data_sessao,TRE,advogados,analise_do_conteudo_juridico,classe_processo,composicao,eleicao,fundamentacao_normativa,numero_processo,origem,partes,pedido_vista,precedentes_citados,punchline,raciocinio_juridico,relator,resoluções_citadas,resultado_final,tema,tipo_registro,votacao,youtube_link
18/12/2025,TRE-RO,,"Apreciação de lista tríplice para provimento de vaga de juiz efetivo (classe jurista) no TRE/RO, com foco na conformidade com regras de paridade de gênero recém-instituídas pela Res.-TSE 23.746/2025. A análise verificou requisitos objetivos dos indicados e a composição de gênero do tribunal de origem para aferir atendimento à política afirmativa. Constatou-se que a lista apresenta duas mulheres e um homem, e que todos os candidatos preenchem os requisitos formais para nomeação.",Lista Tríplice,"Min. Cármen Lúcia, Min. Nunes Marques, Min. André Mendonça, Min. Antônio Carlos Ferreira, Min. Vilas Boas Cueva, Min. Floriano de Azevedo Marques, Min. Estela Aranha",,"Resolução TSE nº 23.746/2025, Resolução TSE nº 23.517",0600180-72,Porto Velho/RO,"José Vítor Costa Júnior, Letícia Botelho, Joilma Gleis Schiavi Gomes",,"TSE, Lista Tríplice nº 0600613 (Rel. Min. Isabel Gallotti), TSE, Lista Tríplice nº 0600265 (Rel. Min. André Mendonça, j. 19/08/2025)",Lista tríplice aprovada: a paridade de gênero foi respeitada.,"Tese vencedora: o Rel. Min. Floriano de Azevedo Marques aplicou a Res.-TSE 23.746/2025, entendendo que a política afirmativa de gênero exige verificação da composição do tribunal de origem e não a exclusão sumária de listas que promovam maior participação feminina. Constatada a presença de duas mulheres entre os três indicados e o atendimento aos requisitos objetivos, concluiu-se pela regularidade da lista e seu encaminhamento ao Presidente da República. Não houve tese divergente no acórdão; o julgamento foi aprovado por unanimidade.",Min. Floriano de Azevedo Marques,"Resolução TSE nº 23.746/2025, Resolução TSE nº 23.517",Aprovada,Lista tríplice e observância da paridade de gênero na indicação de juiz do TRE-RO,Julgamento 1,Unânime,http://www.youtube.com/watch?v=Dg7XT--0ztc&t=1437
18/12/2025,TRE-AP,,"Consulta formulada por parlamentar sobre o impacto de decisões do STF (ADIs sobre sobras eleitorais) na representação de mulheres, negros e indígenas. O núcleo da análise foi a admissibilidade pela via consultiva: competência do TSE para emitir opinião em tese, vedação à resposta sobre casos concretos ou efeitos de decisões já transitadas em julgado, e a exigência de abstração e pertinência para conhecimento da consulta. Parte do pedido buscava dados estatísticos e análise de efeitos retroativos de decisões do STF, o que extrapola o caráter abstrato exigido.",Consulta,"Min. Cármen Lúcia, Min. Nunes Marques, Min. André Mendonça, Min. Antônio Carlos Ferreira, Min. Vilas Boas Cueva, Min. Floriano de Azevedo Marques, Min. Estela Aranha",,"Código Eleitoral (Lei 4.737/1965), art. 23, XII",0600018-89,Macapá/AP,Deputada Federal Silvia Nobre Lopes,,"STF (ADIs 7.228, 7.263, 7.325)",Consulta não conhecida: a via consultiva não decide casos concretos.,"Tese vencedora: o Rel. Min. Antônio Carlos Ferreira concluiu que faltou o requisito da abstração e que a via consultiva do TSE não serve para antecipar pronunciamentos sobre casos concretos nem para modular efeitos de decisões do STF já transitadas. Assim, a consulta foi rejeitada por não atender aos pressupostos de admissibilidade. O julgamento foi proferido por unanimidade, sem divergência registrada.",Min. Antônio Carlos Ferreira,,Não conhecido,Limites da via consultiva do TSE e requisitos de admissibilidade,Julgamento 2,Unânime,http://www.youtube.com/watch?v=Dg7XT--0ztc&t=1815
18/12/2025,TRE-AC,,"Referendo de liminar que suspendeu a cassação de vereadora eleita por suposta fraude à cota de gênero nas eleições de 2024. A questão central foi se, diante de fraude à cota, devem ser preservados os votos atribuídos a candidatas mulheres não envolvidas na fraude ou se deve-se anular integralmente a votação do partido (precedente de 2020). O relator ponderou a plausibilidade de mudança de entendimento do TSE para não sacrificar mandatos legitimamente conferidos a mulheres e o risco de irreversibilidade do afastamento imediato.",Referendo,"Min. Cármen Lúcia, Min. Nunes Marques, Min. André Mendonça, Min. Antônio Carlos Ferreira, Min. Vilas Boas Cueva, Min. Floriano de Azevedo Marques, Min. Estela Aranha",2024,"Lei 9.504/1997 (Lei das Eleições), art. 10, § 3º",0601170-75,Sena Madureira/AC,"Elissandra Matos da Cunha, Ministério Público Eleitoral",Min. Estela Aranha,"TSE, REspe 0600305 (Ceará, Rel. André Ramos Tavares), TSE, Recurso Ordinário 0602977 (julgamento iniciado em 27/11/2025, voto do Min. Antônio Carlos Ferreira)",Liminar preserva mandato: evitar a irreversibilidade até definição final do TSE.,"Tese vencedora (monocrática, por ora): o Rel. Min. André Mendonça concedeu liminar com fundamento na plausibilidade jurídica de que o TSE possa, ao reexaminar a matéria, distinguir ou rever o entendimento de 2020 que determinava anulação total dos votos do partido em caso de fraude à cota. Pesou também o periculum in mora: o afastamento imediato da vereadora seria irreversível se confirmado posteriormente que os votos deveriam ser preservados. Tese divergente/parcial: inexistência de decisão colegiada final — Min. Estela Aranha pediu vista, suspendendo o julgamento colegiado. Conclusão do colegiado: julgamento suspenso por vista; liminar monocrática permanece em vigor. Vencedores/vencidos no plenário: não houve acórdão colegiado definitivo; decisão monocrática do Relator mantém efeitos até o retorno do processo ao plenário.",Min. André Mendonça,,Suspenso por vista,Fraude à cota de gênero e preservação de votos/mandato nas eleições de 2024,Julgamento 3,Suspenso,http://www.youtube.com/watch?v=Dg7XT--0ztc&t=2149
18/12/2025,TRE-SP,Dr. Michel Bertone Soares,"Agravo regimental contra desaprovação de prestação de contas de campanha (Eleições 2022). O debate centrou-se na exigência de contratos individuais para comprovação de gastos com militância/panfletagem prevista na Res.-TSE 23.607/2019 (Art. 35) versus a liberdade dos meios de prova prevista no CPC. O relator entendeu que, no caso concreto, a ausência de contratos individuais e as inconsistências nos valores apresentados impediam a aprovação das contas. A controvérsia também discutiu se a resolução imporia uma 'prova tarifada' - tese contra a qual houve voto divergente.",AgR-REspe,"Min. Cármen Lúcia, Min. Nunes Marques, Min. André Mendonça, Min. Antônio Carlos Ferreira, Min. Vilas Boas Cueva, Min. Floriano de Azevedo Marques, Min. Estela Aranha",2022,"Resolução TSE nº 23.607/2019 (Art. 35), Código de Processo Civil (CPC), Art. 369, Súmula TSE 24, Súmula TSE 30",0605153-64,São Paulo/SP,Eduardo Matarazzo Suplicy,,"TSE, AgR-REspe 0601470; TSE, AgR-REspe 0607354 (Rel. André Ramos Tavares)",Maioria mantém desaprovação: comprovação documental insuficiente não aprova contas.,"Tese vencedora: o Rel. Min. André Mendonça negou provimento ao agravo, fundamentando que as provas apresentadas eram insuficientes e inconsistentes (ausência de contratos individuais, divergências nos valores e dias trabalhados), o que justificou a manutenção da desaprovação das contas. A maioria que acompanhou o Relator foi formada pelos Min. André Mendonça, Min. Antônio Carlos Ferreira (que, embora tenha feito ressalvas teóricas sobre a inexistência de prova tarifada em tese, acompanhou o relator no caso concreto), Min. Vilas Boas Cueva, Min. Estela Aranha e Min. Nunes Marques. Tese divergente: Min. Floriano de Azevedo Marques entendeu que não se pode exigir prova tarifada exclusivamente e que demais elementos (fotos, relatórios, recibos) poderiam ser suficientes para aprovar ou reanalisar as contas; foi vencido. Conclusão colegiada: por maioria, negou-se provimento ao agravo e manteve-se a desaprovação das contas.",Min. André Mendonça,"Resolução TSE nº 23.607/2019, Art. 35, § 2º",Desprovido,Prova tarifada versus liberdade de prova na prestação de contas eleitorais,Julgamento 4,Por maioria,http://www.youtube.com/watch?v=Dg7XT--0ztc&t=2536
18/12/2025,TRE-SP,,Recurso em mandado de segurança interposto por servidor do TRE/SP que pleiteou licença para acompanhar cônjuge no exterior. A controvérsia jurídica residiu na interpretação do conceito de 'deslocamento' previsto na Lei 8.112/1990: se a mudança de domicílio resultou de deslocamento funcional/compulsório do cônjuge ou de opção voluntária do servidor após período de férias. A relatora exigiu prova pré-constituída da voluntariedade alheia à vontade do servidor para reconhecer o direito à licença.,RMS,"Min. Cármen Lúcia, Min. Nunes Marques, Min. André Mendonça, Min. Antônio Carlos Ferreira, Min. Vilas Boas Cueva, Min. Floriano de Azevedo Marques, Min. Estela Aranha",,"Lei 8.112/1990, Art. 84, § 1º",0608272,São Paulo/SP,Hélio Alves de Souza Lima,Min. Antônio Carlos Ferreira,Jurisprudência administrativa sobre a necessidade de deslocamento efetivo e não mera permanência voluntária após viagem,Pedido de licença negado por falta de prova de deslocamento compulsório; julgamento suspenso por vista.,"Tese vencedora (por ora monocrática): a Min. Relatora Estela Aranha entendeu que o direito à licença exige comprovação de deslocamento do cônjuge que justifique a mudança da unidade familiar. No caso, ficou demonstrado que a permanência no exterior decorreu de opção voluntária após férias e ausência de comprovação de deslocamento funcional do cônjuge, além de faltar prova pré-constituída exigida em mandado de segurança. Assim, a relatora votou por negar o pleito. No entanto, o julgamento foi suspenso por pedido de vista do Min. Antônio Carlos Ferreira, de modo que não há decisão colegiada definitiva. Pedido de vista: Min. Antônio Carlos Ferreira.",Min. Estela Aranha,,Suspenso por vista,Licença para servidor por acompanhamento de cônjuge e alcance do conceito de deslocamento,Julgamento 5,Suspenso,http://www.youtube.com/watch?v=Dg7XT--0ztc&t=3667
