data_sessao,TRE,advogados,analise_do_conteudo_juridico,classe_processo,composicao,eleicao,fundamentacao_normativa,numero_processo,origem,partes,pedido_vista,precedentes_citados,punchline,raciocinio_juridico,relator,resoluções_citadas,resultado_final,tema,tipo_registro,votacao,youtube_link
25/06/2024,TRE-RN,"Dr. Marcelo Rocha Lopes, Dra. Fernanda Tavares Barreto, Dr. Murilo Muniz de Faria Neto","Trata-se do preenchimento de vaga para o cargo de Juiz Efetivo do TRE-RN, na classe de juristas (advogados), em decorrência do término do biênio do Dr. Fernando de Araújo Jales Costa. A escolha se dá mediante encaminhamento de lista tríplice composta pelos indicados pelo Tribunal Regional para nomeação pelo Presidente da República.",,"Min. Cármen Lúcia, Min. Kassio Nunes Marques, Min. André Mendonça, Min. Raúl Araújo, Min. Isabel Gallotti, Min. Floriano de Azevedo Marques, Min. André Ramos Tavares, Min. Vera Lúcia, Min. Edilene Lôbo",,"A assessoria consultiva do TSE verificou o preenchimento dos requisitos legais e constitucionais para a indicação. Foi mencionada a publicação de edital, sem que houvesse impugnações aos nomes.",0600206,Natal/RN,"Tribunal Regional Eleitoral do Rio Grande do Norte (TRE-RN), Marcelo Rocha Lopes, Fernanda Tavares Barreto, Murilo Muniz de Faria Neto, Dr. Fernando de Araújo Jales Costa",,,Lista tríplice aprovada por unanimidade para preencher vaga de juiz do TRE-RN.,"Tese vencedora: o relator concluiu que os indicados atendem aos requisitos legais (idoneidade moral e notável saber jurídico) para compor a Corte Regional, fundamentando-se na verificação da assessoria consultiva e na regularidade do edital de indicação. Não houve apresentação de tese divergente nem impugnações registradas. Conclusão do colegiado: o Plenário acompanhou integralmente o voto do relator por unanimidade, determinando o encaminhamento da lista tríplice à Presidência da República para escolha e nomeação. Ministros vencedores: Min. Cármen Lúcia, Min. Kassio Nunes Marques, Min. André Mendonça, Min. Raúl Araújo, Min. Isabel Gallotti, Min. Floriano de Azevedo Marques, Min. André Ramos Tavares, Min. Vera Lúcia, Min. Edilene Lôbo. Ministros vencidos: nenhum (decisão unânime).",Min. Floriano de Azevedo Marques,,Aprovada,JULGAMENTO: LISTA TRÍPLICE Nº 0600206 (SESSÃO ADMINISTRATIVA),Julgamento 1,Unânime,http://www.youtube.com/watch?v=Ice8cDCXoY0&t=676
25/06/2024,TRE-PA,Dra. Ana Paula Trento,"Recurso ordinário em habeas corpus contra acórdão do TRE-PA que denegou o pedido e manteve a prisão preventiva do paciente. O caso envolve acusações de violência política de gênero, perseguição (stalking), violência psicológica contra a mulher, extorsão e crimes contra a honra (injúria e difamação). Consta nos autos a utilização reiterada de redes sociais para ofensas, divulgação do número de telefone pessoal da vítima para fomentar assédio coletivo, criação de perfis falsos/satíricos destinados a ridicularizar a vítima (referido como ""Cadela Ninfodemos"") e exigência de pagamento de R$ 80.000,00 sob a alegada proposta de paz. O TRE-PA havia, em primeiro momento, substituído a prisão por medidas cautelares, mas registrou-se continuidade das agressões pela internet, criação de novos perfis e descumprimento de ordens judiciais, o que fundamentou a manutenção da preventiva.",RO,"Min. Cármen Lúcia, Min. Kassio Nunes Marques, Min. André Mendonça, Min. Raúl Araújo, Min. Isabel Gallotti, Min. Floriano de Azevedo Marques, Min. André Ramos Tavares, Min. Vera Lúcia, Min. Edilene Lôbo",2022,"Código Eleitoral: Art. 326-B, Art. 327; Código Penal: Art. 147-A, Art. 147-B, Art. 140, Art. 139 c/c Art. 141, Art. 158, Art. 359-P; Código de Processo Penal: Art. 312, Art. 319",0600091-08,Belém/PA,"Recorrente/Paciente: Vladimir Afonso da Costa Rabelo, Vítima: Renilce Conceição Nicodemos de Albuquerque (Deputada Federal eleita em 2022)",Min. Rosa Weber sobre a superação de excesso de prazo após o recebimento da denúncia 42:40http://www,"STF: Precedente da Min. Rosa Weber sobre superação de excesso de prazo após o recebimento da denúncia, STJ: Jurisprudência sobre condições pessoais favoráveis não impedirem a preventiva se presentes os requisitos do art. 312 CPP",Prisão preventiva mantida para cessar violência política reiterada contra mandatária eleita.,"Tese vencedora: manutenção da prisão preventiva com fundamento na garantia da ordem pública diante da reiteração delitiva, contumácia e ineficácia de medidas menos gravosas. Argumentos centrais: comportamento persistente do paciente nas redes sociais (novos perfis e gravações desafiando decisões judiciais), gravidade dos fatos em contexto de violência política contra mulher eleita, tentativa de coação mediante extorsão e risco de reiteração. A relatora, Min. Isabel Gallotti, sustentou que as medidas cautelares anteriormente adotadas revelaram-se insuficientes para estancar a prática criminosa, justificando a manutenção da preventiva com base no art. 312 do CPP. Tese divergente: não houve divergência registrada no acórdão relatado; eventual argumento atenuante citado (condições pessoais favoráveis) foi afastado à luz da jurisprudência do STJ quando presentes os elementos do art. 312. Conclusão do colegiado: desprovimento do recurso, manutenção da prisão preventiva. Votação: unânime. Ministros vencedores: Min. Cármen Lúcia, Min. Kassio Nunes Marques, Min. André Mendonça, Min. Raúl Araújo, Min. Isabel Gallotti, Min. Floriano de Azevedo Marques, Min. André Ramos Tavares, Min. Vera Lúcia, Min. Edilene Lôbo. Ministros vencidos: nenhum (unanimidade).",Min. Isabel Gallotti,,Desprovido,JULGAMENTO: RECURSO ORDINÁRIO EM HABEAS CORPUS Nº 0600091-08,Julgamento 2,Unânime,http://www.youtube.com/watch?v=Ice8cDCXoY0&t=961
25/06/2024,TRE-PA,,"Desaprovação de contas de campanha por ausência de abertura de conta bancária específica para a rubrica 'Outros Recursos', o que impossibilita a fiscalização pela Justiça Eleitoral. O exame concentrou-se na gravidade da irregularidade (considerada insanável mesmo sem movimentação financeira) e nas consequências processuais pela apresentação, na peça recursal, de citações e números de processos inexistentes, caracterizando possível deslealdade processual.",AgR-REspe,"Min. Cármen Lúcia, Min. Kassio Nunes Marques, Min. André Mendonça, Min. Raúl Araújo, Min. Isabel Gallotti, Min. Floriano de Azevedo Marques, Min. André Ramos Tavares, Min. Vera Lúcia, Min. Edilene Lôbo",2022,"Resolução-TSE nº 23.607/2017: Art. 74, inciso III, Código de Processo Civil (CPC): Art. 5º (dever de boa-fé processual), Art. 77, incisos I e II, Arts. 79 a 81 (litigância de má-fé), Súmula TSE nº 26, Súmula TSE nº 72, Súmula TSE nº 30",0601859-37,Belém/PA,João Bosco Oliveira de Almeida,Min. Maria Teresa de Assis Moura sobre punição disciplinar no âmbito do estatuto da advocacia por deslealdade processual 56:56http://www,STJ: Precedente da Min. Maria Teresa de Assis Moura sobre punição disciplinar no âmbito do estatuto da advocacia por deslealdade processual,Ausência de conta bancária: falha insanável e conduta processual suspeita.,"Tese vencedora: a não abertura de conta bancária específica para 'Outros Recursos' configura falha grave e insanável que legitima a desaprovação das contas e o desprovimento do agravo. O relator enfatizou que a irregularidade impede a fiscalização e que tal omissão não se saneia pela ausência de movimentação financeira. Foi também considerada a conduta processual da defesa, que teria apresentado dados e citações espúrios, o que autorizou a remessa de ofício à OAB e ao Ministério Público Eleitoral para apuração disciplinar. Tese divergente: não registrada expressamente nos autos examinados. Conclusão do colegiado: desprovimento do agravo e manutenção da desaprovação das contas; expedição de ofício à OAB e ao MP Eleitoral para apurar a conduta da advogada. Não há indicação de ministros vencidos ou de votação registrada no trecho analisado.",Min. Raúl Araújo,"Resolução-TSE nº 23.607/2017, Art. 74, inciso III",Desprovido,Desaprovação de contas por ausência de conta bancária para 'Outros Recursos',Julgamento 3,,http://www.youtube.com/watch?v=Ice8cDCXoY0&t=3148
25/06/2024,TRE-AL,,"Recurso referente a propaganda eleitoral irregular. Tema central: intempestividade reflexa do recurso eleitoral original, por contagem de prazo entre a publicação da decisão de procedência (16/12/2022) e a interposição do recurso (19/12/2022), com discussão sobre suspensão/interrupção de prazos processuais e consequência na admissibilidade do Recurso Especial. Mantida a multa aplicada por descumprimento de decisão liminar.",AgRg-REspe,"Min. Cármen Lúcia, Min. Kassio Nunes Marques, Min. André Mendonça, Min. Raúl Araújo, Min. Isabel Gallotti, Min. Floriano de Azevedo Marques, Min. André Ramos Tavares, Min. Vera Lúcia, Min. Edilene Lôbo",2022,"Resolução-TSE nº 23.608: Art. 25 (prazo de 24 horas para recurso em representação), Resolução-TSE nº 23.608: Art. 7º (regras de suspensão/interrupção de prazos)",0600929-52,Maceió/AL,"Coligação Alagoas Merece Mais, Rodrigo Santos Cunha, Josilene Soares Pereira de Melo Feitosa, Coligação Alagoas Daqui para Melhor",,,Intempestividade reflexa inviabiliza recurso e mantém a multa.,"Tese vencedora: O tribunal considerou que o recurso eleitoral original foi interposto fora do prazo (decisão publicada em 16/12/2022; recurso interposto em 19/12/2022) e que a alegada suspensão/interrupção dos prazos não se aplicou retroativamente a gerar tempestividade. Consequência: a intempestividade do recurso originário contaminou a admissibilidade do Recurso Especial (intempestividade reflexa), impedindo seu processamento. Não há registro de tese divergente ou de ministros vencidos no relatório. Como efeito prático, foi mantida a multa de R$ 20.000,00 aplicada por descumprimento de decisão liminar em propaganda irregular.",Min. Floriano de Azevedo Marques,"Resolução-TSE nº 23.608: Art. 25, Resolução-TSE nº 23.608: Art. 7º",Desprovido,Agravamento regimental no Recurso Especial nº 0600929-52 (propaganda eleitoral irregular),Julgamento 4,,http://www.youtube.com/watch?v=Ice8cDCXoY0&t=3626
25/06/2024,TRE-RR,,"Trata-se de agravo regimental interposto no agravo em recurso especial relativo a fatos ocorridos na campanha eleitoral de 2014, envolvendo crimes de corrupção eleitoral (compra de votos) e associação criminosa. Os agravantes foram condenados por práticas eleitorais ilícitas, e o recurso discute, entre outros pontos, a possibilidade de celebração de Acordo de Não Persecução Penal (ANPP) e o correto enquadramento tipológico (associação criminosa versus concurso de pessoas). O processo originou-se em Boa Vista/RR e teve condenação criminal mantida pelo TRE, sendo objeto da presente impugnação junto ao TSE.",AgRg-REspe,"Min. Cármen Lúcia, Min. Kassio Nunes Marques, Min. André Mendonça, Min. Raúl Araújo, Min. Isabel Gallotti, Min. Floriano de Azevedo Marques, Min. André Ramos Tavares, Min. Vera Lúcia, Min. Edilene Lôbo",2014,"Código Eleitoral: Art. 229 (Corrupção eleitoral), Código Penal: Art. 288 (Associação criminosa), Lei nº 13.964/2019 (Pacote Anticrime) — dispositivos sobre Acordo de Não Persecução Penal (ANPP), Súmula TSE nº 24 (impedimento de reexame de fatos e provas em sede especial), Súmula TSE nº 26 (falta de impugnação específica), Súmula TSE nº 72 (falta de prequestionamento)",0600039-02,Boa Vista/RR,"Jileno Gomes Passos e outros, Vitor Marcelo Moreira Ferreira, Ministério Público Eleitoral",Min. Floriano de Azevedo Marques,HC 185.913 (STF),Condenação mantida: ANPP não cabível após recebimento da denúncia e decisão colegiada.,"Tese vencedora: O relator concluiu que o ANPP não é aplicável no caso concreto porque, no entendimento do TSE, o acordo só pode ser celebrado se a denúncia não tiver sido recebida. Aqui, havia condenação mantida pelo TRE, de modo que não há direito subjetivo ao ANPP; assim, o pedido da defesa foi rejeitado. Quanto à tipicidade, a defesa buscou requalificar a associação criminosa como mero concurso de pessoas; o relator rejeitou a reclassificação por exigir revolvimento de matéria fática e probatória, vedado em sede especial pela Súmula TSE nº 24. Conclusão do colegiado: manutenção da condenação criminal dos agravantes e rejeição do agravo regimental. Tese divergente: não registrada no relatório (não há indicação de voto vencido ou fundamento contrário exposto). Ministros vencedores/vencidos: não há registro expresso de votação nominal no relatório fornecido; o resultado informado foi a rejeição do agravo regimental, sem detalhamento de votos individuais.",Min. Floriano de Azevedo Marques,,Rejeitada,Agravamento: Agravo Regimental no Agravo em Recurso Especial nº 0600039-02 — Corrupção eleitoral e associação criminosa,Julgamento 5,,http://www.youtube.com/watch?v=Ice8cDCXoY0&t=3876
