siglaTribunalJE,origemDecisao,numeroProcesso,numeroUnico,numeroProtocolo,numeroDecisao,dataDecisao,anoEleicao,siglaClasse,descricaoClasse,siglaUF,nomeMunicipio,naturezaDocumento,siglaTipoProcesso,nomeTipoProcesso,descricaoTipoDecisao,assuntos,partes,publicacoes,referenciasLegislativas,relatores,textoDecisao,textoEmenta
"TSE","PJE","060049951","06004995120246250013","0","","26/03/2026","2024","REspEl","RECURSO ESPECIAL ELEITORAL","SE","RIACHUELO","Sem anotação","AgR-REspEl","Agravo Regimental no Recurso Especial Eleitoral","Acórdão","Matéria processual, Contas de campanha","CARMEM LUCIA ALVES DA COSTA, PETERSON DANTAS ARAUJO","DJE","","Relator(a) Min. Nunes Marques","  O Tribunal, por unanimidade, negou provimento ao agravo interno, nos termos do voto do Relator. Acompanharam o Relator os Ministros André Mendonça, Antonio Carlos Ferreira, Ricardo Villas Bôas Cueva, Floriano de Azevedo Marques, Estela Aranha e Cármen Lúcia (Presidente). Composição: Ministros (as) Cármen Lúcia (Presidente), Nunes Marques, André Mendonça, Antonio Carlos Ferreira, Ricardo Villas Bôas Cueva, Floriano de Azevedo Marques e Estela Aranha.  ","ELEIÇÕES 2024. PRESTAÇÃO DE CONTAS. PREFEITO E VICE–PREFEITO. DESAPROVAÇÃO. EXTRAPOLADO O LIMITE DE AUTOFINANCIAMENTO. PRINCÍPIOS DA PROPORCIONALIDADE E DA RAZOABILIDADE. INAPLICABILIDADE. MULTA. ACÓRDÃO REGIONAL CONFORME A JURISPRUDÊNCIA DO TSE. INCIDÊNCIA DOS ENUNCIADOS N. 24, 28, 29 E 30 DA SÚMULA DO TSE. AGRAVO INTERNO DESPROVIDO. I. Caso em exame 1. Agravo interno interposto contra decisão por meio da qual foi negado provimento ao agravo em recurso especial eleitoral com base nos enunciados n. 24, 28, 29 e 30 da Súmula do TSE. 2. Na origem, o Tribunal Regional Eleitoral de Sergipe (TRE/SE) manteve a sentença que julgou desaprovadas as contas de campanha dos agravantes e aplicou–lhes multa em razão da extrapolação do limite de autofinanciamento. 3. No presente recurso, os agravantes reiteram as teses de que não houve a extrapolação do limite de autofinanciamento e de que a irregularidade apontada seria de baixa gravidade, autorizando a aprovação das contas com ressalvas. II. Questão em discussão 4. Saber se incidem no caso em análise os enunciados n. 24, 28, 29 e 30 da Súmula do TSE. III. Razões de decidir 5. A extrapolação do limite de autofinanciamento estabelecido no art. 23, § 2º–A, da Lei n. 9.504/1997 configura irregularidade apta a ensejar a desaprovação das contas e autoriza a imposição da multa. 6. O TRE/SE constatou que a irregularidade totalizou R$ 9.491,92 (nove mil quatrocentos e noventa e um reais e noventa e dois centavos), o que equivale a 15,94% do limite permitido de recursos próprios na campanha eleitoral para os cargos de prefeito e vice–prefeito de Riachuelo/SE nas Eleições 2024. 7. Para serem acolhidas as teses defensivas – de que não houve extrapolação do limite de autofinanciamento de campanha e de que a irregularidade atingiu 6% do teto de gastos da campanha –, seria indispensável o reexame de fatos e provas produzidos nos autos, incidindo, na espécie, o óbice do enunciado n. 24 da Súmula do TSE. 8. A jurisprudência desta Corte Superior firmou o entendimento de que a extrapolação do limite de gastos com autofinanciamento de campanha é situação grave e enseja a desaprovação das contas, pois afronta o princípio da igualdade de condições na disputa eleitoral. Precedentes. Incidência do enunciado n. 30 da Súmula do TSE. 9. O dissídio jurisprudencial não foi comprovado, seja em razão da ausência de indispensável cotejo entre o acórdão recorrido e o paradigma, seja em virtude da impossibilidade de se aferirem, em sede de instância especial, fatos e provas, conforme o dissenso passaria a exigir, atraindo o óbice do enunciado n. 28 da Súmula do TSE. 10. A divergência entre julgados do mesmo tribunal não se presta a configurar dissídio jurisprudencial apto a fundamentar recurso especial eleitoral, conforme enunciado n. 29 da Súmula do TSE. IV. Dispositivo e tese 11. Agravo interno a que se nega provimento. Tese de julgamento: A extrapolação do limite de gastos com autofinanciamento de campanha é situação grave e enseja a desaprovação das contas, pois afronta o princípio da igualdade de condições na disputa eleitoral. Legislação relevante citada: Lei n. 9.504/1997, art. 23, §§ 2º–A e 3º. Resolução n. 23.607/2019/TSE, arts. 27, §§ 1º a 4º, e 74, III. Jurisprudência relevante citada: TSE, AgR–REspEl n. 0600315–50.2024.6.25.0028/SE, ministro André Mendonça, DJe de 1º de julho de 2025. TSE, AgR–AREspE n. 0600813–87.2020.6.13.0298/MG, ministro Floriano de Azevedo Marques, DJe de 16 de outubro de 2023. TSE, AgR–AREspEl n. 0600461–72.2020.6.25.0015/SE, ministro Alexandre de Moraes, DJe de 26 de abril de 2022. TSE, REspEl n. 0601306–61.2018.6.20.0000/RN, ministro Mauro Campbell Marques, DJe de 23 de novembro de 2020. TSE, AREspE n. 0600739–15.2020.6.03.0006/AP, ministro Mauro Campbell Marques, DJe de 20 de setembro de 2022. TSE, AgR–AREspE n. 0600306–17.2020.6.06.0074/CE, ministro Sérgio Silveira Banhos, DJe de 6 de maio de 2022."
"TSE","PJE","060037595","06003759520246160085","0","","26/03/2026","2024","AREspEl","Agravo em Recurso Especial Eleitoral ","PR","PORTO RICO","Sem anotação","AgR-AREspEl","Agravo Regimental no Agravo em Recurso Especial Eleitoral","Acórdão","Contas de campanha","BENEDITO JOSE MARIA","DJE","","Relator(a) Min. Nunes Marques","  O Tribunal, por unanimidade, negou provimento ao agravo interno, nos termos do voto do Relator. Acompanharam o Relator os Ministros André Mendonça, Antonio Carlos Ferreira, Villas Bôas Cueva, Floriano de Azevedo Marques, Estela Aranha e Cármen Lúcia (Presidente). Composição: Ministros (as) Cármen Lúcia (Presidente), Nunes Marques, André Mendonça, Antonio Carlos Ferreira, Villas Bôas Cueva, Floriano de Azevedo Marques e Estela Aranha.  ","ELEIÇÕES 2024. AGRAVO INTERNO NO AGRAVO EM RECURSO ESPECIAL. PRESTAÇÃO DE CONTAS. VEREADOR. UTILIZAÇÃO INDEVIDA DE RECURSOS DO FUNDO ESPECIAL DE FINANCIAMENTO DE CAMPANHA (FEFC). RECEBIMENTO DE DOAÇÃO POR CANDIDATO DE PARTIDO NÃO COLIGADO. ADI N. 7.214/DF. DESAPROVAÇÃO NA ORIGEM COM DETERMINAÇÃO DE RECOLHIMENTO AO ERÁRIO. AUSÊNCIA DE IMPUGNAÇÃO ESPECÍFICA DE FUNDAMENTO SUFICIENTE PARA MANTER A DECISÃO QUE INADMITIU O RECURSO ESPECIAL.INCIDÊNCIA DO ENUNCIADO N. 26 DA SÚMULA DO TSE. MATÉRIA DE FUNDO. INCIDÊNCIA DOS ÓBICES DOS VERBETES N. 24 E 30 DA SÚMULA DO TSE. AGRAVO INTERNO A QUE SE NEGA PROVIMENTO.     I. Caso em exame     1. Agravo interno interposto contra decisão pela qual não conhecido agravo em recurso especial eleitoral, em virtude da incidência dos enunciados n. 26 e 27 da Súmula do TSE.     2. Na decisão recorrida, assentei que o agravante não se desincumbiu do ônus de impugnar especificamente o fundamento em que alicerçada a inadmissão do apelo especial quanto à incidência do enunciado n. 27 da Súmula do TSE, além de que utilizou em suas razões de argumento dissociado de fundamento que embasou a decisão de admissibilidade.     3. No presente recurso, o agravante aduz ter impugnado adequadamente a decisão de inadmissão do recurso especial, destacando não pretender o revolvimento do conjunto fático–probatório, e defende que o acórdão regional violou os arts. 28, § 6º, II e 38, da lei n. 9.504/1997 e art. 17 da Resolução n. 23.607/2019/TSE.     II. Questão em discussão     4. A controvérsia consiste em verificar se é possível a superação do óbice do verbete n. 26 da Súmula do TSE que fundamentou a decisão agravada, a fim de se adentrar a análise do mérito e afastar a desaprovação das contas na espécie.     III. Razões de decidir     5. À luz do princípio da dialeticidade, é inviável o conhecimento de recurso que deixe de apresentar argumentos suficientes para infirmar todos os fundamentos da decisão recorrida, nos termos do verbete n. 26 da Súmula deste Tribunal, a revelar a necessidade de manutenção do pronunciamento ora combatido. Precedentes do TSE.     6. Ainda que superado o óbice, o TRE/PR concluiu pelo acerto da decisão do Juízo Eleitoral a quo quanto à desaprovação das contas na espécie, tendo em vista o percentual e o valor expressivos da irregularidade, consubstanciada no repasse de recursos do Fundo Partidário e do Fundo Especial de Financiamento de Campanha (FEFC) entre candidatos a cargos majoritários e proporcionais de partidos diversos.     7. O Supremo Tribunal Federal, no julgamento da ADI n. 7.214/DF, assentou a impossibilidade do repasse de recursos do Fundo Partidário e do Fundo Especial de Financiamento de Campanha (FEFC) entre candidatos a cargos majoritários e proporcionais numa mesma circunscrição, ainda que as legendas sejam coligadas no pleito majoritário, tendo em vista a impossibilidade de celebração de coligação nas eleições proporcionais, a teor do art. 17, § 1º, da Constituição Federal.     8. A argumentação do agravante não altera o entendimento já consolidado nesta Corte que considera que a transferência de verbas públicas entre candidatos aos cargos majoritários e proporcionais de partidos distintos, ainda que coligados na eleição majoritária, é irregular. Incidência, na espécie, do enunciado n. 30 do TSE.     8. A jurisprudência do TSE firmou a compreensão de que é incabível a incidência dos princípios da razoabilidade e da proporcionalidade para aprovar com ressalvas as contas quando (a) os valores considerados irregulares ultrapassarem o valor nominal de 1.000 Ufirs (R$ 1.064,00); (b) as irregularidades, percentualmente, superarem 10% do total; e (c) as falhas detectadas forem graves, como ocorreu na hipótese.     9. As razões do agravo interno são inaptas para desconstituir os fundamentos da decisão agravada, que, por isso, mantêm–se hígidos.     IV. Dispositivo e tese     10. Agravo interno desprovido.        ________________________Tese de julgamento:    1. É inviável agravo interno que deixa de atacar especificamente os fundamentos da decisão agravada (verbete n. 26 da Súmula do TSE).     2. Não se conhece de recurso especial eleitoral quando a decisão recorrida estiver em conformidade com a jurisprudência do Tribunal Superior Eleitoral, nos termos do enunciado n. 30 da Súmula do TSE.     Legislação relevante citada:       Lei n. 9.504/1997, art. 57–C § 3º     Jurisprudência relevante citada:       TSE, PetCiv n. 0608573–77.2022.6.26.0000/SP, ministro Raul Araújo Filho, DJe de 24 de março de 2023        STF, ADI/DF n. 7.214/DF, ministro Ricardo Lewandowski, DJe de 5 de outubro de 2022        TSE, AgR–REspEl n. 0601797–62.2022.6.08.0000/ES, ministro André Ramos Tavares, DJe de 8 maio de 2024        TSE, AgR–AREspE n. 0600182–57.2024.6.08.0003/ES, ministro André Mendonça, DJe de 08 de agosto de 2025        TSE, AgR–AREspE n. 0600739–15.2020.6.03.0006/AP, ministro Mauro Campbell Marques, DJe de 20 de setembro de 2022        TSE, AREspE n. 0600306–17.2020.6.06.0074/CE, ministro Sérgio Silveira Banhos, DJe de 6 de maio de 2022.    "
"TSE","PJE","060057965","06005796520246130169","0","","26/03/2026","2024","AREspEl","Agravo em Recurso Especial Eleitoral ","MG","MANTENA","Sem anotação","AgR-AREspEl","Agravo Regimental no Agravo em Recurso Especial Eleitoral","Acórdão","Propaganda eleitoral irregular, Matéria processual","MAICON DOUGLAS DA ROCHA LOPES, Ministério Público Eleitoral","DJE","LEG.: Federal RESOLUÇÃO  DO TRIBUNAL SUPERIOR ELEITORAL Nº.: 23608 Ano: 2019, LEG.: Federal LEI ORDINÁRIA Nº.: 9504 Ano: 1997 (LEL - Lei Eleitoral - Normas para as Eleições)","Relator(a) Min. Nunes Marques","  O Tribunal, por unanimidade, negou provimento ao agravo interno, nos termos do voto do Relator. Acompanharam o Relator os Ministros André Mendonça, Antonio Carlos Ferreira, Ricardo Villas Bôas Cueva, Floriano de Azevedo Marques, Estela Aranha e Cármen Lúcia (Presidente). Composição: Ministros (as) Cármen Lúcia (Presidente), Nunes Marques, André Mendonça, Antonio Carlos Ferreira, Ricardo Villas Bôas Cueva, Floriano de Azevedo Marques e Estela Aranha.  ","ELEIÇÕES 2024. AGRAVO INTERNO NO AGRAVO EM RECURSO ESPECIAL. REPRESENTAÇÃO. PROPAGANDA ELEITORAL IRREGULAR. VEREADOR. ALEGADA VIOLAÇÃO AO ART. 5º, II E LV, DA CONSTITUIÇÃO FEDERAL, AOS ARTS. 373, I, § 1º, E 374, I, DO CÓDIGO DE PROCESSO CIVIL E AOS PRINCÍPIOS DO COTRADITÓRIO E DA AMPLA DEFESA. MATÉRIAS NÃO PREQUESTIONADAS. VERBETE N. 72 DA SÚMULA DESTE TRIBUNAL SUPERIOR. AUSÊNCIA DE COMUNICAÇÃO DOS ENDEREÇOS ELETRÔNICOS À JUSTIÇA ELEITORAL. HARMONIA DO ACÓRDÃO RECORRIDO COM A JURISPRUDÊNCIA DO TSE. ENUNCIADO N. 30 DA SÚMULA DO TSE. DECISÃO AGRAVADA MANTIDA POR SEUS PRÓPRIOS FUNDAMENTOS. AGRAVO INTERNO DESPROVIDO. I. Caso em exame 1. Agravo interno interposto contra decisão por meio da qual mantida a procedência da representação por propaganda irregular, consubstanciada na veiculação de propaganda na internet sem comunicação prévia à Justiça Eleitoral dos respectivos endereços eletrônicos, em descumprimento ao disposto no art. 57–B, § 1º, da Lei n. 9.504/1997. 2. Na origem, a Corte regional assentou ser incontroverso que: (i) o candidato não comunicou previamente à Justiça Eleitoral o endereço eletrônico da rede social na qual foram divulgadas propagandas de campanha; e (ii) as publicações foram realizadas no perfil da rede social do próprio candidato, comprovando o seu prévio conhecimento. 3. No presente recurso, o agravante reitera a violação ao art. 275 do Código Eleitoral e ao art. 1.022, I e II, do Código de Processo Civil (CPC), defende a inaplicabilidade dos enunciados n. 30 e 72 da Súmula do TSE e aduz que: (i) a omissão teria sido sanada tempestivamente, sem prejuízo à lisura do pleito; e (ii) a representação não foi instruída com as provas exigidas pela norma de regência. II. Questão em discussão 4. A controvérsia consiste em verificar se: (i) o acórdão regional incorreu em omissão na análise dos embargos de declaração; (ii) há prequestionamento das teses para fins de admissibilidade do recurso especial; (iii) o candidato pode ser responsabilizado pela ausência de comunicação prévia à Justiça Eleitoral e se essa irregularidade é suficiente para ensejar a imposição de multa, ainda que sanada posteriormente; e (iv) o fato de a propaganda ter sido publicada nas redes sociais do candidato agravante é suficiente para vincular a ele a autoria da propaganda. III. Razões de decidir 5. Os embargos de declaração não podem ser acolhidos apenas com o objetivo de prequestionamento, sendo necessária a existência de vício de omissão, contradição ou obscuridade, nos termos do art. 1.022 do CPC e do art. 275 do Código Eleitoral, o que não ocorreu na hipótese. 6. O acórdão regional enfrentou de forma suficiente e fundamentada as alegações de ilegitimidade passiva e de regularização espontânea, não havendo vício a ser sanado. 7. Segundo a jurisprudência consolidada desta Corte Superior, os embargos declaratórios têm por finalidade sanar obscuridade, contradição, omissão ou erro material, não se prestando a novo exame da questão de fundo em via processual inadequada. Precedentes. 8. A decisão agravada foi proferida com base na constatação da ausência de comunicação prévia à Justiça Eleitoral dos perfis utilizados para a divulgação de propaganda eleitoral, em afronta ao art. 57–B, § 1º, da Lei das Eleições. 9. O Regional consignou que o candidato veiculou propaganda eleitoral em seu favor nas respectivas redes sociais, razão pela qual a autoria e o prévio conhecimento seriam presumidos, por serem essas publicações de responsabilidade única e exclusiva do candidato. 10. A jurisprudência desta Corte Superior estabelece ser despicienda a comprovação do prévio conhecimento da irregularidade para efeito de incidência da multa prevista no § 5º do art. 57–B da Lei das Eleições, quando o agravante é, concomitantemente, o responsável e o beneficiário da propaganda eleitoral irregular, uma vez que a ciência prévia, neste caso, é presumida. Precedente. 11. Segundo o TSE, são de responsabilidade do candidato e da candidata as publicações realizadas nas respectivas redes sociais, bem como a informação prévia dessas redes à Justiça Eleitoral, sendo que a comunicação dos endereços preexistentes deverá ocorrer impreterivelmente no Requerimento de Registro de Candidatura (RRC) ou no Demonstrativo de Regularidade de Atos Partidários (DRAP), sob pena de multa. Incidência do verbete n. 30 da Súmula do TSE. IV. Dispositivo e tese 12. Agravo interno a que se nega provimento. __________________ Tese de julgamento: 1. O prequestionamento reclama o efetivo debate da matéria versada no preceito tido por violado pelo Regional e a emissão de juízo explícito a respeito da questão no acórdão recorrido, sob pena de incidência do verbete n. 72 da Súmula do TSE. 2. Para se acolherem os embargos de declaração, ainda que para fins de prequestionamento, é necessária a ocorrência, no acórdão impugnado, de quaisquer dos vícios dispostos nos arts. 275 do Código Eleitoral e no art. 1.022 do Código de Processo Civil. 3. A ausência de comunicação prévia à Justiça Eleitoral dos endereços eletrônicos utilizados para veiculação de propaganda eleitoral na internet configura descumprimento ao art. 57–B, § 1º, da Lei n. 9.504/1997, ainda que regularizada posteriormente. 4. A titularidade da conta na rede social utilizada para a veiculação de propaganda gera presunção lógica e objetiva do prévio conhecimento do candidato. 5. Incumbe ao candidato e à candidata a responsabilidade pelas publicações realizadas nas respectivas redes sociais, bem como a informação prévia dessas redes à Justiça Eleitoral. 6. A imposição de multa é devida pelo simples descumprimento da norma legal, independentemente da existência de prejuízo à lisura do pleito. Legislação relevante citada: Lei n. 9.504/1997, art. 57–B, §§ 1º e 5º. Resolução n. 23.608/2019/TSE, art. 17, § 2º.    Jurisprudência relevante citada:  TSE, ED–AgR–AREspE n. 0602597–63.2022.6.09.0000/GO, ministro André Mendonça, DJe de 3 de dezembro de 2024. TSE, AgR–AREspE n. 0600807–31.2020.6.16.0061/PR, ministro Carlos Horbach, DJe de 17 de junho de 2021. TSE, AREspE n. 0600583–05.2024.6.13.0169/MG, ministro Antonio Carlos Ferreira, DJe de 10 de outubro de 2025. TSE, AgR–AREspE n. 0600133–58.2024.6.26.0409/SP, ministro André Ramos Tavares, DJe de 22 de maio de 2025. TSE, AgR–AREspE n. 0600283–72.2020.6.06.0009/CE, ministro Raul Araújo Filho, DJe de 15 de dezembro de 2023.    "
"TSE","PJE","060058912","06005891220246130169","0","","26/03/2026","2024","AREspEl","Agravo em Recurso Especial Eleitoral ","MG","MANTENA","Sem anotação","AgR-AREspEl","Agravo Regimental no Agravo em Recurso Especial Eleitoral","Acórdão","Matéria processual, Propaganda eleitoral irregular","FERNANDO TEIXEIRA DE PAULA, Ministério Público Eleitoral","DJE","LEG.: Federal LEI ORDINÁRIA Nº.: 9504 Ano: 1997 (LEL - Lei Eleitoral - Normas para as Eleições), LEG.: Federal RESOLUÇÃO  DO TRIBUNAL SUPERIOR ELEITORAL Nº.: 23609 Ano: 2019, LEG.: Federal RESOLUÇÃO  DO TRIBUNAL SUPERIOR ELEITORAL Nº.: 23610 Ano: 2019 (RESTSE23610 - Dispõe sobre propaganda eleitoral, utilização e geração do horário gratuito e condutas ilícitas em campanha eleitoral.)","Relator(a) Min. Nunes Marques","  O Tribunal, por unanimidade, negou provimento ao agravo interno, nos termos do voto do Relator. Acompanharam o Relator os Ministros André Mendonça, Antonio Carlos Ferreira, Ricardo Villas Bôas Cueva, Floriano de Azevedo Marques, Estela Aranha e Cármen Lúcia (Presidente). Composição: Ministros (as) Cármen Lúcia (Presidente), Nunes Marques, André Mendonça, Antonio Carlos Ferreira, Ricardo Villas Bôas Cueva, Floriano de Azevedo Marques e Estela Aranha.  ","ELEIÇÕES 2024. AGRAVO INTERNO NO AGRAVO EM RECURSO ESPECIAL ELEITORAL. REPRESENTAÇÃO. PROPAGANDA ELEITORAL IRREGULAR NA INTERNET. VEREADOR. FALTA DE COMUNICAÇÃO PRÉVIA DOS ENDEREÇOS ELETRÔNICOS À JUSTIÇA ELEITORAL. MULTA. INCIDÊNCIA. § 5º DO ART. 57–B DA LEI N. 9.504/1997. ACÓRDÃO REGIONAL EM CONSONÂNCIA COM A JURISPRUDÊNCIA DESTA CORTE SUPERIOR. INCIDÊNCIA DO ENUNCIADO N. 30 DA SÚMULA DESTE TRIBUNAL SUPERIOR. DISSÍDIO JURISPRUDENCIAL NÃO DEMONSTRADO. INCIDÊNCIA DO VERBETE N. 28 DA SÚMULA DO TSE. AGRAVO INTERNO DESPROVIDO.     I. Caso em exame     1. Agravo interno interposto contra decisão por meio da qual negado provimento ao agravo em recurso especial eleitoral, em razão da incidência dos enunciados n. 28 e 30 da Súmula do TSE. 2. Na origem, o TRE/MG aplicou multa ao agravante no valor de R$ 5.000,00 (cinco mil reais), com fundamento no art. 57–B, § 5º, da Lei n. 9.504/1997, por ausência de comunicação prévia à Justiça Eleitoral dos endereços eletrônicos utilizados na campanha eleitoral. 3. No presente recuso, o agravante reitera os argumentos trazidos no agravo em recurso especial e alega a não incidência dos enunciados n. 24, 28 e 30 da Súmula do TSE.     II. Questões em discussão     4. A controvérsia consiste em verificar: (i) a legitimidade passiva do candidato responsável pela divulgação de conteúdo eleitoral nos respectivos perfis em redes sociais antes de informar os endereços eletrônicos à Justiça Eleitoral; e (ii) a correção da incidência da multa prevista no art. 57–B, § 5º, da Lei n. 9.504/1997, quando a omissão foi suprida após a veiculação de propaganda eleitoral.     III. Razões de decidir     5. Segundo o art. 40–B, parágrafo único, da Lei n. 9.504/1997, a responsabilidade do candidato beneficiário, quando não for o autor da propaganda, estará demonstrada se as circunstâncias e as peculiaridades do caso específico revelarem a impossibilidade de não ter tido prévio conhecimento.     6. A jurisprudência desta Corte Superior prescreve que 'a representação relativa à propaganda irregular deve ser instruída com prova da autoria ou do prévio conhecimento do beneficiário, caso este não seja por ela responsável' (AgR–REspEl n. 0601577–10.2022.6.10.0000/MA, ministro André Ramos Tavares, DJe de 26 de fevereiro de 2024).     7. Embora o art. 21 da Resolução n. 23.607/2019/TSE determine competir ao partido subscrever o Requerimento de Registro de Candidatura (RRC), cabe ao candidato certificar–se de que os endereços eletrônicos em que pretende realizar a propaganda eleitoral foram comunicados à Justiça Eleitoral, nos termos do § 5º do art. 57–B da Lei n. 9.504/1997, o qual dispõe ser 'o usuário responsável pelo conteúdo divulgado'.     8. É inviável o provimento do agravo, nos termos do enunciado n. 30 da Súmula do TSE, segundo o qual: 'Não se conhece de recurso especial eleitoral por dissídio jurisprudencial, quando a decisão recorrida estiver conforme a jurisprudência do Tribunal Superior Eleitoral'.     9. O dissídio jurisprudencial não foi comprovado, seja em razão da ausência de indispensável cotejo entre o acórdão recorrido e o paradigma, seja em virtude da impossibilidade de se aferirem, em âmbito de instância especial, fatos e provas, conforme o dissenso passaria a exigir, atraindo o óbice do verbete n. 28 da Súmula desta Corte Superior.     IV. Dispositivo e tese     10. Agravo interno desprovido.     __________     Tese de julgamento:     1. O candidato é parte legítima para figurar no polo passivo da representação por ser o responsável pelo conteúdo divulgado.     2. A ausência de comunicação prévia à Justiça Eleitoral dos endereços eletrônicos utilizados para propaganda eleitoral na internet enseja a aplicação da multa prevista no art. 57–B, § 5º, da Lei n. 9.504/1997, não se afastando a penalidade por posterior regularização.     Legislação relevante citada:Lei n. 9.504/1997, arts. 40–B, parágrafo único, e 57–B, § 5º.     Resolução n. 23.609/2019/TSE, art. 21.     Resolução n. 23.610/2019/TSE, art. 28, I e II, §§ 1º e 5º.     Jurisprudência relevante citada:       TSE, AgR–REspEl n. 0601577–10.2022.6.10.0000/MA, ministro André Ramos Tavares, DJe de 26 de fevereiro de 2024.        TSE, AgR–AREspE n. 0600619–47.2024.6.13.0169/MG, ministro Antonio Carlos Ferreira, DJe de 24 de junho de 2025.        TSE, REspEl n. 0601004–57.2020.6.16.0199/PR, ministro Mauro Campbell Marques, DJe de 11 de junho de 2021.        TSE, AgR–AREspE n. 0600475–72.2020.6.06.0019/CE, ministro Alexandre de Moraes, DJe de 9 de novembro de 2021.        TSE, Rec–Rp n. 0601056–44.2022.6.00.0000/DF, ministra Maria Claudia Bucchianeri, PSESS de 19 de dezembro de 2022.        TSE, AREspE n. 0600739–15.2020.6.03.0006/AP, ministro Mauro Campbell Marques, DJe de 20 de setembro de 2022.        TSE, AgR–AREspE n. 0600306–17.2020.6.06.0074/CE, ministro Sérgio Silveira Banhos, DJe de 6 de maio de 2022.    "
