id,ordem_doc,arquivo_fonte,norma_id,norma_titulo,norma_nome_popular,macrogrupo,grupo_sumario,pagina_inicial,pagina_final,hierarquia_normativa,tipo_dispositivo,dispositivo,dispositivo_pai,artigo,paragrafo,inciso,alinea,item,texto_dispositivo,notas_texto,notas_json,qtd_notas,referencias_normativas,referencias_jurisprudenciais,referencias_sumulas,texto_rag,resumo_curto,palavras_chave,incluir_no_rag,chars,tokens_estimados,row_key,csv_arquivo,dispositivo_pai_id,dispositivo_pai_row_key
26,26,Codigo_Eleitoral_2026_anotado.pdf,lei_complementar_64_1990,"Lei Complementar n. 64, de 18 de maio de 1990",Lei de Inelegibilidade,Lei de Inelegibilidade,Lei de Inelegibilidade,416,417,,alinea,"Art. 55, l)",Art. 55,Art. 55,,,l),,"l) os que forem condenados à suspensão dos direitos políticos, em decisão transitada em julgado ou proferida por órgão judicial colegiado, por ato doloso de improbidade administrativa que importe, concomitantemente, na parte dispositiva da decisão, lesão ao patrimônio público e enriquecimento ilícito, desde a condenação por órgão colegiado até o transcurso do prazo de 8 (oito) anos;","Alínea l com redação dada pelo art. 2º da
LC n. 219/2025.
Ac.-TSE, de 20/9/2012, no REspe n. 27558: “O ato doloso de improbidade administrativa pode implicar o enriquecimento ilícito tanto do próprio agente, mediante proveito pessoal, quanto de terceiros por ele beneficiados”.
Ac.-TSE, de 23/4/2025, no AgR-REspEI n. 060027054; de 13/8/2018, no AgR-REspe n. 27473 e, de 18/4/2017, no AgR-REspe n. 23884: a análise do enriquecimento ilícito e do dano ao erário pode ser realizada pela Justiça Eleitoral, com base no exame da fundamentação do decisum, ainda que não tenha constado expressamente do dispositivo.
Ac.-TSE, de 19/12/2022, no RO-El n. 060082847 e, de 19/4/2022, no AgR-REspEl n. 060018366: “Configura ato doloso de improbidade administrativa a prática do esquema denominado ‘rachadinha’, o qual acarreta enriquecimento ilícito do agente público beneficiário e prejuízos à Administração Pública”.
Ac.-TSE, de 30/3/2017, no AgR-REspe n. 11166 e, de 21/3/2017, no REspe n. 48978: condenação por ato doloso de improbidade administrativa fundada apenas no art. 11 da Lei n. 8.429/1992 não atrai a inelegibilidade prevista nesta alínea.
Ac.-TSE, de 21/2/2017, no REspe n. 10049: requisitos de incidência desta alínea: a) condenação por ato de improbidade administrativa que importe, simultaneamente, lesão ao patrimônio público e enriquecimento ilícito; b) presença de dolo; c) decisão definitiva ou proferida por órgão judicial colegiado; e d) sanção de suspensão dos direitos políticos.
Ac.-TSE, de 13/12/2016, no REspe n. 5039: é lícito à Justiça Eleitoral examinar por inteiro o acórdão da Justiça Comum em que proclamada a improbidade, não podendo incluir ou suprimir nada, requalificar fatos e provas, conceber adendos e refazer conclusões.
Ac.-TSE, de 18/10/2016, no REspe n. 4932 e, de 10/12/2013, no RO n. 67938: a condenação por ato doloso de improbidade administrativa deve implicar, concomitantemente, lesão ao Erário e enriquecimento ilícito.
Ac.-TSE, de 22/10/2014, no RO n. 140804 e, de 11/9/2014, no RO n. 38023: indefere-se o registro de candidatura se, com base na análise das condenações, for possível constatar que a Justiça Comum reconheceu a presença cumulativa de prejuízo ao Erário e de enriquecimento ilícito decorrente de ato doloso de improbidade administrativa, ainda que não conste expressamente na parte dispositiva da decisão condenatória.","[{""ordem"": 1, ""marcador"": ""continuação"", ""texto"": ""Alínea l com redação dada pelo art. 2º da"", ""pagina_inicial"": 416, ""pagina_final"": 416}, {""ordem"": 2, ""marcador"": ""quadrado"", ""texto"": ""LC n. 219/2025."", ""pagina_inicial"": 416, ""pagina_final"": 416}, {""ordem"": 3, ""marcador"": ""ticado"", ""texto"": ""Ac.-TSE, de 20/9/2012, no REspe n. 27558: “O ato doloso de improbidade administrativa pode implicar o enriquecimento ilícito tanto do próprio agente, mediante proveito pessoal, quanto de terceiros por ele beneficiados”."", ""pagina_inicial"": 416, ""pagina_final"": 416}, {""ordem"": 4, ""marcador"": ""ticado"", ""texto"": ""Ac.-TSE, de 23/4/2025, no AgR-REspEI n. 060027054; de 13/8/2018, no AgR-REspe n. 27473 e, de 18/4/2017, no AgR-REspe n. 23884: a análise do enriquecimento ilícito e do dano ao erário pode ser realizada pela Justiça Eleitoral, com base no exame da fundamentação do decisum, ainda que não tenha constado expressamente do dispositivo."", ""pagina_inicial"": 417, ""pagina_final"": 417}, {""ordem"": 5, ""marcador"": ""quadrado"", ""texto"": ""Ac.-TSE, de 19/12/2022, no RO-El n. 060082847 e, de 19/4/2022, no AgR-REspEl n. 060018366: “Configura ato doloso de improbidade administrativa a prática do esquema denominado ‘rachadinha’, o qual acarreta enriquecimento ilícito do agente público beneficiário e prejuízos à Administração Pública”."", ""pagina_inicial"": 417, ""pagina_final"": 417}, {""ordem"": 6, ""marcador"": ""quadrado"", ""texto"": ""Ac.-TSE, de 30/3/2017, no AgR-REspe n. 11166 e, de 21/3/2017, no REspe n. 48978: condenação por ato doloso de improbidade administrativa fundada apenas no art. 11 da Lei n. 8.429/1992 não atrai a inelegibilidade prevista nesta alínea."", ""pagina_inicial"": 417, ""pagina_final"": 417}, {""ordem"": 7, ""marcador"": ""quadrado"", ""texto"": ""Ac.-TSE, de 21/2/2017, no REspe n. 10049: requisitos de incidência desta alínea: a) condenação por ato de improbidade administrativa que importe, simultaneamente, lesão ao patrimônio público e enriquecimento ilícito; b) presença de dolo; c) decisão definitiva ou proferida por órgão judicial colegiado; e d) sanção de suspensão dos direitos políticos."", ""pagina_inicial"": 417, ""pagina_final"": 417}, {""ordem"": 8, ""marcador"": ""quadrado"", ""texto"": ""Ac.-TSE, de 13/12/2016, no REspe n. 5039: é lícito à Justiça Eleitoral examinar por inteiro o acórdão da Justiça Comum em que proclamada a improbidade, não podendo incluir ou suprimir nada, requalificar fatos e provas, conceber adendos e refazer conclusões."", ""pagina_inicial"": 417, ""pagina_final"": 417}, {""ordem"": 9, ""marcador"": ""quadrado"", ""texto"": ""Ac.-TSE, de 18/10/2016, no REspe n. 4932 e, de 10/12/2013, no RO n. 67938: a condenação por ato doloso de improbidade administrativa deve implicar, concomitantemente, lesão ao Erário e enriquecimento ilícito."", ""pagina_inicial"": 417, ""pagina_final"": 417}, {""ordem"": 10, ""marcador"": ""quadrado"", ""texto"": ""Ac.-TSE, de 22/10/2014, no RO n. 140804 e, de 11/9/2014, no RO n. 38023: indefere-se o registro de candidatura se, com base na análise das condenações, for possível constatar que a Justiça Comum reconheceu a presença cumulativa de prejuízo ao Erário e de enriquecimento ilícito decorrente de ato doloso de improbidade administrativa, ainda que não conste expressamente na parte dispositiva da decisão condenatória."", ""pagina_inicial"": 417, ""pagina_final"": 417}]",10,Lei n. 8.429/1992; LC n. 219/2025,"Ac.-TSE, de 20/9/2012, no REspe n. 27558; Ac.-TSE, de 23/4/2025, no AgR-REspEI n. 060027054; Ac.-TSE, de 19/12/2022, no RO-El n. 060082847; Ac.-TSE, de 30/3/2017, no AgR-REspe n. 11166; Ac.-TSE, de 21/2/2017, no REspe n. 10049; Ac.-TSE, de 13/12/2016, no REspe n. 5039; Ac.-TSE, de 18/10/2016, no REspe n. 4932; Ac.-TSE, de 22/10/2014, no RO n. 140804; AgR-REspe n. 27473; AgR-REspe n. 23884; AgR-REspEl n. 060018366; REspe n. 48978; RO n. 67938; RO n. 38023",,"Documento: Codigo Eleitoral 2026 anotado Norma: Lei Complementar n. 64, de 18 de maio de 1990 Nome popular/citação curta: Lei de Inelegibilidade Macrogrupo: Lei de Inelegibilidade Grupo do sumário: Lei de Inelegibilidade Dispositivo: Art. 55, l) Tipo: alinea Dispositivo pai: Art. 55 ID do dispositivo pai: 007_lei_complementar_64_1990_lei_de_inelegibilidade:6 Páginas: 416-417 Resumo: Art. 55, l), subordinado a Art. 55: os que forem condenados à suspensão dos direitos políticos, em decisão transitada em julgado ou proferida por órgão judicial colegiado, por ato doloso de improbidade administrativa que importe, concomitantemente, na parte dispositiva da decisão, lesão ao patrimônio público e enriquecimento ilícito, desde a condenação por órgão colegiado até o transcurso do prazo de 8 (oito) anos... Referências jurisprudenciais: Ac.-TSE, de 20/9/2012, no REspe n. 27558; Ac.-TSE, de 23/4/2025, no AgR-REspEI n. 060027054; Ac.-TSE, de 19/12/2022, no RO-El n. 060082847; Ac.-TSE, de 30/3/2017, no AgR-REspe n. 11166; Ac.-TSE, de 21/2/2017, no REspe n. 10049; Ac.-TSE, de 13/12/2016, no REspe n. 5039; Ac.-TSE, de 18/10/2016, no REspe n. 4932; Ac.-TSE, de 22/10/2014, no RO n. 140804; AgR-REspe n. 27473; AgR-REspe n. 23884; AgR-REspEl n. 060018366; REspe n. 48978; RO n. 67938; RO n. 38023 l) os que forem condenados à suspensão dos direitos políticos, em decisão transitada em julgado ou proferida por órgão judicial colegiado, por ato doloso de improbidade administrativa que importe, concomitantemente, na parte dispositiva da decisão, lesão ao patrimônio público e enriquecimento ilícito, desde a condenação por órgão colegiado até o transcurso do prazo de 8 (oito) anos; Notas vinculadas: Alínea l com redação dada pelo art. 2º da LC n. 219/2025. Ac.-TSE, de 20/9/2012, no REspe n. 27558: “O ato doloso de improbidade administrativa pode implicar o enriquecimento ilícito tanto do próprio agente, mediante proveito pessoal, quanto de terceiros por ele beneficiados”. Ac.-TSE, de 23/4/2025, no AgR-REspEI n. 060027054; de 13/8/2018, no AgR-REspe n. 27473 e, de 18/4/2017, no AgR-REspe n. 23884: a análise do enriquecimento ilícito e do dano ao erário pode ser realizada pela Justiça Eleitoral, com base no exame da fundamentação do decisum, ainda que não tenha constado expressamente do dispositivo. Ac.-TSE, de 19/12/2022, no RO-El n. 060082847 e, de 19/4/2022, no AgR-REspEl n. 060018366: “Configura ato doloso de improbidade administrativa a prática do esquema denominado ‘rachadinha’, o qual acarreta enriquecimento ilícito do agente público beneficiário e prejuízos à Administração Pública”. Ac.-TSE, de 30/3/2017, no AgR-REspe n. 11166 e, de 21/3/2017, no REspe n. 48978: condenação por ato doloso de improbidade administrativa fundada apenas no art. 11 da Lei n. 8.429/1992 não atrai a inelegibilidade prevista nesta alínea. Ac.-TSE, de 21/2/2017, no REspe n. 10049: requisitos de incidência desta alínea: a) condenação por ato de improbidade administrativa que importe, simultaneamente, lesão ao patrimônio público e enriquecimento ilícito; b) presença de dolo; c) decisão definitiva ou proferida por órgão judicial colegiado; e d) sanção de suspensão dos direitos políticos. Ac.-TSE, de 13/12/2016, no REspe n. 5039: é lícito à Justiça Eleitoral examinar por inteiro o acórdão da Justiça Comum em que proclamada a improbidade, não podendo incluir ou suprimir nada, requalificar fatos e provas, conceber adendos e refazer conclusões. Ac.-TSE, de 18/10/2016, no REspe n. 4932 e, de 10/12/2013, no RO n. 67938: a condenação por ato doloso de improbidade administrativa deve implicar, concomitantemente, lesão ao Erário e enriquecimento ilícito. Ac.-TSE, de 22/10/2014, no RO n. 140804 e, de 11/9/2014, no RO n. 38023: indefere-se o registro de candidatura se, com base na análise das condenações, for possível constatar que a Justiça Comum reconheceu a presença cumulativa de prejuízo ao Erário e de enriquecimento ilícito decorrente de ato doloso de improbidade administrativa, ainda que não conste expressamente na parte dispositiva da decisão condenatória.","Art. 55, l), subordinado a Art. 55: os que forem condenados à suspensão dos direitos políticos, em decisão transitada em julgado ou proferida por órgão judicial colegiado, por ato doloso de improbidade administrativa que importe, concomitantemente, na parte dispositiva da decisão, lesão ao patrimônio público e enriquecimento ilícito, desde a condenação por órgão colegiado até o transcurso do prazo de 8 (oito) anos...",improbidade; respe; administrativa; enriquecimento; ilicito; doloso; decisao; condenacao; justica; orgao,True,4075,1019,007_lei_complementar_64_1990_lei_de_inelegibilidade:26,007_lei_complementar_64_1990_lei_de_inelegibilidade.csv,6,007_lei_complementar_64_1990_lei_de_inelegibilidade:6
27,27,Codigo_Eleitoral_2026_anotado.pdf,lei_complementar_64_1990,"Lei Complementar n. 64, de 18 de maio de 1990",Lei de Inelegibilidade,Lei de Inelegibilidade,Lei de Inelegibilidade,417,417,,alinea,"Art. 55, m)",Art. 55,Art. 55,,,m),,"m) os que forem excluídos do exercício da profissão, por decisão sancionatória do órgão profissional competente, em decorrência de infração ético-profissional, pelo prazo de 8 (oito) anos, salvo se o ato houver sido anulado ou suspenso pelo Poder Judiciário;",Alínea m acrescida pelo art. 2º da LC n. 135/2010.,"[{""ordem"": 1, ""marcador"": ""continuação"", ""texto"": ""Alínea m acrescida pelo art. 2º da LC n. 135/2010."", ""pagina_inicial"": 417, ""pagina_final"": 417}]",1,LC n. 135/2010,,,"Documento: Codigo Eleitoral 2026 anotado Norma: Lei Complementar n. 64, de 18 de maio de 1990 Nome popular/citação curta: Lei de Inelegibilidade Macrogrupo: Lei de Inelegibilidade Grupo do sumário: Lei de Inelegibilidade Dispositivo: Art. 55, m) Tipo: alinea Dispositivo pai: Art. 55 ID do dispositivo pai: 007_lei_complementar_64_1990_lei_de_inelegibilidade:6 Páginas: 417-417 Resumo: Art. 55, m), subordinado a Art. 55: os que forem excluídos do exercício da profissão, por decisão sancionatória do órgão profissional competente, em decorrência de infração ético-profissional, pelo prazo de 8 (oito) anos, salvo se o ato houver sido anulado ou suspenso pelo Poder Judiciário; | 1 nota(s) vinculada(s) m) os que forem excluídos do exercício da profissão, por decisão sancionatória do órgão profissional competente, em decorrência de infração ético-profissional, pelo prazo de 8 (oito) anos, salvo se o ato houver sido anulado ou suspenso pelo Poder Judiciário; Notas vinculadas: Alínea m acrescida pelo art. 2º da LC n. 135/2010.","Art. 55, m), subordinado a Art. 55: os que forem excluídos do exercício da profissão, por decisão sancionatória do órgão profissional competente, em decorrência de infração ético-profissional, pelo prazo de 8 (oito) anos, salvo se o ato houver sido anulado ou suspenso pelo Poder Judiciário; | 1 nota(s) vinculada(s)",profissional; complementar; maio; forem; excluidos; exercicio; profissao; decisao; sancionatoria; orgao,True,1030,258,007_lei_complementar_64_1990_lei_de_inelegibilidade:27,007_lei_complementar_64_1990_lei_de_inelegibilidade.csv,6,007_lei_complementar_64_1990_lei_de_inelegibilidade:6
28,28,Codigo_Eleitoral_2026_anotado.pdf,lei_complementar_64_1990,"Lei Complementar n. 64, de 18 de maio de 1990",Lei de Inelegibilidade,Lei de Inelegibilidade,Lei de Inelegibilidade,417,417,,alinea,"Art. 55, n)",Art. 55,Art. 55,,,n),,"n) os que forem condenados, em decisão transitada em julgado ou proferida por órgão judicial colegiado, em razão de terem desfeito ou simulado desfazer vínculo conjugal ou de união estável para evitar caracterização de inelegibilidade, pelo prazo de 8 (oito) anos após a decisão que reconhecer a fraude;","Alínea n acrescida pelo art. 2º da LC n. 135/2010.
Ac.-TSE, de 21/8/2014, no REspe n. 39723: a incidência deste dispositivo pressupõe ação judicial que condene a parte por fraude.","[{""ordem"": 1, ""marcador"": ""continuação"", ""texto"": ""Alínea n acrescida pelo art. 2º da LC n. 135/2010."", ""pagina_inicial"": 417, ""pagina_final"": 417}, {""ordem"": 3, ""marcador"": ""quadrado"", ""texto"": ""Ac.-TSE, de 21/8/2014, no REspe n. 39723: a incidência deste dispositivo pressupõe ação judicial que condene a parte por fraude."", ""pagina_inicial"": 417, ""pagina_final"": 417}]",2,LC n. 135/2010,"Ac.-TSE, de 21/8/2014, no REspe n. 39723",,"Documento: Codigo Eleitoral 2026 anotado Norma: Lei Complementar n. 64, de 18 de maio de 1990 Nome popular/citação curta: Lei de Inelegibilidade Macrogrupo: Lei de Inelegibilidade Grupo do sumário: Lei de Inelegibilidade Dispositivo: Art. 55, n) Tipo: alinea Dispositivo pai: Art. 55 ID do dispositivo pai: 007_lei_complementar_64_1990_lei_de_inelegibilidade:6 Páginas: 417-417 Resumo: Art. 55, n), subordinado a Art. 55: os que forem condenados, em decisão transitada em julgado ou proferida por órgão judicial colegiado, em razão de terem desfeito ou simulado desfazer vínculo conjugal ou de união estável para evitar caracterização de inelegibilidade, pelo prazo de 8 (oito) anos após a decisão que reconhecer a fraude; | 2 nota(s) vinculada(s); jurisprudência extraída das notas Referências jurisprudenciais: Ac.-TSE, de 21/8/2014, no REspe n. 39723 n) os que forem condenados, em decisão transitada em julgado ou proferida por órgão judicial colegiado, em razão de terem desfeito ou simulado desfazer vínculo conjugal ou de união estável para evitar caracterização de inelegibilidade, pelo prazo de 8 (oito) anos após a decisão que reconhecer a fraude; Notas vinculadas: Alínea n acrescida pelo art. 2º da LC n. 135/2010. Ac.-TSE, de 21/8/2014, no REspe n. 39723: a incidência deste dispositivo pressupõe ação judicial que condene a parte por fraude.","Art. 55, n), subordinado a Art. 55: os que forem condenados, em decisão transitada em julgado ou proferida por órgão judicial colegiado, em razão de terem desfeito ou simulado desfazer vínculo conjugal ou de união estável para evitar caracterização de inelegibilidade, pelo prazo de 8 (oito) anos após a decisão que reconhecer a fraude; | 2 nota(s) vinculada(s); jurisprudência extraída das notas",decisao; judicial; fraude; complementar; maio; forem; condenados; transitada; julgado; proferida,True,1355,339,007_lei_complementar_64_1990_lei_de_inelegibilidade:28,007_lei_complementar_64_1990_lei_de_inelegibilidade.csv,6,007_lei_complementar_64_1990_lei_de_inelegibilidade:6
29,29,Codigo_Eleitoral_2026_anotado.pdf,lei_complementar_64_1990,"Lei Complementar n. 64, de 18 de maio de 1990",Lei de Inelegibilidade,Lei de Inelegibilidade,Lei de Inelegibilidade,417,418,,alinea,"Art. 55, o)",Art. 55,Art. 55,,,o),,"o) os que forem demitidos do serviço público em decorrência de processo administrativo ou judicial, quando o fato que deu causa à demissão for equiparado a ato de improbidade, pelo prazo de 8 (oito) anos, contado da decisão, salvo se o ato houver sido suspenso ou anulado pelo Poder Judiciário;","Alínea o com redação dada pelo art. 2º da
LC n. 219/2025.
Ac.-TSE, de 18/12/2018, no RO n. 060079292: a inelegibilidade de que trata esta alínea é aplicável aos militares a que se impuserem sanções que, a qualquer título, produzam efeitos análogos à demissão.
Ac.-TSE, de 21/6/2016, no REspe n. 2026: a suspensão ou anulação administrativa do ato demissional é suficiente para afastar a inelegibilidade.
Ac.-TSE, de 12/9/2014, no RO n. 29340: a inelegibilidade prevista nesta alínea somente é afastada no caso de absolvição criminal que negue a existência do fato ou da autoria.","[{""ordem"": 1, ""marcador"": ""continuação"", ""texto"": ""Alínea o com redação dada pelo art. 2º da"", ""pagina_inicial"": 417, ""pagina_final"": 417}, {""ordem"": 2, ""marcador"": ""quadrado"", ""texto"": ""LC n. 219/2025."", ""pagina_inicial"": 417, ""pagina_final"": 417}, {""ordem"": 3, ""marcador"": ""quadrado"", ""texto"": ""Ac.-TSE, de 18/12/2018, no RO n. 060079292: a inelegibilidade de que trata esta alínea é aplicável aos militares a que se impuserem sanções que, a qualquer título, produzam efeitos análogos à demissão."", ""pagina_inicial"": 417, ""pagina_final"": 418}, {""ordem"": 4, ""marcador"": ""quadrado"", ""texto"": ""Ac.-TSE, de 21/6/2016, no REspe n. 2026: a suspensão ou anulação administrativa do ato demissional é suficiente para afastar a inelegibilidade."", ""pagina_inicial"": 418, ""pagina_final"": 418}, {""ordem"": 5, ""marcador"": ""quadrado"", ""texto"": ""Ac.-TSE, de 12/9/2014, no RO n. 29340: a inelegibilidade prevista nesta alínea somente é afastada no caso de absolvição criminal que negue a existência do fato ou da autoria."", ""pagina_inicial"": 418, ""pagina_final"": 418}]",5,LC n. 219/2025,"Ac.-TSE, de 18/12/2018, no RO n. 060079292; Ac.-TSE, de 21/6/2016, no REspe n. 2026; Ac.-TSE, de 12/9/2014, no RO n. 29340",,"Documento: Codigo Eleitoral 2026 anotado Norma: Lei Complementar n. 64, de 18 de maio de 1990 Nome popular/citação curta: Lei de Inelegibilidade Macrogrupo: Lei de Inelegibilidade Grupo do sumário: Lei de Inelegibilidade Dispositivo: Art. 55, o) Tipo: alinea Dispositivo pai: Art. 55 ID do dispositivo pai: 007_lei_complementar_64_1990_lei_de_inelegibilidade:6 Páginas: 417-418 Resumo: Art. 55, o), subordinado a Art. 55: os que forem demitidos do serviço público em decorrência de processo administrativo ou judicial, quando o fato que deu causa à demissão for equiparado a ato de improbidade, pelo prazo de 8 (oito) anos, contado da decisão, salvo se o ato houver sido suspenso ou anulado pelo Poder Judiciário; | 5 nota(s) vinculada(s); jurisprudência extraída das notas Referências jurisprudenciais: Ac.-TSE, de 18/12/2018, no RO n. 060079292; Ac.-TSE, de 21/6/2016, no REspe n. 2026; Ac.-TSE, de 12/9/2014, no RO n. 29340 o) os que forem demitidos do serviço público em decorrência de processo administrativo ou judicial, quando o fato que deu causa à demissão for equiparado a ato de improbidade, pelo prazo de 8 (oito) anos, contado da decisão, salvo se o ato houver sido suspenso ou anulado pelo Poder Judiciário; Notas vinculadas: Alínea o com redação dada pelo art. 2º da LC n. 219/2025. Ac.-TSE, de 18/12/2018, no RO n. 060079292: a inelegibilidade de que trata esta alínea é aplicável aos militares a que se impuserem sanções que, a qualquer título, produzam efeitos análogos à demissão. Ac.-TSE, de 21/6/2016, no REspe n. 2026: a suspensão ou anulação administrativa do ato demissional é suficiente para afastar a inelegibilidade. Ac.-TSE, de 12/9/2014, no RO n. 29340: a inelegibilidade prevista nesta alínea somente é afastada no caso de absolvição criminal que negue a existência do fato ou da autoria.","Art. 55, o), subordinado a Art. 55: os que forem demitidos do serviço público em decorrência de processo administrativo ou judicial, quando o fato que deu causa à demissão for equiparado a ato de improbidade, pelo prazo de 8 (oito) anos, contado da decisão, salvo se o ato houver sido suspenso ou anulado pelo Poder Judiciário; | 5 nota(s) vinculada(s); jurisprudência extraída das notas",alinea; inelegibilidade; fato; demissao; complementar; maio; forem; demitidos; servico; publico,True,1818,454,007_lei_complementar_64_1990_lei_de_inelegibilidade:29,007_lei_complementar_64_1990_lei_de_inelegibilidade.csv,6,007_lei_complementar_64_1990_lei_de_inelegibilidade:6
