id,ordem_doc,arquivo_fonte,norma_id,norma_titulo,norma_nome_popular,macrogrupo,grupo_sumario,pagina_inicial,pagina_final,hierarquia_normativa,tipo_dispositivo,dispositivo,dispositivo_pai,artigo,paragrafo,inciso,alinea,item,texto_dispositivo,notas_texto,notas_json,qtd_notas,referencias_normativas,referencias_jurisprudenciais,referencias_sumulas,texto_rag,resumo_curto,palavras_chave,incluir_no_rag,chars,tokens_estimados,row_key,csv_arquivo,dispositivo_pai_id,dispositivo_pai_row_key
138,138,Codigo_Eleitoral_2026_anotado.pdf,lei_complementar_64_1990,"Lei Complementar n. 64, de 18 de maio de 1990",Lei de Inelegibilidade,Lei de Inelegibilidade,Lei de Inelegibilidade,435,435,,inciso,"Art. 22, I",Art. 22,Art. 22,,I,,,"I - o corregedor, que terá as mesmas atribuições do relator em processos judiciais, ao despachar a inicial, adotará as seguintes providências:","Res.-TSE n. 23585/2018: permite a convocação de magistrados para prestar auxílio nos Tribunais Regionais Eleitorais, sem gerar direito à percepção de eventual diferença de subsídio ou gratificação eleitoral, ante a ausência de previsão legal.","[{""ordem"": 1, ""marcador"": ""quadrado"", ""texto"": ""Res.-TSE n. 23585/2018: permite a convocação de magistrados para prestar auxílio nos Tribunais Regionais Eleitorais, sem gerar direito à percepção de eventual diferença de subsídio ou gratificação eleitoral, ante a ausência de previsão legal."", ""pagina_inicial"": 435, ""pagina_final"": 435}]",1,Res.-TSE n. 23585/2018,,,"Documento: Codigo Eleitoral 2026 anotado Norma: Lei Complementar n. 64, de 18 de maio de 1990 Nome popular/citação curta: Lei de Inelegibilidade Macrogrupo: Lei de Inelegibilidade Grupo do sumário: Lei de Inelegibilidade Dispositivo: Art. 22, I Tipo: inciso Dispositivo pai: Art. 22 ID do dispositivo pai: 007_lei_complementar_64_1990_lei_de_inelegibilidade:137 Páginas: 435-435 Resumo: Art. 22, I, subordinado a Art. 22: o corregedor, que terá as mesmas atribuições do relator em processos judiciais, ao despachar a inicial, adotará as seguintes providências: | 1 nota(s) vinculada(s) I - o corregedor, que terá as mesmas atribuições do relator em processos judiciais, ao despachar a inicial, adotará as seguintes providências: Notas vinculadas: Res.-TSE n. 23585/2018: permite a convocação de magistrados para prestar auxílio nos Tribunais Regionais Eleitorais, sem gerar direito à percepção de eventual diferença de subsídio ou gratificação eleitoral, ante a ausência de previsão legal.","Art. 22, I, subordinado a Art. 22: o corregedor, que terá as mesmas atribuições do relator em processos judiciais, ao despachar a inicial, adotará as seguintes providências: | 1 nota(s) vinculada(s)",complementar; maio; corregedor; tera; mesmas; atribuicoes; relator; processos; judiciais; despachar,True,989,247,007_lei_complementar_64_1990_lei_de_inelegibilidade:138,007_lei_complementar_64_1990_lei_de_inelegibilidade.csv,137,007_lei_complementar_64_1990_lei_de_inelegibilidade:137
139,139,Codigo_Eleitoral_2026_anotado.pdf,lei_complementar_64_1990,"Lei Complementar n. 64, de 18 de maio de 1990",Lei de Inelegibilidade,Lei de Inelegibilidade,Lei de Inelegibilidade,435,435,,alinea,"Art. 22, I, a)","Art. 22, I",Art. 22,,I,a),,"a) ordenará que se notifique o representado do conteúdo da petição, entregando-se-lhe a segunda via apresentada pelo representante com as cópias dos documentos, a fim de que, no prazo de 5 (cinco) dias, ofereça ampla defesa, juntada de documentos e rol de testemunhas, se cabível;",,[],0,,,,"Documento: Codigo Eleitoral 2026 anotado Norma: Lei Complementar n. 64, de 18 de maio de 1990 Nome popular/citação curta: Lei de Inelegibilidade Macrogrupo: Lei de Inelegibilidade Grupo do sumário: Lei de Inelegibilidade Dispositivo: Art. 22, I, a) Tipo: alinea Dispositivo pai: Art. 22, I ID do dispositivo pai: 007_lei_complementar_64_1990_lei_de_inelegibilidade:138 Páginas: 435-435 Resumo: Art. 22, I, a), subordinado a Art. 22, I: ordenará que se notifique o representado do conteúdo da petição, entregando-se-lhe a segunda via apresentada pelo representante com as cópias dos documentos, a fim de que, no prazo de 5 (cinco) dias, ofereça ampla defesa, juntada de documentos e rol de testemunhas, se cabível; a) ordenará que se notifique o representado do conteúdo da petição, entregando-se-lhe a segunda via apresentada pelo representante com as cópias dos documentos, a fim de que, no prazo de 5 (cinco) dias, ofereça ampla defesa, juntada de documentos e rol de testemunhas, se cabível;","Art. 22, I, a), subordinado a Art. 22, I: ordenará que se notifique o representado do conteúdo da petição, entregando-se-lhe a segunda via apresentada pelo representante com as cópias dos documentos, a fim de que, no prazo de 5 (cinco) dias, ofereça ampla defesa, juntada de documentos e rol de testemunhas, se cabível;",documentos; complementar; maio; ordenara; notifique; representado; conteudo; peticao; entregando; segunda,True,994,248,007_lei_complementar_64_1990_lei_de_inelegibilidade:139,007_lei_complementar_64_1990_lei_de_inelegibilidade.csv,138,007_lei_complementar_64_1990_lei_de_inelegibilidade:138
140,140,Codigo_Eleitoral_2026_anotado.pdf,lei_complementar_64_1990,"Lei Complementar n. 64, de 18 de maio de 1990",Lei de Inelegibilidade,Lei de Inelegibilidade,Lei de Inelegibilidade,435,435,,alinea,"Art. 22, I, b)","Art. 22, I",Art. 22,,I,b),,"b) determinará que se suspenda o ato que deu motivo à representação, quando for relevante o fundamento e do ato impugnado puder resultar a ineficiência da medida, caso seja julgada procedente;","Ac.-TSE, de 20/10/2022, no Ref-AIJE n. 060152238: “O exercício dessa competência deve se pautar pela mínima intervenção, atuando de forma pontual para conter a propagação e amplificação de efeitos potencialmente danosos”.","[{""ordem"": 1, ""marcador"": ""quadrado"", ""texto"": ""Ac.-TSE, de 20/10/2022, no Ref-AIJE n. 060152238: “O exercício dessa competência deve se pautar pela mínima intervenção, atuando de forma pontual para conter a propagação e amplificação de efeitos potencialmente danosos”."", ""pagina_inicial"": 435, ""pagina_final"": 435}]",1,,"Ac.-TSE, de 20/10/2022, no Ref-AIJE n. 060152238",,"Documento: Codigo Eleitoral 2026 anotado Norma: Lei Complementar n. 64, de 18 de maio de 1990 Nome popular/citação curta: Lei de Inelegibilidade Macrogrupo: Lei de Inelegibilidade Grupo do sumário: Lei de Inelegibilidade Dispositivo: Art. 22, I, b) Tipo: alinea Dispositivo pai: Art. 22, I ID do dispositivo pai: 007_lei_complementar_64_1990_lei_de_inelegibilidade:138 Páginas: 435-435 Resumo: Art. 22, I, b), subordinado a Art. 22, I: determinará que se suspenda o ato que deu motivo à representação, quando for relevante o fundamento e do ato impugnado puder resultar a ineficiência da medida, caso seja julgada procedente; | 1 nota(s) vinculada(s); jurisprudência extraída das notas Referências jurisprudenciais: Ac.-TSE, de 20/10/2022, no Ref-AIJE n. 060152238 b) determinará que se suspenda o ato que deu motivo à representação, quando for relevante o fundamento e do ato impugnado puder resultar a ineficiência da medida, caso seja julgada procedente; Notas vinculadas: Ac.-TSE, de 20/10/2022, no Ref-AIJE n. 060152238: “O exercício dessa competência deve se pautar pela mínima intervenção, atuando de forma pontual para conter a propagação e amplificação de efeitos potencialmente danosos”.","Art. 22, I, b), subordinado a Art. 22, I: determinará que se suspenda o ato que deu motivo à representação, quando for relevante o fundamento e do ato impugnado puder resultar a ineficiência da medida, caso seja julgada procedente; | 1 nota(s) vinculada(s); jurisprudência extraída das notas",complementar; maio; determinara; suspenda; motivo; representacao; quando; relevante; fundamento; impugnado,True,1197,299,007_lei_complementar_64_1990_lei_de_inelegibilidade:140,007_lei_complementar_64_1990_lei_de_inelegibilidade.csv,138,007_lei_complementar_64_1990_lei_de_inelegibilidade:138
141,141,Codigo_Eleitoral_2026_anotado.pdf,lei_complementar_64_1990,"Lei Complementar n. 64, de 18 de maio de 1990",Lei de Inelegibilidade,Lei de Inelegibilidade,Lei de Inelegibilidade,435,435,,alinea,"Art. 22, I, c)","Art. 22, I",Art. 22,,I,c),,"c) indeferirá desde logo a inicial, quando não for caso de representação ou lhe faltar algum requisito desta lei complementar;",,[],0,,,,"Documento: Codigo Eleitoral 2026 anotado Norma: Lei Complementar n. 64, de 18 de maio de 1990 Nome popular/citação curta: Lei de Inelegibilidade Macrogrupo: Lei de Inelegibilidade Grupo do sumário: Lei de Inelegibilidade Dispositivo: Art. 22, I, c) Tipo: alinea Dispositivo pai: Art. 22, I ID do dispositivo pai: 007_lei_complementar_64_1990_lei_de_inelegibilidade:138 Páginas: 435-435 Resumo: Art. 22, I, c), subordinado a Art. 22, I: indeferirá desde logo a inicial, quando não for caso de representação ou lhe faltar algum requisito desta lei complementar; c) indeferirá desde logo a inicial, quando não for caso de representação ou lhe faltar algum requisito desta lei complementar;","Art. 22, I, c), subordinado a Art. 22, I: indeferirá desde logo a inicial, quando não for caso de representação ou lhe faltar algum requisito desta lei complementar;",complementar; maio; indeferira; desde; logo; inicial; quando; caso; representacao; faltar,True,686,172,007_lei_complementar_64_1990_lei_de_inelegibilidade:141,007_lei_complementar_64_1990_lei_de_inelegibilidade.csv,138,007_lei_complementar_64_1990_lei_de_inelegibilidade:138
142,142,Codigo_Eleitoral_2026_anotado.pdf,lei_complementar_64_1990,"Lei Complementar n. 64, de 18 de maio de 1990",Lei de Inelegibilidade,Lei de Inelegibilidade,Lei de Inelegibilidade,435,435,,inciso,"Art. 22, II",Art. 22,Art. 22,,II,,,"II - no caso do corregedor indeferir a reclamação ou representação, ou retardar-lhe a solução, poderá o interessado renová-la perante o Tribunal, que resolverá dentro de 24 (vinte e quatro) horas;","Res.-TSE n. 22022/2005: inaplicabilidade deste inciso quando se tratar de eleições municipais, cabendo recurso no caso de indeferimento da petição inicial ou, no caso de demora, a invocação do inciso III deste artigo perante o TRE.
Ac.-TSE, de 1º/6/2006, no RO n. 714: a renovação da representação, na hipótese de anterior indeferimento, requer a apresentação de fatos, indícios, circunstâncias e fundamentos novos em relação aos que já foram apresentados e analisados pela Corregedoria Regional, excetuando-se essa regra quando o corregedor retardar a solução da investigação judicial.","[{""ordem"": 1, ""marcador"": ""quadrado"", ""texto"": ""Res.-TSE n. 22022/2005: inaplicabilidade deste inciso quando se tratar de eleições municipais, cabendo recurso no caso de indeferimento da petição inicial ou, no caso de demora, a invocação do inciso III deste artigo perante o TRE."", ""pagina_inicial"": 435, ""pagina_final"": 435}, {""ordem"": 2, ""marcador"": ""quadrado"", ""texto"": ""Ac.-TSE, de 1º/6/2006, no RO n. 714: a renovação da representação, na hipótese de anterior indeferimento, requer a apresentação de fatos, indícios, circunstâncias e fundamentos novos em relação aos que já foram apresentados e analisados pela Corregedoria Regional, excetuando-se essa regra quando o corregedor retardar a solução da investigação judicial."", ""pagina_inicial"": 435, ""pagina_final"": 435}]",2,Res.-TSE n. 22022/2005,RO n. 714,,"Documento: Codigo Eleitoral 2026 anotado Norma: Lei Complementar n. 64, de 18 de maio de 1990 Nome popular/citação curta: Lei de Inelegibilidade Macrogrupo: Lei de Inelegibilidade Grupo do sumário: Lei de Inelegibilidade Dispositivo: Art. 22, II Tipo: inciso Dispositivo pai: Art. 22 ID do dispositivo pai: 007_lei_complementar_64_1990_lei_de_inelegibilidade:137 Páginas: 435-435 Resumo: Art. 22, II, subordinado a Art. 22: no caso do corregedor indeferir a reclamação ou representação, ou retardar-lhe a solução, poderá o interessado renová-la perante o Tribunal, que resolverá dentro de 24 (vinte e quatro) horas; | 2 nota(s) vinculada(s); jurisprudência extraída das notas Referências jurisprudenciais: RO n. 714 II - no caso do corregedor indeferir a reclamação ou representação, ou retardar-lhe a solução, poderá o interessado renová-la perante o Tribunal, que resolverá dentro de 24 (vinte e quatro) horas; Notas vinculadas: Res.-TSE n. 22022/2005: inaplicabilidade deste inciso quando se tratar de eleições municipais, cabendo recurso no caso de indeferimento da petição inicial ou, no caso de demora, a invocação do inciso III deste artigo perante o TRE. Ac.-TSE, de 1º/6/2006, no RO n. 714: a renovação da representação, na hipótese de anterior indeferimento, requer a apresentação de fatos, indícios, circunstâncias e fundamentos novos em relação aos que já foram apresentados e analisados pela Corregedoria Regional, excetuando-se essa regra quando o corregedor retardar a solução da investigação judicial.","Art. 22, II, subordinado a Art. 22: no caso do corregedor indeferir a reclamação ou representação, ou retardar-lhe a solução, poderá o interessado renová-la perante o Tribunal, que resolverá dentro de 24 (vinte e quatro) horas; | 2 nota(s) vinculada(s); jurisprudência extraída das notas",caso; corregedor; representacao; retardar; solucao; perante; deste; inciso; quando; indeferimento,True,1517,379,007_lei_complementar_64_1990_lei_de_inelegibilidade:142,007_lei_complementar_64_1990_lei_de_inelegibilidade.csv,137,007_lei_complementar_64_1990_lei_de_inelegibilidade:137
143,143,Codigo_Eleitoral_2026_anotado.pdf,lei_complementar_64_1990,"Lei Complementar n. 64, de 18 de maio de 1990",Lei de Inelegibilidade,Lei de Inelegibilidade,Lei de Inelegibilidade,435,436,,inciso,"Art. 22, III",Art. 22,Art. 22,,III,,,"III - o interessado, quando for atendido ou ocorrer demora, poderá levar o fato ao conhecimento do Tribunal Superior Eleitoral, a fim de que sejam tomadas as providências necessárias;",Depreende-se do contexto que o vocábulo “não” foi omitido por engano da expressão quando for atendido.,"[{""ordem"": 1, ""marcador"": ""ticado"", ""texto"": ""Depreende-se do contexto que o vocábulo “não” foi omitido por engano da expressão quando for atendido."", ""pagina_inicial"": 436, ""pagina_final"": 436}]",1,,,,"Documento: Codigo Eleitoral 2026 anotado Norma: Lei Complementar n. 64, de 18 de maio de 1990 Nome popular/citação curta: Lei de Inelegibilidade Macrogrupo: Lei de Inelegibilidade Grupo do sumário: Lei de Inelegibilidade Dispositivo: Art. 22, III Tipo: inciso Dispositivo pai: Art. 22 ID do dispositivo pai: 007_lei_complementar_64_1990_lei_de_inelegibilidade:137 Páginas: 435-436 Resumo: Art. 22, III, subordinado a Art. 22: o interessado, quando for atendido ou ocorrer demora, poderá levar o fato ao conhecimento do Tribunal Superior Eleitoral, a fim de que sejam tomadas as providências necessárias; | 1 nota(s) vinculada(s) III - o interessado, quando for atendido ou ocorrer demora, poderá levar o fato ao conhecimento do Tribunal Superior Eleitoral, a fim de que sejam tomadas as providências necessárias; Notas vinculadas: Depreende-se do contexto que o vocábulo “não” foi omitido por engano da expressão quando for atendido.","Art. 22, III, subordinado a Art. 22: o interessado, quando for atendido ou ocorrer demora, poderá levar o fato ao conhecimento do Tribunal Superior Eleitoral, a fim de que sejam tomadas as providências necessárias; | 1 nota(s) vinculada(s)",quando; atendido; complementar; maio; interessado; ocorrer; demora; podera; levar; fato,True,933,233,007_lei_complementar_64_1990_lei_de_inelegibilidade:143,007_lei_complementar_64_1990_lei_de_inelegibilidade.csv,137,007_lei_complementar_64_1990_lei_de_inelegibilidade:137
144,144,Codigo_Eleitoral_2026_anotado.pdf,lei_complementar_64_1990,"Lei Complementar n. 64, de 18 de maio de 1990",Lei de Inelegibilidade,Lei de Inelegibilidade,Lei de Inelegibilidade,436,436,,inciso,"Art. 22, IV",Art. 22,Art. 22,,IV,,,"IV - feita a notificação, a Secretaria do Tribunal juntará aos autos cópia autêntica do ofício endereçado ao representado, bem como a prova da entrega ou da sua recusa em aceitá-la ou dar recibo;","Ac.-TSE, de 26/5/2011, no REspe n. 272506: irrelevância de o requerimento objetivando a diligência ter sido veiculado fora dos três dias previstos neste inciso, presente a possibilidade de o próprio Estado julgador implementar a providência.","[{""ordem"": 1, ""marcador"": ""quadrado"", ""texto"": ""Ac.-TSE, de 26/5/2011, no REspe n. 272506: irrelevância de o requerimento objetivando a diligência ter sido veiculado fora dos três dias previstos neste inciso, presente a possibilidade de o próprio Estado julgador implementar a providência."", ""pagina_inicial"": 436, ""pagina_final"": 436}]",1,,"Ac.-TSE, de 26/5/2011, no REspe n. 272506",,"Documento: Codigo Eleitoral 2026 anotado Norma: Lei Complementar n. 64, de 18 de maio de 1990 Nome popular/citação curta: Lei de Inelegibilidade Macrogrupo: Lei de Inelegibilidade Grupo do sumário: Lei de Inelegibilidade Dispositivo: Art. 22, IV Tipo: inciso Dispositivo pai: Art. 22 ID do dispositivo pai: 007_lei_complementar_64_1990_lei_de_inelegibilidade:137 Páginas: 436-436 Resumo: Art. 22, IV, subordinado a Art. 22: feita a notificação, a Secretaria do Tribunal juntará aos autos cópia autêntica do ofício endereçado ao representado, bem como a prova da entrega ou da sua recusa em aceitá-la ou dar recibo; | 1 nota(s) vinculada(s); jurisprudência extraída das notas Referências jurisprudenciais: Ac.-TSE, de 26/5/2011, no REspe n. 272506 IV - feita a notificação, a Secretaria do Tribunal juntará aos autos cópia autêntica do ofício endereçado ao representado, bem como a prova da entrega ou da sua recusa em aceitá-la ou dar recibo; Notas vinculadas: Ac.-TSE, de 26/5/2011, no REspe n. 272506: irrelevância de o requerimento objetivando a diligência ter sido veiculado fora dos três dias previstos neste inciso, presente a possibilidade de o próprio Estado julgador implementar a providência.","Art. 22, IV, subordinado a Art. 22: feita a notificação, a Secretaria do Tribunal juntará aos autos cópia autêntica do ofício endereçado ao representado, bem como a prova da entrega ou da sua recusa em aceitá-la ou dar recibo; | 1 nota(s) vinculada(s); jurisprudência extraída das notas",complementar; maio; feita; notificacao; secretaria; tribunal; juntara; autos; copia; autentica,True,1202,300,007_lei_complementar_64_1990_lei_de_inelegibilidade:144,007_lei_complementar_64_1990_lei_de_inelegibilidade.csv,137,007_lei_complementar_64_1990_lei_de_inelegibilidade:137
145,145,Codigo_Eleitoral_2026_anotado.pdf,lei_complementar_64_1990,"Lei Complementar n. 64, de 18 de maio de 1990",Lei de Inelegibilidade,Lei de Inelegibilidade,Lei de Inelegibilidade,436,436,,inciso,"Art. 22, V",Art. 22,Art. 22,,V,,,"V - findo o prazo da notificação, com ou sem defesa, abrir-se-á prazo de 5 (cinco) dias para inquirição, em uma só assentada, de testemunhas arroladas pelo representante e pelo representado, até o máximo de 6 (seis) para cada um, as quais comparecerão independentemente de intimação;","Ac.-TSE, de 8/10/2020, no RO-El n. 352379: desnecessidade de expedição de carta precatória às testemunhas do representante e do representado para o comparecimento à audiência.
Ac.-TSE, de 9/9/2014, no AgR-REspe n. 80025 e, de 6/12/2005, no AgRgAg n. 6241: impossibilidade de julgamento antecipado da lide na representação por abuso de poder ou captação ilícita de sufrágio, na hipótese de necessária dilação probatória, com oitiva de testemunhas.
Ac.-TSE, de 4/5/2010, no REspe n. 36151: extrapolação do número de testemunhas em virtude da diversidade de fatos suscitados num mesmo processo.
Ac.-TSE, de 4/6/2009, no HC n. 131: inexistência de previsão legal quanto à obrigatoriedade de depoimento pessoal de prefeito e vice-prefeito que figuram no polo passivo de AIJE.
Ac.-TSE, de 18/5/2006, no REspe n. 26148: “[...] a apresentação do rol de testemunhas deve ocorrer no momento da inicial ajuizada pelo representante e da defesa protocolada pelo representado”.","[{""ordem"": 1, ""marcador"": ""quadrado"", ""texto"": ""Ac.-TSE, de 8/10/2020, no RO-El n. 352379: desnecessidade de expedição de carta precatória às testemunhas do representante e do representado para o comparecimento à audiência."", ""pagina_inicial"": 436, ""pagina_final"": 436}, {""ordem"": 2, ""marcador"": ""quadrado"", ""texto"": ""Ac.-TSE, de 9/9/2014, no AgR-REspe n. 80025 e, de 6/12/2005, no AgRgAg n. 6241: impossibilidade de julgamento antecipado da lide na representação por abuso de poder ou captação ilícita de sufrágio, na hipótese de necessária dilação probatória, com oitiva de testemunhas."", ""pagina_inicial"": 436, ""pagina_final"": 436}, {""ordem"": 3, ""marcador"": ""quadrado"", ""texto"": ""Ac.-TSE, de 4/5/2010, no REspe n. 36151: extrapolação do número de testemunhas em virtude da diversidade de fatos suscitados num mesmo processo."", ""pagina_inicial"": 436, ""pagina_final"": 436}, {""ordem"": 4, ""marcador"": ""quadrado"", ""texto"": ""Ac.-TSE, de 4/6/2009, no HC n. 131: inexistência de previsão legal quanto à obrigatoriedade de depoimento pessoal de prefeito e vice-prefeito que figuram no polo passivo de AIJE."", ""pagina_inicial"": 436, ""pagina_final"": 436}, {""ordem"": 5, ""marcador"": ""quadrado"", ""texto"": ""Ac.-TSE, de 18/5/2006, no REspe n. 26148: “[...] a apresentação do rol de testemunhas deve ocorrer no momento da inicial ajuizada pelo representante e da defesa protocolada pelo representado”."", ""pagina_inicial"": 436, ""pagina_final"": 436}]",5,,"Ac.-TSE, de 8/10/2020, no RO-El n. 352379; Ac.-TSE, de 9/9/2014, no AgR-REspe n. 80025; Ac.-TSE, de 4/5/2010, no REspe n. 36151; Ac.-TSE, de 4/6/2009, no HC n. 131; Ac.-TSE, de 18/5/2006, no REspe n. 26148",,"Documento: Codigo Eleitoral 2026 anotado Norma: Lei Complementar n. 64, de 18 de maio de 1990 Nome popular/citação curta: Lei de Inelegibilidade Macrogrupo: Lei de Inelegibilidade Grupo do sumário: Lei de Inelegibilidade Dispositivo: Art. 22, V Tipo: inciso Dispositivo pai: Art. 22 ID do dispositivo pai: 007_lei_complementar_64_1990_lei_de_inelegibilidade:137 Páginas: 436-436 Resumo: Art. 22, V, subordinado a Art. 22: findo o prazo da notificação, com ou sem defesa, abrir-se-á prazo de 5 (cinco) dias para inquirição, em uma só assentada, de testemunhas arroladas pelo representante e pelo representado, até o máximo de 6 (seis) para cada um, as quais comparecerão independentemente de intimação; | 5 nota(s) vinculada(s); jurisprudência extraída das notas Referências jurisprudenciais: Ac.-TSE, de 8/10/2020, no RO-El n. 352379; Ac.-TSE, de 9/9/2014, no AgR-REspe n. 80025; Ac.-TSE, de 4/5/2010, no REspe n. 36151; Ac.-TSE, de 4/6/2009, no HC n. 131; Ac.-TSE, de 18/5/2006, no REspe n. 26148 V - findo o prazo da notificação, com ou sem defesa, abrir-se-á prazo de 5 (cinco) dias para inquirição, em uma só assentada, de testemunhas arroladas pelo representante e pelo representado, até o máximo de 6 (seis) para cada um, as quais comparecerão independentemente de intimação; Notas vinculadas: Ac.-TSE, de 8/10/2020, no RO-El n. 352379: desnecessidade de expedição de carta precatória às testemunhas do representante e do representado para o comparecimento à audiência. Ac.-TSE, de 9/9/2014, no AgR-REspe n. 80025 e, de 6/12/2005, no AgRgAg n. 6241: impossibilidade de julgamento antecipado da lide na representação por abuso de poder ou captação ilícita de sufrágio, na hipótese de necessária dilação probatória, com oitiva de testemunhas. Ac.-TSE, de 4/5/2010, no REspe n. 36151: extrapolação do número de testemunhas em virtude da diversidade de fatos suscitados num mesmo processo. Ac.-TSE, de 4/6/2009, no HC n. 131: inexistência de previsão legal quanto à obrigatoriedade de depoimento pessoal de prefeito e vice-prefeito que figuram no polo passivo de AIJE. Ac.-TSE, de 18/5/2006, no REspe n. 26148: “[...] a apresentação do rol de testemunhas deve ocorrer no momento da inicial ajuizada pelo representante e da defesa protocolada pelo representado”.","Art. 22, V, subordinado a Art. 22: findo o prazo da notificação, com ou sem defesa, abrir-se-á prazo de 5 (cinco) dias para inquirição, em uma só assentada, de testemunhas arroladas pelo representante e pelo representado, até o máximo de 6 (seis) para cada um, as quais comparecerão independentemente de intimação; | 5 nota(s) vinculada(s); jurisprudência extraída das notas",testemunhas; representante; representado; respe; prazo; defesa; prefeito; complementar; maio; findo,True,2263,566,007_lei_complementar_64_1990_lei_de_inelegibilidade:145,007_lei_complementar_64_1990_lei_de_inelegibilidade.csv,137,007_lei_complementar_64_1990_lei_de_inelegibilidade:137
