id,ordem_doc,arquivo_fonte,norma_id,norma_titulo,norma_nome_popular,macrogrupo,grupo_sumario,pagina_inicial,pagina_final,hierarquia_normativa,tipo_dispositivo,dispositivo,dispositivo_pai,artigo,paragrafo,inciso,alinea,item,texto_dispositivo,notas_texto,notas_json,qtd_notas,referencias_normativas,referencias_jurisprudenciais,referencias_sumulas,texto_rag,resumo_curto,palavras_chave,incluir_no_rag,chars,tokens_estimados,row_key,csv_arquivo,dispositivo_pai_id,dispositivo_pai_row_key
81,81,Codigo_Eleitoral_2026_anotado.pdf,lei_complementar_64_1990,"Lei Complementar n. 64, de 18 de maio de 1990",Lei de Inelegibilidade,Lei de Inelegibilidade,Lei de Inelegibilidade,424,425,,paragrafo,"Art. 55, §4º",Art. 55,Art. 55,§4º,,,,"§ 4º A inelegibilidade prevista na alínea e do inciso I deste artigo não se aplica aos crimes culposos e àqueles definidos em lei como de menor potencial ofensivo, nem aos crimes de ação penal privada.","Parágrafo 4º acrescido pelo art. 2º da LC n. 135/2010.
Ac.-TSE, de 2/3/2023, no REspEl n. 060008415: a definição do crime de menor potencial ofensivo, para fins de incidência da exceção prevista neste parágrafo, leva em conta o limite máximo da pena previsto em lei, que é aquele ao qual é cominada pena máxima não superior a 2 anos, sendo indiferente a indicação de multa alternativa nos casos acima desse patamar.
Ac.-TSE, de 6/12/2018, no RO n. 060058443: considera-se crime de menor potencial ofensivo aquele cujo quantum máximo da pena privativa de liberdade abstratamente cominada não seja superior a dois anos.
Ac.-TSE, de 7/11/2017, no REspe n. 10554: a incidência da exceção prevista neste parágrafo, quanto aos crimes de menor potencial ofensivo praticados isoladamente ou em concurso material, formal ou em continuidade delitiva, leva em conta a condenação penal pelo prazo máximo da pena abstratamente prevista em lei, independentemente das circunstâncias consideradas para efeito da aplicação da pena em concreto.","[{""ordem"": 1, ""marcador"": ""quadrado"", ""texto"": ""Parágrafo 4º acrescido pelo art. 2º da LC n. 135/2010."", ""pagina_inicial"": 425, ""pagina_final"": 425}, {""ordem"": 2, ""marcador"": ""ticado"", ""texto"": ""Ac.-TSE, de 2/3/2023, no REspEl n. 060008415: a definição do crime de menor potencial ofensivo, para fins de incidência da exceção prevista neste parágrafo, leva em conta o limite máximo da pena previsto em lei, que é aquele ao qual é cominada pena máxima não superior a 2 anos, sendo indiferente a indicação de multa alternativa nos casos acima desse patamar."", ""pagina_inicial"": 425, ""pagina_final"": 425}, {""ordem"": 3, ""marcador"": ""ticado"", ""texto"": ""Ac.-TSE, de 6/12/2018, no RO n. 060058443: considera-se crime de menor potencial ofensivo aquele cujo quantum máximo da pena privativa de liberdade abstratamente cominada não seja superior a dois anos."", ""pagina_inicial"": 425, ""pagina_final"": 425}, {""ordem"": 4, ""marcador"": ""ticado"", ""texto"": ""Ac.-TSE, de 7/11/2017, no REspe n. 10554: a incidência da exceção prevista neste parágrafo, quanto aos crimes de menor potencial ofensivo praticados isoladamente ou em concurso material, formal ou em continuidade delitiva, leva em conta a condenação penal pelo prazo máximo da pena abstratamente prevista em lei, independentemente das circunstâncias consideradas para efeito da aplicação da pena em concreto."", ""pagina_inicial"": 425, ""pagina_final"": 425}]",4,LC n. 135/2010,"Ac.-TSE, de 2/3/2023, no REspEl n. 060008415; Ac.-TSE, de 6/12/2018, no RO n. 060058443; Ac.-TSE, de 7/11/2017, no REspe n. 10554",,"Documento: Codigo Eleitoral 2026 anotado Norma: Lei Complementar n. 64, de 18 de maio de 1990 Nome popular/citação curta: Lei de Inelegibilidade Macrogrupo: Lei de Inelegibilidade Grupo do sumário: Lei de Inelegibilidade Dispositivo: Art. 55, §4º Tipo: paragrafo Dispositivo pai: Art. 55 ID do dispositivo pai: 007_lei_complementar_64_1990_lei_de_inelegibilidade:6 Páginas: 424-425 Resumo: Art. 55, §4º, subordinado a Art. 55: § 4º A inelegibilidade prevista na alínea e do inciso I deste artigo não se aplica aos crimes culposos e àqueles definidos em lei como de menor potencial ofensivo, nem aos crimes de ação penal privada. | 4 nota(s) vinculada(s); jurisprudência extraída das notas Referências jurisprudenciais: Ac.-TSE, de 2/3/2023, no REspEl n. 060008415; Ac.-TSE, de 6/12/2018, no RO n. 060058443; Ac.-TSE, de 7/11/2017, no REspe n. 10554 § 4º A inelegibilidade prevista na alínea e do inciso I deste artigo não se aplica aos crimes culposos e àqueles definidos em lei como de menor potencial ofensivo, nem aos crimes de ação penal privada. Notas vinculadas: Parágrafo 4º acrescido pelo art. 2º da LC n. 135/2010. Ac.-TSE, de 2/3/2023, no REspEl n. 060008415: a definição do crime de menor potencial ofensivo, para fins de incidência da exceção prevista neste parágrafo, leva em conta o limite máximo da pena previsto em lei, que é aquele ao qual é cominada pena máxima não superior a 2 anos, sendo indiferente a indicação de multa alternativa nos casos acima desse patamar. Ac.-TSE, de 6/12/2018, no RO n. 060058443: considera-se crime de menor potencial ofensivo aquele cujo quantum máximo da pena privativa de liberdade abstratamente cominada não seja superior a dois anos. Ac.-TSE, de 7/11/2017, no REspe n. 10554: a incidência da exceção prevista neste parágrafo, quanto aos crimes de menor potencial ofensivo praticados isoladamente ou em concurso material, formal ou em continuidade delitiva, leva em conta a condenação penal pelo prazo máximo da pena abstratamente prevista em lei, independentemente das circunstâncias consideradas para efeito da aplicação da pena em concreto.","Art. 55, §4º, subordinado a Art. 55: § 4º A inelegibilidade prevista na alínea e do inciso I deste artigo não se aplica aos crimes culposos e àqueles definidos em lei como de menor potencial ofensivo, nem aos crimes de ação penal privada. | 4 nota(s) vinculada(s); jurisprudência extraída das notas",pena; prevista; menor; potencial; ofensivo; crimes; paragrafo; maximo; penal; crime,True,2095,524,007_lei_complementar_64_1990_lei_de_inelegibilidade:81,007_lei_complementar_64_1990_lei_de_inelegibilidade.csv,6,007_lei_complementar_64_1990_lei_de_inelegibilidade:6
82,82,Codigo_Eleitoral_2026_anotado.pdf,lei_complementar_64_1990,"Lei Complementar n. 64, de 18 de maio de 1990",Lei de Inelegibilidade,Lei de Inelegibilidade,Lei de Inelegibilidade,425,425,,paragrafo,"Art. 55, §4º-A",Art. 55,Art. 55,§4º-A,,,,§ 4º-A A inelegibilidade prevista na alínea g do inciso I do caput deste artigo não se aplica aos responsáveis que tenham tido suas contas julgadas irregulares sem imputação de débito e sancionados exclusivamente com o pagamento de multa.,"Parágrafo 4º-A acrescido pelo art. 2º da LC n. 184/2021.
Ac.-STF, de 16/9/2024, no RE n. 1459224: correta a interpretação conforme a CF/1988 dada a este parágrafo para restringir sua aplicação aos casos de julgamento de contas de gestores públicos pelos Tribunais de Contas, ficando afastada, portanto, a exceção nele prevista (não incidência de inelegibilidade) para os casos de julgamentos de contas realizados pelo órgão central do Poder Legislativo.","[{""ordem"": 1, ""marcador"": ""quadrado"", ""texto"": ""Parágrafo 4º-A acrescido pelo art. 2º da LC n. 184/2021."", ""pagina_inicial"": 425, ""pagina_final"": 425}, {""ordem"": 2, ""marcador"": ""quadrado"", ""texto"": ""Ac.-STF, de 16/9/2024, no RE n. 1459224: correta a interpretação conforme a CF/1988 dada a este parágrafo para restringir sua aplicação aos casos de julgamento de contas de gestores públicos pelos Tribunais de Contas, ficando afastada, portanto, a exceção nele prevista (não incidência de inelegibilidade) para os casos de julgamentos de contas realizados pelo órgão central do Poder Legislativo."", ""pagina_inicial"": 425, ""pagina_final"": 425}]",2,CF/1988; LC n. 184/2021,"Ac.-STF, de 16/9/2024, no RE n. 1459224",,"Documento: Codigo Eleitoral 2026 anotado Norma: Lei Complementar n. 64, de 18 de maio de 1990 Nome popular/citação curta: Lei de Inelegibilidade Macrogrupo: Lei de Inelegibilidade Grupo do sumário: Lei de Inelegibilidade Dispositivo: Art. 55, §4º-A Tipo: paragrafo Dispositivo pai: Art. 55 ID do dispositivo pai: 007_lei_complementar_64_1990_lei_de_inelegibilidade:6 Páginas: 425-425 Resumo: Art. 55, §4º-A, subordinado a Art. 55: § 4º-A A inelegibilidade prevista na alínea g do inciso I do caput deste artigo não se aplica aos responsáveis que tenham tido suas contas julgadas irregulares sem imputação de débito e sancionados exclusivamente com o pagamento de multa. | 2 nota(s) vinculada(s); jurisprudência extraída das notas Referências jurisprudenciais: Ac.-STF, de 16/9/2024, no RE n. 1459224 § 4º-A A inelegibilidade prevista na alínea g do inciso I do caput deste artigo não se aplica aos responsáveis que tenham tido suas contas julgadas irregulares sem imputação de débito e sancionados exclusivamente com o pagamento de multa. Notas vinculadas: Parágrafo 4º-A acrescido pelo art. 2º da LC n. 184/2021. Ac.-STF, de 16/9/2024, no RE n. 1459224: correta a interpretação conforme a CF/1988 dada a este parágrafo para restringir sua aplicação aos casos de julgamento de contas de gestores públicos pelos Tribunais de Contas, ficando afastada, portanto, a exceção nele prevista (não incidência de inelegibilidade) para os casos de julgamentos de contas realizados pelo órgão central do Poder Legislativo.","Art. 55, §4º-A, subordinado a Art. 55: § 4º-A A inelegibilidade prevista na alínea g do inciso I do caput deste artigo não se aplica aos responsáveis que tenham tido suas contas julgadas irregulares sem imputação de débito e sancionados exclusivamente com o pagamento de multa. | 2 nota(s) vinculada(s); jurisprudência extraída das notas",contas; inelegibilidade; prevista; paragrafo; casos; complementar; maio; alinea; inciso; caput,True,1510,378,007_lei_complementar_64_1990_lei_de_inelegibilidade:82,007_lei_complementar_64_1990_lei_de_inelegibilidade.csv,6,007_lei_complementar_64_1990_lei_de_inelegibilidade:6
83,83,Codigo_Eleitoral_2026_anotado.pdf,lei_complementar_64_1990,"Lei Complementar n. 64, de 18 de maio de 1990",Lei de Inelegibilidade,Lei de Inelegibilidade,Lei de Inelegibilidade,425,425,,paragrafo,"Art. 55, §4º-B",Art. 55,Art. 55,§4º-B,,,,"§ 4º-B. Para fins de incidência das alíneas g e l do inciso I do caput deste artigo, considera-se dolo a vontade livre e consciente de alcançar o resultado ilícito tipificado exclusiva e cumulativamente nos arts. 9º e 10 da Lei n. 8.429, de 2 de junho de 1992 (Lei de Improbidade Administrativa), não bastando a voluntariedade do agente.",,[],0,Lei n. 8.429,,,"Documento: Codigo Eleitoral 2026 anotado Norma: Lei Complementar n. 64, de 18 de maio de 1990 Nome popular/citação curta: Lei de Inelegibilidade Macrogrupo: Lei de Inelegibilidade Grupo do sumário: Lei de Inelegibilidade Dispositivo: Art. 55, §4º-B Tipo: paragrafo Dispositivo pai: Art. 55 ID do dispositivo pai: 007_lei_complementar_64_1990_lei_de_inelegibilidade:6 Páginas: 425-425 Resumo: Art. 55, §4º-B, subordinado a Art. 55: Para fins de incidência das alíneas g e l do inciso I do caput deste artigo, considera-se dolo a vontade livre e consciente de alcançar o resultado ilícito tipificado exclusiva e cumulativamente nos arts. 9º e 10 da Lei n. 8.429, de 2 de junho de 1992 (Lei de Improbidade Administrativa), não bastando a voluntariedade do agente. § 4º-B. Para fins de incidência das alíneas g e l do inciso I do caput deste artigo, considera-se dolo a vontade livre e consciente de alcançar o resultado ilícito tipificado exclusiva e cumulativamente nos arts. 9º e 10 da Lei n. 8.429, de 2 de junho de 1992 (Lei de Improbidade Administrativa), não bastando a voluntariedade do agente.","Art. 55, §4º-B, subordinado a Art. 55: Para fins de incidência das alíneas g e l do inciso I do caput deste artigo, considera-se dolo a vontade livre e consciente de alcançar o resultado ilícito tipificado exclusiva e cumulativamente nos arts. 9º e 10 da Lei n. 8.429, de 2 de junho de 1992 (Lei de Improbidade Administrativa), não bastando a voluntariedade do agente.",complementar; maio; fins; incidencia; alineas; inciso; caput; deste; artigo; considera,True,1098,274,007_lei_complementar_64_1990_lei_de_inelegibilidade:83,007_lei_complementar_64_1990_lei_de_inelegibilidade.csv,6,007_lei_complementar_64_1990_lei_de_inelegibilidade:6
84,84,Codigo_Eleitoral_2026_anotado.pdf,lei_complementar_64_1990,"Lei Complementar n. 64, de 18 de maio de 1990",Lei de Inelegibilidade,Lei de Inelegibilidade,Lei de Inelegibilidade,425,425,,paragrafo,"Art. 55, §4º-C",Art. 55,Art. 55,§4º-C,,,,"§ 4º-C. O mero exercício da função ou o desempenho de competências públicas, sem comprovação de ato doloso com fim ilícito, afasta a responsabilidade por ato de improbidade administrativa, impedindo a incidência do disposto nas alíneas g e l do inciso I do caput deste artigo.",,[],0,,,,"Documento: Codigo Eleitoral 2026 anotado Norma: Lei Complementar n. 64, de 18 de maio de 1990 Nome popular/citação curta: Lei de Inelegibilidade Macrogrupo: Lei de Inelegibilidade Grupo do sumário: Lei de Inelegibilidade Dispositivo: Art. 55, §4º-C Tipo: paragrafo Dispositivo pai: Art. 55 ID do dispositivo pai: 007_lei_complementar_64_1990_lei_de_inelegibilidade:6 Páginas: 425-425 Resumo: Art. 55, §4º-C, subordinado a Art. 55: O mero exercício da função ou o desempenho de competências públicas, sem comprovação de ato doloso com fim ilícito, afasta a responsabilidade por ato de improbidade administrativa, impedindo a incidência do disposto nas alíneas g e l do inciso I do caput deste artigo. § 4º-C. O mero exercício da função ou o desempenho de competências públicas, sem comprovação de ato doloso com fim ilícito, afasta a responsabilidade por ato de improbidade administrativa, impedindo a incidência do disposto nas alíneas g e l do inciso I do caput deste artigo.","Art. 55, §4º-C, subordinado a Art. 55: O mero exercício da função ou o desempenho de competências públicas, sem comprovação de ato doloso com fim ilícito, afasta a responsabilidade por ato de improbidade administrativa, impedindo a incidência do disposto nas alíneas g e l do inciso I do caput deste artigo.",complementar; maio; mero; exercicio; funcao; desempenho; competencias; publicas; comprovacao; doloso,True,976,244,007_lei_complementar_64_1990_lei_de_inelegibilidade:84,007_lei_complementar_64_1990_lei_de_inelegibilidade.csv,6,007_lei_complementar_64_1990_lei_de_inelegibilidade:6
85,85,Codigo_Eleitoral_2026_anotado.pdf,lei_complementar_64_1990,"Lei Complementar n. 64, de 18 de maio de 1990",Lei de Inelegibilidade,Lei de Inelegibilidade,Lei de Inelegibilidade,425,425,,paragrafo,"Art. 55, §4º-D",Art. 55,Art. 55,§4º-D,,,,"§ 4º-D. As ações judiciais ajuizadas pelos mesmos fatos, ou por fatos a eles conexos, que possam acarretar a suspensão dos direitos políticos e a aplicação do disposto nas alíneas e e l do inciso I do caput deste artigo gerarão a inelegibilidade a partir da primeira condenação proferida por órgão colegiado, vedada a incidência de nova restrição à elegibilidade, ainda que tenham sido impostas sanções ulteriores mais gravosas.",,[],0,,,,"Documento: Codigo Eleitoral 2026 anotado Norma: Lei Complementar n. 64, de 18 de maio de 1990 Nome popular/citação curta: Lei de Inelegibilidade Macrogrupo: Lei de Inelegibilidade Grupo do sumário: Lei de Inelegibilidade Dispositivo: Art. 55, §4º-D Tipo: paragrafo Dispositivo pai: Art. 55 ID do dispositivo pai: 007_lei_complementar_64_1990_lei_de_inelegibilidade:6 Páginas: 425-425 Resumo: Art. 55, §4º-D, subordinado a Art. 55: As ações judiciais ajuizadas pelos mesmos fatos, ou por fatos a eles conexos, que possam acarretar a suspensão dos direitos políticos e a aplicação do disposto nas alíneas e e l do inciso I do caput deste artigo gerarão a inelegibilidade a partir da primeira condenação proferida por órgão colegiado, vedada a incidência de nova restrição à elegibilidade, ainda que tenham sido... § 4º-D. As ações judiciais ajuizadas pelos mesmos fatos, ou por fatos a eles conexos, que possam acarretar a suspensão dos direitos políticos e a aplicação do disposto nas alíneas e e l do inciso I do caput deste artigo gerarão a inelegibilidade a partir da primeira condenação proferida por órgão colegiado, vedada a incidência de nova restrição à elegibilidade, ainda que tenham sido impostas sanções ulteriores mais gravosas.","Art. 55, §4º-D, subordinado a Art. 55: As ações judiciais ajuizadas pelos mesmos fatos, ou por fatos a eles conexos, que possam acarretar a suspensão dos direitos políticos e a aplicação do disposto nas alíneas e e l do inciso I do caput deste artigo gerarão a inelegibilidade a partir da primeira condenação proferida por órgão colegiado, vedada a incidência de nova restrição à elegibilidade, ainda que tenham sido...",fatos; complementar; maio; acoes; judiciais; ajuizadas; mesmos; eles; conexos; possam,True,1240,310,007_lei_complementar_64_1990_lei_de_inelegibilidade:85,007_lei_complementar_64_1990_lei_de_inelegibilidade.csv,6,007_lei_complementar_64_1990_lei_de_inelegibilidade:6
86,86,Codigo_Eleitoral_2026_anotado.pdf,lei_complementar_64_1990,"Lei Complementar n. 64, de 18 de maio de 1990",Lei de Inelegibilidade,Lei de Inelegibilidade,Lei de Inelegibilidade,425,425,,paragrafo,"Art. 55, §4º-E",Art. 55,Art. 55,§4º-E,,,,"§ 4º-E. Na hipótese de ocorrência de fatos ímprobos conexos, assim considerados segundo as regras previstas na Lei n. 13.105, de 16 de março de 2015 (Código de Processo Civil), se o autor optar por promover as respectivas ações de improbidade administrativa em processos separados, será observada a contagem do prazo prevista na alínea l do inciso I do caput deste artigo a partir da primeira condenação proferida ou confirmada por órgão judicial colegiado, ainda que haja decisões colegiadas posteriores, inclusive com sanções mais gravosas.",Parágrafos 4º-B a 4º-E acrescidos pelo art. 2º da LC n. 219/2025.,"[{""ordem"": 1, ""marcador"": ""quadrado"", ""texto"": ""Parágrafos 4º-B a 4º-E acrescidos pelo art. 2º da LC n. 219/2025."", ""pagina_inicial"": 425, ""pagina_final"": 425}]",1,Lei n. 13.105; LC n. 219/2025,,,"Documento: Codigo Eleitoral 2026 anotado Norma: Lei Complementar n. 64, de 18 de maio de 1990 Nome popular/citação curta: Lei de Inelegibilidade Macrogrupo: Lei de Inelegibilidade Grupo do sumário: Lei de Inelegibilidade Dispositivo: Art. 55, §4º-E Tipo: paragrafo Dispositivo pai: Art. 55 ID do dispositivo pai: 007_lei_complementar_64_1990_lei_de_inelegibilidade:6 Páginas: 425-425 Resumo: Art. 55, §4º-E, subordinado a Art. 55: Na hipótese de ocorrência de fatos ímprobos conexos, assim considerados segundo as regras previstas na Lei n. 13.105, de 16 de março de 2015 (Código de Processo Civil), se o autor optar por promover as respectivas ações de improbidade administrativa em processos separados, será observada a contagem do prazo prevista na alínea l do inciso I do caput deste artigo a partir da... § 4º-E. Na hipótese de ocorrência de fatos ímprobos conexos, assim considerados segundo as regras previstas na Lei n. 13.105, de 16 de março de 2015 (Código de Processo Civil), se o autor optar por promover as respectivas ações de improbidade administrativa em processos separados, será observada a contagem do prazo prevista na alínea l do inciso I do caput deste artigo a partir da primeira condenação proferida ou confirmada por órgão judicial colegiado, ainda que haja decisões colegiadas posteriores, inclusive com sanções mais gravosas. Notas vinculadas: Parágrafos 4º-B a 4º-E acrescidos pelo art. 2º da LC n. 219/2025.","Art. 55, §4º-E, subordinado a Art. 55: Na hipótese de ocorrência de fatos ímprobos conexos, assim considerados segundo as regras previstas na Lei n. 13.105, de 16 de março de 2015 (Código de Processo Civil), se o autor optar por promover as respectivas ações de improbidade administrativa em processos separados, será observada a contagem do prazo prevista na alínea l do inciso I do caput deste artigo a partir da...",complementar; maio; hipotese; ocorrencia; fatos; improbos; conexos; assim; considerados; segundo,True,1436,359,007_lei_complementar_64_1990_lei_de_inelegibilidade:86,007_lei_complementar_64_1990_lei_de_inelegibilidade.csv,6,007_lei_complementar_64_1990_lei_de_inelegibilidade:6
87,87,Codigo_Eleitoral_2026_anotado.pdf,lei_complementar_64_1990,"Lei Complementar n. 64, de 18 de maio de 1990",Lei de Inelegibilidade,Lei de Inelegibilidade,Lei de Inelegibilidade,426,426,,paragrafo,"Art. 55, §4º-F",Art. 55,Art. 55,§4º-F,,,,§ 4º-F. (Vetado).,,[],0,,,,"Documento: Codigo Eleitoral 2026 anotado Norma: Lei Complementar n. 64, de 18 de maio de 1990 Nome popular/citação curta: Lei de Inelegibilidade Macrogrupo: Lei de Inelegibilidade Grupo do sumário: Lei de Inelegibilidade Dispositivo: Art. 55, §4º-F Tipo: paragrafo Dispositivo pai: Art. 55 ID do dispositivo pai: 007_lei_complementar_64_1990_lei_de_inelegibilidade:6 Páginas: 426-426 Resumo: Art. 55, §4º-F, subordinado a Art. 55: (Vetado). | há marcação de revogação/cancelamento/veto § 4º-F. (Vetado).","Art. 55, §4º-F, subordinado a Art. 55: (Vetado). | há marcação de revogação/cancelamento/veto",complementar; maio; vetado,True,503,126,007_lei_complementar_64_1990_lei_de_inelegibilidade:87,007_lei_complementar_64_1990_lei_de_inelegibilidade.csv,6,007_lei_complementar_64_1990_lei_de_inelegibilidade:6
88,88,Codigo_Eleitoral_2026_anotado.pdf,lei_complementar_64_1990,"Lei Complementar n. 64, de 18 de maio de 1990",Lei de Inelegibilidade,Lei de Inelegibilidade,Lei de Inelegibilidade,426,426,,paragrafo,"Art. 55, §5º",Art. 55,Art. 55,§5º,,,,"§ 5º A renúncia para atender à desincompatibilização com vistas a candidatura a cargo eletivo ou para assunção de mandato não gerará a inelegibilidade prevista na alínea k, a menos que a Justiça Eleitoral reconheça fraude ao disposto nesta lei complementar.",Parágrafo 5º acrescido pelo art. 2º da LC n. 135/2010.,"[{""ordem"": 1, ""marcador"": ""quadrado"", ""texto"": ""Parágrafo 5º acrescido pelo art. 2º da LC n. 135/2010."", ""pagina_inicial"": 426, ""pagina_final"": 426}]",1,LC n. 135/2010,,,"Documento: Codigo Eleitoral 2026 anotado Norma: Lei Complementar n. 64, de 18 de maio de 1990 Nome popular/citação curta: Lei de Inelegibilidade Macrogrupo: Lei de Inelegibilidade Grupo do sumário: Lei de Inelegibilidade Dispositivo: Art. 55, §5º Tipo: paragrafo Dispositivo pai: Art. 55 ID do dispositivo pai: 007_lei_complementar_64_1990_lei_de_inelegibilidade:6 Páginas: 426-426 Resumo: Art. 55, §5º, subordinado a Art. 55: § 5º A renúncia para atender à desincompatibilização com vistas a candidatura a cargo eletivo ou para assunção de mandato não gerará a inelegibilidade prevista na alínea k, a menos que a Justiça Eleitoral reconheça fraude ao disposto nesta lei complementar. | 1 nota(s) vinculada(s) § 5º A renúncia para atender à desincompatibilização com vistas a candidatura a cargo eletivo ou para assunção de mandato não gerará a inelegibilidade prevista na alínea k, a menos que a Justiça Eleitoral reconheça fraude ao disposto nesta lei complementar. Notas vinculadas: Parágrafo 5º acrescido pelo art. 2º da LC n. 135/2010.","Art. 55, §5º, subordinado a Art. 55: § 5º A renúncia para atender à desincompatibilização com vistas a candidatura a cargo eletivo ou para assunção de mandato não gerará a inelegibilidade prevista na alínea k, a menos que a Justiça Eleitoral reconheça fraude ao disposto nesta lei complementar. | 1 nota(s) vinculada(s)",complementar; maio; renuncia; atender; desincompatibilizacao; vistas; candidatura; cargo; eletivo; assuncao,True,1040,260,007_lei_complementar_64_1990_lei_de_inelegibilidade:88,007_lei_complementar_64_1990_lei_de_inelegibilidade.csv,6,007_lei_complementar_64_1990_lei_de_inelegibilidade:6
89,89,Codigo_Eleitoral_2026_anotado.pdf,lei_complementar_64_1990,"Lei Complementar n. 64, de 18 de maio de 1990",Lei de Inelegibilidade,Lei de Inelegibilidade,Lei de Inelegibilidade,426,426,,paragrafo,"Art. 55, §6º",Art. 55,Art. 55,§6º,,,,§ 6º (Vetado).,,[],0,,,,"Documento: Codigo Eleitoral 2026 anotado Norma: Lei Complementar n. 64, de 18 de maio de 1990 Nome popular/citação curta: Lei de Inelegibilidade Macrogrupo: Lei de Inelegibilidade Grupo do sumário: Lei de Inelegibilidade Dispositivo: Art. 55, §6º Tipo: paragrafo Dispositivo pai: Art. 55 ID do dispositivo pai: 007_lei_complementar_64_1990_lei_de_inelegibilidade:6 Páginas: 426-426 Resumo: Art. 55, §6º, subordinado a Art. 55: § 6º (Vetado). | há marcação de revogação/cancelamento/veto § 6º (Vetado).","Art. 55, §6º, subordinado a Art. 55: § 6º (Vetado). | há marcação de revogação/cancelamento/veto",complementar; maio; vetado,True,501,125,007_lei_complementar_64_1990_lei_de_inelegibilidade:89,007_lei_complementar_64_1990_lei_de_inelegibilidade.csv,6,007_lei_complementar_64_1990_lei_de_inelegibilidade:6
