id,ordem_doc,arquivo_fonte,norma_id,norma_titulo,norma_nome_popular,macrogrupo,grupo_sumario,pagina_inicial,pagina_final,hierarquia_normativa,tipo_dispositivo,dispositivo,dispositivo_pai,artigo,paragrafo,inciso,alinea,item,texto_dispositivo,notas_texto,notas_json,qtd_notas,referencias_normativas,referencias_jurisprudenciais,referencias_sumulas,texto_rag,resumo_curto,palavras_chave,incluir_no_rag,chars,tokens_estimados,row_key,csv_arquivo,dispositivo_pai_id,dispositivo_pai_row_key
1,1,Codigo_Eleitoral_2026_anotado.pdf,lei_complementar_64_1990,"Lei Complementar n. 64, de 18 de maio de 1990",Lei de Inelegibilidade,Lei de Inelegibilidade,Lei de Inelegibilidade,407,407,,norma,"Lei Complementar n. 64, de 18 de maio de 1990",,,,,,,"Estabelece, de acordo com o art. 14, § 9º, da Constituição Federal, casos de inelegibilidade, prazos de cessação e determina outras providências. O PRESIDENTE DA REPÚBLICA Faço saber que o Congresso Nacional decreta e eu sanciono a seguinte lei:","Ac.-TSE, de 14/2/2013, no AgR-REspe n. 9677 e, de 4/9/2012, no AgR-REspe n. 23046: “No julgamento das ADCs n. 29 e 30 e da ADI n. 4.578, o STF assentou que a aplicação das causas de inelegibilidade instituídas ou alteradas pela LC n. 135/2010 a fatos anteriores à sua vigência não viola a Constituição Federal”.","[{""ordem"": 1, ""marcador"": ""quadrado"", ""texto"": ""Ac.-TSE, de 14/2/2013, no AgR-REspe n. 9677 e, de 4/9/2012, no AgR-REspe n. 23046: “No julgamento das ADCs n. 29 e 30 e da ADI n. 4.578, o STF assentou que a aplicação das causas de inelegibilidade instituídas ou alteradas pela LC n. 135/2010 a fatos anteriores à sua vigência não viola a Constituição Federal”."", ""pagina_inicial"": 407, ""pagina_final"": 407}]",1,LC n. 135/2010,"Ac.-TSE, de 14/2/2013, no AgR-REspe n. 9677; AgR-REspe n. 23046; ADI n. 4.578",,"Documento: Codigo Eleitoral 2026 anotado Norma: Lei Complementar n. 64, de 18 de maio de 1990 Nome popular/citação curta: Lei de Inelegibilidade Macrogrupo: Lei de Inelegibilidade Grupo do sumário: Lei de Inelegibilidade Dispositivo: Lei Complementar n. 64, de 18 de maio de 1990 Tipo: norma Páginas: 407-407 Resumo: Norma Lei de Inelegibilidade: Estabelece, de acordo com o art. 14, § 9º, da Constituição Federal, casos de inelegibilidade, prazos de cessação e determina outras providências. | 1 nota(s) vinculada(s); jurisprudência extraída das notas Referências jurisprudenciais: Ac.-TSE, de 14/2/2013, no AgR-REspe n. 9677; AgR-REspe n. 23046; ADI n. 4.578 Estabelece, de acordo com o art. 14, § 9º, da Constituição Federal, casos de inelegibilidade, prazos de cessação e determina outras providências. O PRESIDENTE DA REPÚBLICA Faço saber que o Congresso Nacional decreta e eu sanciono a seguinte lei: Notas vinculadas: Ac.-TSE, de 14/2/2013, no AgR-REspe n. 9677 e, de 4/9/2012, no AgR-REspe n. 23046: “No julgamento das ADCs n. 29 e 30 e da ADI n. 4.578, o STF assentou que a aplicação das causas de inelegibilidade instituídas ou alteradas pela LC n. 135/2010 a fatos anteriores à sua vigência não viola a Constituição Federal”.","Norma Lei de Inelegibilidade: Estabelece, de acordo com o art. 14, § 9º, da Constituição Federal, casos de inelegibilidade, prazos de cessação e determina outras providências. | 1 nota(s) vinculada(s); jurisprudência extraída das notas",complementar; maio; constituicao; federal; inelegibilidade; respe; estabelece; acordo; casos; prazos,True,1236,309,007_lei_complementar_64_1990_lei_de_inelegibilidade:1,007_lei_complementar_64_1990_lei_de_inelegibilidade.csv,,
2,2,Codigo_Eleitoral_2026_anotado.pdf,lei_complementar_64_1990,"Lei Complementar n. 64, de 18 de maio de 1990",Lei de Inelegibilidade,Lei de Inelegibilidade,Lei de Inelegibilidade,407,407,,artigo,Art. 1º,"Lei Complementar n. 64, de 18 de maio de 1990",Art. 1º,,,,,Art. 1º São inelegíveis:,,[],0,,,,"Documento: Codigo Eleitoral 2026 anotado Norma: Lei Complementar n. 64, de 18 de maio de 1990 Nome popular/citação curta: Lei de Inelegibilidade Macrogrupo: Lei de Inelegibilidade Grupo do sumário: Lei de Inelegibilidade Dispositivo: Art. 1º Tipo: artigo Dispositivo pai: Lei Complementar n. 64, de 18 de maio de 1990 ID do dispositivo pai: 007_lei_complementar_64_1990_lei_de_inelegibilidade:1 Páginas: 407-407 Resumo: Art. 1º, subordinado a Lei Complementar n. 64, de 18 de maio de 1990: São inelegíveis: Art. 1º São inelegíveis:","Art. 1º, subordinado a Lei Complementar n. 64, de 18 de maio de 1990: São inelegíveis:",complementar; maio; inelegiveis,True,531,133,007_lei_complementar_64_1990_lei_de_inelegibilidade:2,007_lei_complementar_64_1990_lei_de_inelegibilidade.csv,1,007_lei_complementar_64_1990_lei_de_inelegibilidade:1
3,3,Codigo_Eleitoral_2026_anotado.pdf,lei_complementar_64_1990,"Lei Complementar n. 64, de 18 de maio de 1990",Lei de Inelegibilidade,Lei de Inelegibilidade,Lei de Inelegibilidade,407,407,,inciso,"Art. 1º, I",Art. 1º,Art. 1º,,I,,,I - para qualquer cargo:,"Ac.-STF, de 16/2/2012, nas ADC n. 29 e 30: constitucionalidade das hipóteses de inelegibilidade instituídas pelas alíneas c, d, f, g, h, j, m, n, o, p e q deste inciso, introduzidas pela LC n. 135/2010.","[{""ordem"": 1, ""marcador"": ""quadrado"", ""texto"": ""Ac.-STF, de 16/2/2012, nas ADC n. 29 e 30: constitucionalidade das hipóteses de inelegibilidade instituídas pelas alíneas c, d, f, g, h, j, m, n, o, p e q deste inciso, introduzidas pela LC n. 135/2010."", ""pagina_inicial"": 407, ""pagina_final"": 407}]",1,LC n. 135/2010,"Ac.-STF, de 16/2/2012, nas ADC n. 29",,"Documento: Codigo Eleitoral 2026 anotado Norma: Lei Complementar n. 64, de 18 de maio de 1990 Nome popular/citação curta: Lei de Inelegibilidade Macrogrupo: Lei de Inelegibilidade Grupo do sumário: Lei de Inelegibilidade Dispositivo: Art. 1º, I Tipo: inciso Dispositivo pai: Art. 1º ID do dispositivo pai: 007_lei_complementar_64_1990_lei_de_inelegibilidade:2 Páginas: 407-407 Resumo: Art. 1º, I, subordinado a Art. 1º: para qualquer cargo: | 1 nota(s) vinculada(s); jurisprudência extraída das notas Referências jurisprudenciais: Ac.-STF, de 16/2/2012, nas ADC n. 29 I - para qualquer cargo: Notas vinculadas: Ac.-STF, de 16/2/2012, nas ADC n. 29 e 30: constitucionalidade das hipóteses de inelegibilidade instituídas pelas alíneas c, d, f, g, h, j, m, n, o, p e q deste inciso, introduzidas pela LC n. 135/2010.","Art. 1º, I, subordinado a Art. 1º: para qualquer cargo: | 1 nota(s) vinculada(s); jurisprudência extraída das notas",complementar; maio; qualquer; cargo; constitucionalidade; hipoteses; inelegibilidade; instituidas; alineas; deste,True,813,203,007_lei_complementar_64_1990_lei_de_inelegibilidade:3,007_lei_complementar_64_1990_lei_de_inelegibilidade.csv,2,007_lei_complementar_64_1990_lei_de_inelegibilidade:2
4,4,Codigo_Eleitoral_2026_anotado.pdf,lei_complementar_64_1990,"Lei Complementar n. 64, de 18 de maio de 1990",Lei de Inelegibilidade,Lei de Inelegibilidade,Lei de Inelegibilidade,407,407,,alinea,"Art. 1º, I, a)","Art. 1º, I",Art. 1º,,I,a),,a) os inalistáveis e os analfabetos;,"V. Súm.-TSE n. 15/2016 e 55/2016.
Ac.-TSE, de 18/9/2018, no RO n. 060247518: a aferição da alfabetização deve ser feita com o menor rigor possível, não podendo ser considerado analfabeto o candidato que possuir capacidade mínima de escrita e leitura; Ac.-TSE, de 12/4/2018, no PA n. 51371: “A realidade multifacetada da sociedade brasileira desaconselha que o analfabetismo seja avaliado a partir de critérios rígidos, abstratos e estanques. Do contrário, em redutos onde o analfabetismo seja a regra, o domínio político se perpetuaria como um monopólio das elites”.
Ac.-TSE, de 27/9/2016, no REspe n. 8941: o exame da causa de inelegibilidade referida nesta alínea deve ocorrer em conjunto com os valores constitucionais da cidadania, da dignidade da pessoa humana e da isonomia, levando a concluir que analfabetismo de natureza educacional não pode nem deve significar analfabetismo para a vida política.
Ac.-TSE, de 21/8/2012, no AgR-REspe n. 424839: a inelegibilidade dos analfabetos é de legalidade estrita, vedada a interpretação extensiva, devendo ser exigido apenas que o candidato saiba ler e escrever minimamente, de modo que se possa evidenciar eventual incapacidade absoluta de compreensão e de expressão da língua.","[{""ordem"": 1, ""marcador"": ""quadrado"", ""texto"": ""V. Súm.-TSE n. 15/2016 e 55/2016."", ""pagina_inicial"": 407, ""pagina_final"": 407}, {""ordem"": 2, ""marcador"": ""quadrado"", ""texto"": ""Ac.-TSE, de 18/9/2018, no RO n. 060247518: a aferição da alfabetização deve ser feita com o menor rigor possível, não podendo ser considerado analfabeto o candidato que possuir capacidade mínima de escrita e leitura; Ac.-TSE, de 12/4/2018, no PA n. 51371: “A realidade multifacetada da sociedade brasileira desaconselha que o analfabetismo seja avaliado a partir de critérios rígidos, abstratos e estanques. Do contrário, em redutos onde o analfabetismo seja a regra, o domínio político se perpetuaria como um monopólio das elites”."", ""pagina_inicial"": 407, ""pagina_final"": 407}, {""ordem"": 3, ""marcador"": ""quadrado"", ""texto"": ""Ac.-TSE, de 27/9/2016, no REspe n. 8941: o exame da causa de inelegibilidade referida nesta alínea deve ocorrer em conjunto com os valores constitucionais da cidadania, da dignidade da pessoa humana e da isonomia, levando a concluir que analfabetismo de natureza educacional não pode nem deve significar analfabetismo para a vida política."", ""pagina_inicial"": 407, ""pagina_final"": 407}, {""ordem"": 4, ""marcador"": ""quadrado"", ""texto"": ""Ac.-TSE, de 21/8/2012, no AgR-REspe n. 424839: a inelegibilidade dos analfabetos é de legalidade estrita, vedada a interpretação extensiva, devendo ser exigido apenas que o candidato saiba ler e escrever minimamente, de modo que se possa evidenciar eventual incapacidade absoluta de compreensão e de expressão da língua."", ""pagina_inicial"": 407, ""pagina_final"": 407}]",4,,"Ac.-TSE, de 18/9/2018, no RO n. 060247518; Ac.-TSE, de 12/4/2018, no PA n. 51371; Ac.-TSE, de 27/9/2016, no REspe n. 8941; Ac.-TSE, de 21/8/2012, no AgR-REspe n. 424839",Súm.-TSE n. 15/2016,"Documento: Codigo Eleitoral 2026 anotado Norma: Lei Complementar n. 64, de 18 de maio de 1990 Nome popular/citação curta: Lei de Inelegibilidade Macrogrupo: Lei de Inelegibilidade Grupo do sumário: Lei de Inelegibilidade Dispositivo: Art. 1º, I, a) Tipo: alinea Dispositivo pai: Art. 1º, I ID do dispositivo pai: 007_lei_complementar_64_1990_lei_de_inelegibilidade:3 Páginas: 407-407 Resumo: Art. 1º, I, a), subordinado a Art. 1º, I: os inalistáveis e os analfabetos; | 4 nota(s) vinculada(s); jurisprudência extraída das notas Referências jurisprudenciais: Ac.-TSE, de 18/9/2018, no RO n. 060247518; Ac.-TSE, de 12/4/2018, no PA n. 51371; Ac.-TSE, de 27/9/2016, no REspe n. 8941; Ac.-TSE, de 21/8/2012, no AgR-REspe n. 424839 a) os inalistáveis e os analfabetos; Notas vinculadas: V. Súm.-TSE n. 15/2016 e 55/2016. Ac.-TSE, de 18/9/2018, no RO n. 060247518: a aferição da alfabetização deve ser feita com o menor rigor possível, não podendo ser considerado analfabeto o candidato que possuir capacidade mínima de escrita e leitura; Ac.-TSE, de 12/4/2018, no PA n. 51371: “A realidade multifacetada da sociedade brasileira desaconselha que o analfabetismo seja avaliado a partir de critérios rígidos, abstratos e estanques. Do contrário, em redutos onde o analfabetismo seja a regra, o domínio político se perpetuaria como um monopólio das elites”. Ac.-TSE, de 27/9/2016, no REspe n. 8941: o exame da causa de inelegibilidade referida nesta alínea deve ocorrer em conjunto com os valores constitucionais da cidadania, da dignidade da pessoa humana e da isonomia, levando a concluir que analfabetismo de natureza educacional não pode nem deve significar analfabetismo para a vida política. Ac.-TSE, de 21/8/2012, no AgR-REspe n. 424839: a inelegibilidade dos analfabetos é de legalidade estrita, vedada a interpretação extensiva, devendo ser exigido apenas que o candidato saiba ler e escrever minimamente, de modo que se possa evidenciar eventual incapacidade absoluta de compreensão e de expressão da língua.","Art. 1º, I, a), subordinado a Art. 1º, I: os inalistáveis e os analfabetos; | 4 nota(s) vinculada(s); jurisprudência extraída das notas",analfabetismo; deve; analfabetos; candidato; seja; respe; inelegibilidade; complementar; maio; inalistaveis,True,2009,502,007_lei_complementar_64_1990_lei_de_inelegibilidade:4,007_lei_complementar_64_1990_lei_de_inelegibilidade.csv,3,007_lei_complementar_64_1990_lei_de_inelegibilidade:3
5,5,Codigo_Eleitoral_2026_anotado.pdf,lei_complementar_64_1990,"Lei Complementar n. 64, de 18 de maio de 1990",Lei de Inelegibilidade,Lei de Inelegibilidade,Lei de Inelegibilidade,407,407,,alinea,"Art. 1º, I, b)","Art. 1º, I",Art. 1º,,I,b),,"b) os membros do Congresso Nacional, das Assembleias Legislativas, da Câmara Legislativa e das Câmaras Municipais que tenham perdido os respectivos mandatos por infringência do disposto nos incisos I e II do caput do",,[],0,,,,"Documento: Codigo Eleitoral 2026 anotado Norma: Lei Complementar n. 64, de 18 de maio de 1990 Nome popular/citação curta: Lei de Inelegibilidade Macrogrupo: Lei de Inelegibilidade Grupo do sumário: Lei de Inelegibilidade Dispositivo: Art. 1º, I, b) Tipo: alinea Dispositivo pai: Art. 1º, I ID do dispositivo pai: 007_lei_complementar_64_1990_lei_de_inelegibilidade:3 Páginas: 407-407 Resumo: Art. 1º, I, b), subordinado a Art. 1º, I: os membros do Congresso Nacional, das Assembleias Legislativas, da Câmara Legislativa e das Câmaras Municipais que tenham perdido os respectivos mandatos por infringência do disposto nos incisos I e II do caput do b) os membros do Congresso Nacional, das Assembleias Legislativas, da Câmara Legislativa e das Câmaras Municipais que tenham perdido os respectivos mandatos por infringência do disposto nos incisos I e II do caput do","Art. 1º, I, b), subordinado a Art. 1º, I: os membros do Congresso Nacional, das Assembleias Legislativas, da Câmara Legislativa e das Câmaras Municipais que tenham perdido os respectivos mandatos por infringência do disposto nos incisos I e II do caput do",complementar; maio; membros; congresso; nacional; assembleias; legislativas; camara; legislativa; camaras,True,864,216,007_lei_complementar_64_1990_lei_de_inelegibilidade:5,007_lei_complementar_64_1990_lei_de_inelegibilidade.csv,3,007_lei_complementar_64_1990_lei_de_inelegibilidade:3
6,6,Codigo_Eleitoral_2026_anotado.pdf,lei_complementar_64_1990,"Lei Complementar n. 64, de 18 de maio de 1990",Lei de Inelegibilidade,Lei de Inelegibilidade,Lei de Inelegibilidade,407,407,,artigo,Art. 55,"Lei Complementar n. 64, de 18 de maio de 1990",Art. 55,,,,,"art. 55 da Constituição Federal ou dos dispositivos equivalentes sobre perda de mandato das Constituições estaduais e das Leis Orgânicas dos municípios e do Distrito Federal, nos 8 (oito) anos subsequentes à data da decisão que decretar a perda do cargo eletivo;","Alínea b com redação dada pelo art. 2º da LC
n. 219/2025.
Ac.-TSE, de 16/9/2021, no AgR-REspEl n. 060029974: ante a inexistência de evidências de nulidade no ato legislativo, a revogação de ato próprio, por critérios políticos de oportunidade e conveniência, não configura fato superveniente capaz de afastar a inelegibilidade.","[{""ordem"": 1, ""marcador"": ""continuação"", ""texto"": ""Alínea b com redação dada pelo art. 2º da LC"", ""pagina_inicial"": 407, ""pagina_final"": 407}, {""ordem"": 2, ""marcador"": ""quadrado"", ""texto"": ""n. 219/2025."", ""pagina_inicial"": 407, ""pagina_final"": 407}, {""ordem"": 3, ""marcador"": ""quadrado"", ""texto"": ""Ac.-TSE, de 16/9/2021, no AgR-REspEl n. 060029974: ante a inexistência de evidências de nulidade no ato legislativo, a revogação de ato próprio, por critérios políticos de oportunidade e conveniência, não configura fato superveniente capaz de afastar a inelegibilidade."", ""pagina_inicial"": 407, ""pagina_final"": 407}]",3,,"Ac.-TSE, de 16/9/2021, no AgR-REspEl n. 060029974",,"Documento: Codigo Eleitoral 2026 anotado Norma: Lei Complementar n. 64, de 18 de maio de 1990 Nome popular/citação curta: Lei de Inelegibilidade Macrogrupo: Lei de Inelegibilidade Grupo do sumário: Lei de Inelegibilidade Dispositivo: Art. 55 Tipo: artigo Dispositivo pai: Lei Complementar n. 64, de 18 de maio de 1990 ID do dispositivo pai: 007_lei_complementar_64_1990_lei_de_inelegibilidade:1 Páginas: 407-407 Resumo: Art. 55, subordinado a Lei Complementar n. 64, de 18 de maio de 1990: da Constituição Federal ou dos dispositivos equivalentes sobre perda de mandato das Constituições estaduais e das Leis Orgânicas dos municípios e do Distrito Federal, nos 8 (oito) anos subsequentes à data da decisão que decretar a perda do cargo eletivo; | 3 nota(s) vinculada(s); jurisprudência extraída das notas Referências jurisprudenciais: Ac.-TSE, de 16/9/2021, no AgR-REspEl n. 060029974 art. 55 da Constituição Federal ou dos dispositivos equivalentes sobre perda de mandato das Constituições estaduais e das Leis Orgânicas dos municípios e do Distrito Federal, nos 8 (oito) anos subsequentes à data da decisão que decretar a perda do cargo eletivo; Notas vinculadas: Alínea b com redação dada pelo art. 2º da LC n. 219/2025. Ac.-TSE, de 16/9/2021, no AgR-REspEl n. 060029974: ante a inexistência de evidências de nulidade no ato legislativo, a revogação de ato próprio, por critérios políticos de oportunidade e conveniência, não configura fato superveniente capaz de afastar a inelegibilidade.","Art. 55, subordinado a Lei Complementar n. 64, de 18 de maio de 1990: da Constituição Federal ou dos dispositivos equivalentes sobre perda de mandato das Constituições estaduais e das Leis Orgânicas dos municípios e do Distrito Federal, nos 8 (oito) anos subsequentes à data da decisão que decretar a perda do cargo eletivo; | 3 nota(s) vinculada(s); jurisprudência extraída das notas",federal; perda; complementar; maio; constituicao; dispositivos; equivalentes; sobre; mandato; constituicoes,True,1493,373,007_lei_complementar_64_1990_lei_de_inelegibilidade:6,007_lei_complementar_64_1990_lei_de_inelegibilidade.csv,1,007_lei_complementar_64_1990_lei_de_inelegibilidade:1
7,7,Codigo_Eleitoral_2026_anotado.pdf,lei_complementar_64_1990,"Lei Complementar n. 64, de 18 de maio de 1990",Lei de Inelegibilidade,Lei de Inelegibilidade,Lei de Inelegibilidade,408,408,,alinea,"Art. 55, c)",Art. 55,Art. 55,,,c),,"c) o governador e o vice-governador de estado e do Distrito Federal e o prefeito e o vice-prefeito que perderem seus cargos eletivos por infringência do disposto na Constituição estadual, na Lei Orgânica do Distrito Federal ou na Lei Orgânica do município, nos 8 (oito) anos subsequentes à data da decisão que decretar a perda do cargo eletivo;","Alínea c com redação dada pelo art. 2º da
LC n. 219/2025.
Ac.-TSE, de 27/9/2022, no RO-El n. 060300745 e, de 3/10/2018, no RO n. 060051954: incidência de inelegibilidade se a cassação do mandato tiver decorrido de violação das disposições previstas na Lei n. 1.079/1950 ou no DL n. 201/1967, em temas de crimes de responsabilidade que não podem ser objeto de lei de iniciativa dos entes federativos.
Ac.-TSE, de 4/10/2018, no RO n. 060238825: o impeachment de presidente da República não se enquadra na inelegibilidade desta alínea, porque possui regramento próprio no art. 52, I e parágrafo único da CF/1988, nem na alínea e deste inciso porquanto, dada sua natureza, a condenação por crime de responsabilidade não se equipara a uma “decisão transitada em julgado ou proferida por órgão judicial colegiado”.","[{""ordem"": 1, ""marcador"": ""continuação"", ""texto"": ""Alínea c com redação dada pelo art. 2º da"", ""pagina_inicial"": 408, ""pagina_final"": 408}, {""ordem"": 2, ""marcador"": ""quadrado"", ""texto"": ""LC n. 219/2025."", ""pagina_inicial"": 408, ""pagina_final"": 408}, {""ordem"": 3, ""marcador"": ""ticado"", ""texto"": ""Ac.-TSE, de 27/9/2022, no RO-El n. 060300745 e, de 3/10/2018, no RO n. 060051954: incidência de inelegibilidade se a cassação do mandato tiver decorrido de violação das disposições previstas na Lei n. 1.079/1950 ou no DL n. 201/1967, em temas de crimes de responsabilidade que não podem ser objeto de lei de iniciativa dos entes federativos."", ""pagina_inicial"": 408, ""pagina_final"": 408}, {""ordem"": 4, ""marcador"": ""quadrado"", ""texto"": ""Ac.-TSE, de 4/10/2018, no RO n. 060238825: o impeachment de presidente da República não se enquadra na inelegibilidade desta alínea, porque possui regramento próprio no art. 52, I e parágrafo único da CF/1988, nem na alínea e deste inciso porquanto, dada sua natureza, a condenação por crime de responsabilidade não se equipara a uma “decisão transitada em julgado ou proferida por órgão judicial colegiado”."", ""pagina_inicial"": 408, ""pagina_final"": 408}]",4,CF/1988; Lei n. 1.079/1950; LC n. 219/2025,"Ac.-TSE, de 27/9/2022, no RO-El n. 060300745; Ac.-TSE, de 4/10/2018, no RO n. 060238825; RO n. 060051954",,"Documento: Codigo Eleitoral 2026 anotado Norma: Lei Complementar n. 64, de 18 de maio de 1990 Nome popular/citação curta: Lei de Inelegibilidade Macrogrupo: Lei de Inelegibilidade Grupo do sumário: Lei de Inelegibilidade Dispositivo: Art. 55, c) Tipo: alinea Dispositivo pai: Art. 55 ID do dispositivo pai: 007_lei_complementar_64_1990_lei_de_inelegibilidade:6 Páginas: 408-408 Resumo: Art. 55, c), subordinado a Art. 55: o governador e o vice-governador de estado e do Distrito Federal e o prefeito e o vice-prefeito que perderem seus cargos eletivos por infringência do disposto na Constituição estadual, na Lei Orgânica do Distrito Federal ou na Lei Orgânica do município, nos 8 (oito) anos subsequentes à data da decisão que decretar a perda do cargo eletivo; | 4 nota(s) vinculada(s); jurisprudência... Referências jurisprudenciais: Ac.-TSE, de 27/9/2022, no RO-El n. 060300745; Ac.-TSE, de 4/10/2018, no RO n. 060238825; RO n. 060051954 c) o governador e o vice-governador de estado e do Distrito Federal e o prefeito e o vice-prefeito que perderem seus cargos eletivos por infringência do disposto na Constituição estadual, na Lei Orgânica do Distrito Federal ou na Lei Orgânica do município, nos 8 (oito) anos subsequentes à data da decisão que decretar a perda do cargo eletivo; Notas vinculadas: Alínea c com redação dada pelo art. 2º da LC n. 219/2025. Ac.-TSE, de 27/9/2022, no RO-El n. 060300745 e, de 3/10/2018, no RO n. 060051954: incidência de inelegibilidade se a cassação do mandato tiver decorrido de violação das disposições previstas na Lei n. 1.079/1950 ou no DL n. 201/1967, em temas de crimes de responsabilidade que não podem ser objeto de lei de iniciativa dos entes federativos. Ac.-TSE, de 4/10/2018, no RO n. 060238825: o impeachment de presidente da República não se enquadra na inelegibilidade desta alínea, porque possui regramento próprio no art. 52, I e parágrafo único da CF/1988, nem na alínea e deste inciso porquanto, dada sua natureza, a condenação por crime de responsabilidade não se equipara a uma “decisão transitada em julgado ou proferida por órgão judicial colegiado”.","Art. 55, c), subordinado a Art. 55: o governador e o vice-governador de estado e do Distrito Federal e o prefeito e o vice-prefeito que perderem seus cargos eletivos por infringência do disposto na Constituição estadual, na Lei Orgânica do Distrito Federal ou na Lei Orgânica do município, nos 8 (oito) anos subsequentes à data da decisão que decretar a perda do cargo eletivo; | 4 nota(s) vinculada(s); jurisprudência...",alinea; governador; vice; distrito; federal; prefeito; organica; decisao; dada; inelegibilidade,True,2114,528,007_lei_complementar_64_1990_lei_de_inelegibilidade:7,007_lei_complementar_64_1990_lei_de_inelegibilidade.csv,6,007_lei_complementar_64_1990_lei_de_inelegibilidade:6
