id,ordem_doc,arquivo_fonte,norma_id,norma_titulo,norma_nome_popular,macrogrupo,grupo_sumario,pagina_inicial,pagina_final,hierarquia_normativa,tipo_dispositivo,dispositivo,dispositivo_pai,artigo,paragrafo,inciso,alinea,item,texto_dispositivo,notas_texto,notas_json,qtd_notas,referencias_normativas,referencias_jurisprudenciais,referencias_sumulas,texto_rag,resumo_curto,palavras_chave,incluir_no_rag,chars,tokens_estimados,row_key,csv_arquivo,dispositivo_pai_id,dispositivo_pai_row_key
1,1,Codigo_Eleitoral_2026_anotado.pdf,lei_13877_2019,"Lei n. 13.877, de 27 de setembro de 2019",Lei n. 13.877/2019,Lei n. 13.877/2019,Lei n. 13.877/2019,615,615,,norma,"Lei n. 13.877, de 27 de setembro de 2019",,,,,,,"Altera as Leis n. 9.096, de 19 de setembro de 1995, 9.504, de 30 setembro de 1997, 4.737, de 15 de julho de 1965 (Código Eleitoral), 13.831, de 17 de maio de 2019, e a Consolidação das Leis do Trabalho, aprovada pelo Decreto-Lei n. 5.452, de 1º de maio de 1943, para dispor sobre regras aplicadas às eleições; revoga dispositivo da Lei n. 13.488, de 6 de outubro de 2017 e dá outras providências. O PRESIDENTE DA REPÚBLICA Faço saber que o Congresso Nacional decreta e eu sanciono a seguinte lei:",,[],0,Lei n. 5.452; Lei n. 13.488; Decreto-Lei n. 5.452,,,"Documento: Codigo Eleitoral 2026 anotado Norma: Lei n. 13.877, de 27 de setembro de 2019 Nome popular/citação curta: Lei n. 13.877/2019 Macrogrupo: Lei n. 13.877/2019 Grupo do sumário: Lei n. 13.877/2019 Dispositivo: Lei n. 13.877, de 27 de setembro de 2019 Tipo: norma Páginas: 615-615 Resumo: Norma Lei n. 13.877/2019: Altera as Leis n. 9.096, de 19 de setembro de 1995, 9.504, de 30 setembro de 1997, 4.737, de 15 de julho de 1965 (Código Eleitoral), 13.831, de 17 de maio de 2019, e a Consolidação das Leis do Trabalho, aprovada pelo Decreto-Lei n. 5.452, de 1º de maio de 1943, para dispor sobre regras aplicadas às eleições; revoga dispositivo da Lei n. 13.488, de 6 de outubro de 2017 e dá outras... Altera as Leis n. 9.096, de 19 de setembro de 1995, 9.504, de 30 setembro de 1997, 4.737, de 15 de julho de 1965 (Código Eleitoral), 13.831, de 17 de maio de 2019, e a Consolidação das Leis do Trabalho, aprovada pelo Decreto-Lei n. 5.452, de 1º de maio de 1943, para dispor sobre regras aplicadas às eleições; revoga dispositivo da Lei n. 13.488, de 6 de outubro de 2017 e dá outras providências. O PRESIDENTE DA REPÚBLICA Faço saber que o Congresso Nacional decreta e eu sanciono a seguinte lei:","Norma Lei n. 13.877/2019: Altera as Leis n. 9.096, de 19 de setembro de 1995, 9.504, de 30 setembro de 1997, 4.737, de 15 de julho de 1965 (Código Eleitoral), 13.831, de 17 de maio de 2019, e a Consolidação das Leis do Trabalho, aprovada pelo Decreto-Lei n. 5.452, de 1º de maio de 1943, para dispor sobre regras aplicadas às eleições; revoga dispositivo da Lei n. 13.488, de 6 de outubro de 2017 e dá outras...",setembro; leis; maio; altera; julho; codigo; eleitoral; consolidacao; trabalho; aprovada,True,1203,301,011_lei_13877_2019_lei_n_13_877_2019:1,011_lei_13877_2019_lei_n_13_877_2019.csv,,
2,2,Codigo_Eleitoral_2026_anotado.pdf,lei_13877_2019,"Lei n. 13.877, de 27 de setembro de 2019",Lei n. 13.877/2019,Lei n. 13.877/2019,Lei n. 13.877/2019,615,615,,artigo,Art. 1º,,Art. 1º,,,,,"Art. 1º A Lei n. 9.096, de 19 de setembro de 1995, passa a vigorar com as seguintes alterações:",Alterações incorporadas ao texto da Lei n. 9.096/1995.,"[{""ordem"": 1, ""marcador"": ""quadrado"", ""texto"": ""Alterações incorporadas ao texto da Lei n. 9.096/1995."", ""pagina_inicial"": 615, ""pagina_final"": 615}]",1,Lei n. 9.096; Lei n. 9.096/1995,,,"Documento: Codigo Eleitoral 2026 anotado Norma: Lei n. 13.877, de 27 de setembro de 2019 Nome popular/citação curta: Lei n. 13.877/2019 Macrogrupo: Lei n. 13.877/2019 Grupo do sumário: Lei n. 13.877/2019 Dispositivo: Art. 1º Tipo: artigo Páginas: 615-615 Resumo: Art. 1º: A Lei n. 9.096, de 19 de setembro de 1995, passa a vigorar com as seguintes alterações: | 1 nota(s) vinculada(s) Art. 1º A Lei n. 9.096, de 19 de setembro de 1995, passa a vigorar com as seguintes alterações: Notas vinculadas: Alterações incorporadas ao texto da Lei n. 9.096/1995.","Art. 1º: A Lei n. 9.096, de 19 de setembro de 1995, passa a vigorar com as seguintes alterações: | 1 nota(s) vinculada(s)",setembro; alteracoes; passa; vigorar; seguintes; incorporadas; texto,True,553,138,011_lei_13877_2019_lei_n_13_877_2019:2,011_lei_13877_2019_lei_n_13_877_2019.csv,,
3,3,Codigo_Eleitoral_2026_anotado.pdf,lei_13877_2019,"Lei n. 13.877, de 27 de setembro de 2019",Lei n. 13.877/2019,Lei n. 13.877/2019,Lei n. 13.877/2019,615,615,,artigo,Art. 2º,,Art. 2º,,,,,"Art. 2º A Lei n. 9.504, de 30 de setembro de 1997, passa a vigorar com as seguintes alterações:",Alterações incorporadas ao texto da Lei n. 9.504/1997.,"[{""ordem"": 1, ""marcador"": ""quadrado"", ""texto"": ""Alterações incorporadas ao texto da Lei n. 9.504/1997."", ""pagina_inicial"": 615, ""pagina_final"": 615}]",1,Lei n. 9.504; Lei n. 9.504/1997,,,"Documento: Codigo Eleitoral 2026 anotado Norma: Lei n. 13.877, de 27 de setembro de 2019 Nome popular/citação curta: Lei n. 13.877/2019 Macrogrupo: Lei n. 13.877/2019 Grupo do sumário: Lei n. 13.877/2019 Dispositivo: Art. 2º Tipo: artigo Páginas: 615-615 Resumo: Art. 2º: A Lei n. 9.504, de 30 de setembro de 1997, passa a vigorar com as seguintes alterações: | 1 nota(s) vinculada(s) Art. 2º A Lei n. 9.504, de 30 de setembro de 1997, passa a vigorar com as seguintes alterações: Notas vinculadas: Alterações incorporadas ao texto da Lei n. 9.504/1997.","Art. 2º: A Lei n. 9.504, de 30 de setembro de 1997, passa a vigorar com as seguintes alterações: | 1 nota(s) vinculada(s)",setembro; alteracoes; passa; vigorar; seguintes; incorporadas; texto,True,553,138,011_lei_13877_2019_lei_n_13_877_2019:3,011_lei_13877_2019_lei_n_13_877_2019.csv,,
4,4,Codigo_Eleitoral_2026_anotado.pdf,lei_13877_2019,"Lei n. 13.877, de 27 de setembro de 2019",Lei n. 13.877/2019,Lei n. 13.877/2019,Lei n. 13.877/2019,615,615,,artigo,Art. 3º,,Art. 3º,,,,,"Art. 3º O caput do art. 7º da Consolidação das Leis do Trabalho, aprovada pelo Decreto-Lei n. 5.452, de 1º de maio de 1943, passa a vigorar com a seguinte alteração: “Art. 7º .............................................................................. .............................................................................................",,[],0,Lei n. 5.452; Decreto-Lei n. 5.452,,,"Documento: Codigo Eleitoral 2026 anotado Norma: Lei n. 13.877, de 27 de setembro de 2019 Nome popular/citação curta: Lei n. 13.877/2019 Macrogrupo: Lei n. 13.877/2019 Grupo do sumário: Lei n. 13.877/2019 Dispositivo: Art. 3º Tipo: artigo Páginas: 615-615 Resumo: Art. 3º: O caput do art. 7º da Consolidação das Leis do Trabalho, aprovada pelo Decreto-Lei n. 5.452, de 1º de maio de 1943, passa a vigorar com a seguinte alteração: “Art. 7º .............................................................................. ............................................................................................. Art. 3º O caput do art. 7º da Consolidação das Leis do Trabalho, aprovada pelo Decreto-Lei n. 5.452, de 1º de maio de 1943, passa a vigorar com a seguinte alteração: “Art. 7º .............................................................................. .............................................................................................","Art. 3º: O caput do art. 7º da Consolidação das Leis do Trabalho, aprovada pelo Decreto-Lei n. 5.452, de 1º de maio de 1943, passa a vigorar com a seguinte alteração: “Art. 7º .............................................................................. .............................................................................................",setembro; caput; consolidacao; leis; trabalho; aprovada; decreto; maio; passa; vigorar,True,959,240,011_lei_13877_2019_lei_n_13_877_2019:4,011_lei_13877_2019_lei_n_13_877_2019.csv,,
5,5,Codigo_Eleitoral_2026_anotado.pdf,lei_13877_2019,"Lei n. 13.877, de 27 de setembro de 2019",Lei n. 13.877/2019,Lei n. 13.877/2019,Lei n. 13.877/2019,615,615,,alinea,"Art. 3º, f)",Art. 3º,Art. 3º,,,f),,"f) às atividades de direção e assessoramento nos órgãos, institutos e fundações dos partidos, assim definidas em normas internas de organização partidária.”",,[],0,,,,"Documento: Codigo Eleitoral 2026 anotado Norma: Lei n. 13.877, de 27 de setembro de 2019 Nome popular/citação curta: Lei n. 13.877/2019 Macrogrupo: Lei n. 13.877/2019 Grupo do sumário: Lei n. 13.877/2019 Dispositivo: Art. 3º, f) Tipo: alinea Dispositivo pai: Art. 3º ID do dispositivo pai: 011_lei_13877_2019_lei_n_13_877_2019:4 Páginas: 615-615 Resumo: Art. 3º, f), subordinado a Art. 3º: às atividades de direção e assessoramento nos órgãos, institutos e fundações dos partidos, assim definidas em normas internas de organização partidária.” f) às atividades de direção e assessoramento nos órgãos, institutos e fundações dos partidos, assim definidas em normas internas de organização partidária.”","Art. 3º, f), subordinado a Art. 3º: às atividades de direção e assessoramento nos órgãos, institutos e fundações dos partidos, assim definidas em normas internas de organização partidária.”",setembro; atividades; direcao; assessoramento; orgaos; institutos; fundacoes; partidos; assim; definidas,True,700,175,011_lei_13877_2019_lei_n_13_877_2019:5,011_lei_13877_2019_lei_n_13_877_2019.csv,4,011_lei_13877_2019_lei_n_13_877_2019:4
6,6,Codigo_Eleitoral_2026_anotado.pdf,lei_13877_2019,"Lei n. 13.877, de 27 de setembro de 2019",Lei n. 13.877/2019,Lei n. 13.877/2019,Lei n. 13.877/2019,615,615,,artigo,Art. 4º,,Art. 4º,,,,,"Art. 4º O art. 262 da Lei n. 4.737, de 15 de julho de 1965 (Código Eleitoral), passa a vigorar acrescido dos seguintes §§ 1º, 2º e 3º:","Alteração incorporada ao texto da Lei n. 4.737/1965.
Art. 4º vetado pela Presidência da República; veto rejeitado pelo Congresso Nacional e publicado no DOU de 13/12/2019.","[{""ordem"": 1, ""marcador"": ""quadrado"", ""texto"": ""Alteração incorporada ao texto da Lei n. 4.737/1965."", ""pagina_inicial"": 615, ""pagina_final"": 615}, {""ordem"": 2, ""marcador"": ""quadrado"", ""texto"": ""Art. 4º vetado pela Presidência da República; veto rejeitado pelo Congresso Nacional e publicado no DOU de 13/12/2019."", ""pagina_inicial"": 615, ""pagina_final"": 615}]",2,Lei n. 4.737; Lei n. 4.737/1965,,,"Documento: Codigo Eleitoral 2026 anotado Norma: Lei n. 13.877, de 27 de setembro de 2019 Nome popular/citação curta: Lei n. 13.877/2019 Macrogrupo: Lei n. 13.877/2019 Grupo do sumário: Lei n. 13.877/2019 Dispositivo: Art. 4º Tipo: artigo Páginas: 615-615 Resumo: Art. 4º: O art. 262 da Lei n. 4.737, de 15 de julho de 1965 (Código Eleitoral), passa a vigorar acrescido dos seguintes §§ 1º, 2º e 3º: | há marcação de revogação/cancelamento/veto; 2 nota(s) vinculada(s) Art. 4º O art. 262 da Lei n. 4.737, de 15 de julho de 1965 (Código Eleitoral), passa a vigorar acrescido dos seguintes §§ 1º, 2º e 3º: Notas vinculadas: Alteração incorporada ao texto da Lei n. 4.737/1965. Art. 4º vetado pela Presidência da República; veto rejeitado pelo Congresso Nacional e publicado no DOU de 13/12/2019.","Art. 4º: O art. 262 da Lei n. 4.737, de 15 de julho de 1965 (Código Eleitoral), passa a vigorar acrescido dos seguintes §§ 1º, 2º e 3º: | há marcação de revogação/cancelamento/veto; 2 nota(s) vinculada(s)",setembro; julho; codigo; eleitoral; passa; vigorar; acrescido; seguintes; alteracao; incorporada,True,792,198,011_lei_13877_2019_lei_n_13_877_2019:6,011_lei_13877_2019_lei_n_13_877_2019.csv,,
7,7,Codigo_Eleitoral_2026_anotado.pdf,lei_13877_2019,"Lei n. 13.877, de 27 de setembro de 2019",Lei n. 13.877/2019,Lei n. 13.877/2019,Lei n. 13.877/2019,615,615,,artigo,Art. 5º,,Art. 5º,,,,,"Art. 5º O art. 3º da Lei n. 13.831, de 17 de maio de 2019, passa a vigorar acrescido do seguinte",,[],0,Lei n. 13.831,,,"Documento: Codigo Eleitoral 2026 anotado Norma: Lei n. 13.877, de 27 de setembro de 2019 Nome popular/citação curta: Lei n. 13.877/2019 Macrogrupo: Lei n. 13.877/2019 Grupo do sumário: Lei n. 13.877/2019 Dispositivo: Art. 5º Tipo: artigo Páginas: 615-615 Resumo: Art. 5º: O art. 3º da Lei n. 13.831, de 17 de maio de 2019, passa a vigorar acrescido do seguinte Art. 5º O art. 3º da Lei n. 13.831, de 17 de maio de 2019, passa a vigorar acrescido do seguinte","Art. 5º: O art. 3º da Lei n. 13.831, de 17 de maio de 2019, passa a vigorar acrescido do seguinte",setembro; maio; passa; vigorar; acrescido; seguinte,True,457,114,011_lei_13877_2019_lei_n_13_877_2019:7,011_lei_13877_2019_lei_n_13_877_2019.csv,,
8,8,Codigo_Eleitoral_2026_anotado.pdf,lei_13877_2019,"Lei n. 13.877, de 27 de setembro de 2019",Lei n. 13.877/2019,Lei n. 13.877/2019,Lei n. 13.877/2019,615,615,,paragrafo,"Art. 5º, Parágrafo único",Art. 5º,Art. 5º,Parágrafo único,,,,parágrafo único:,"Alteração incorporada ao texto da Lei n. 13.831/2019.
Art. 5º vetado pela Presidência da República; veto rejeitado pelo Congresso Nacional e publicado no DOU de 13/12/2019.","[{""ordem"": 1, ""marcador"": ""quadrado"", ""texto"": ""Alteração incorporada ao texto da Lei n. 13.831/2019."", ""pagina_inicial"": 615, ""pagina_final"": 615}, {""ordem"": 2, ""marcador"": ""quadrado"", ""texto"": ""Art. 5º vetado pela Presidência da República; veto rejeitado pelo Congresso Nacional e publicado no DOU de 13/12/2019."", ""pagina_inicial"": 615, ""pagina_final"": 615}]",2,Lei n. 13.831/2019,,,"Documento: Codigo Eleitoral 2026 anotado Norma: Lei n. 13.877, de 27 de setembro de 2019 Nome popular/citação curta: Lei n. 13.877/2019 Macrogrupo: Lei n. 13.877/2019 Grupo do sumário: Lei n. 13.877/2019 Dispositivo: Art. 5º, Parágrafo único Tipo: paragrafo Dispositivo pai: Art. 5º ID do dispositivo pai: 011_lei_13877_2019_lei_n_13_877_2019:7 Páginas: 615-615 Resumo: Art. 5º, Parágrafo único: parágrafo único: | há marcação de revogação/cancelamento/veto; 2 nota(s) vinculada(s) parágrafo único: Notas vinculadas: Alteração incorporada ao texto da Lei n. 13.831/2019. Art. 5º vetado pela Presidência da República; veto rejeitado pelo Congresso Nacional e publicado no DOU de 13/12/2019.","Art. 5º, Parágrafo único: parágrafo único: | há marcação de revogação/cancelamento/veto; 2 nota(s) vinculada(s)",paragrafo; unico; setembro; alteracao; incorporada; texto; vetado; presidencia; republica; veto,True,689,172,011_lei_13877_2019_lei_n_13_877_2019:8,011_lei_13877_2019_lei_n_13_877_2019.csv,7,011_lei_13877_2019_lei_n_13_877_2019:7
9,9,Codigo_Eleitoral_2026_anotado.pdf,lei_13877_2019,"Lei n. 13.877, de 27 de setembro de 2019",Lei n. 13.877/2019,Lei n. 13.877/2019,Lei n. 13.877/2019,615,615,,artigo,Art. 6º,,Art. 6º,,,,,Art. 6º As alterações promovidas nesta lei aplicam-se a todos os processos de prestação de contas dos partidos que não tenham transitado em julgado em todas as instâncias.,Art. 6º vetado pela Presidência da República; veto rejeitado pelo Congresso Nacional e publicado no DOU de 13/12/2019.,"[{""ordem"": 1, ""marcador"": ""quadrado"", ""texto"": ""Art. 6º vetado pela Presidência da República; veto rejeitado pelo Congresso Nacional e publicado no DOU de 13/12/2019."", ""pagina_inicial"": 615, ""pagina_final"": 615}]",1,,,,"Documento: Codigo Eleitoral 2026 anotado Norma: Lei n. 13.877, de 27 de setembro de 2019 Nome popular/citação curta: Lei n. 13.877/2019 Macrogrupo: Lei n. 13.877/2019 Grupo do sumário: Lei n. 13.877/2019 Dispositivo: Art. 6º Tipo: artigo Páginas: 615-615 Resumo: Art. 6º: As alterações promovidas nesta lei aplicam-se a todos os processos de prestação de contas dos partidos que não tenham transitado em julgado em todas as instâncias. | há marcação de revogação/cancelamento/veto; 1 nota(s) vinculada(s) Art. 6º As alterações promovidas nesta lei aplicam-se a todos os processos de prestação de contas dos partidos que não tenham transitado em julgado em todas as instâncias. Notas vinculadas: Art. 6º vetado pela Presidência da República; veto rejeitado pelo Congresso Nacional e publicado no DOU de 13/12/2019.",Art. 6º: As alterações promovidas nesta lei aplicam-se a todos os processos de prestação de contas dos partidos que não tenham transitado em julgado em todas as instâncias. | há marcação de revogação/cancelamento/veto; 1 nota(s) vinculada(s),setembro; alteracoes; promovidas; nesta; aplicam; todos; processos; prestacao; contas; partidos,True,813,203,011_lei_13877_2019_lei_n_13_877_2019:9,011_lei_13877_2019_lei_n_13_877_2019.csv,,
10,10,Codigo_Eleitoral_2026_anotado.pdf,lei_13877_2019,"Lei n. 13.877, de 27 de setembro de 2019",Lei n. 13.877/2019,Lei n. 13.877/2019,Lei n. 13.877/2019,615,615,,artigo,Art. 7º,,Art. 7º,,,,,"Art. 7º Fica revogado o art. 4º da Lei n. 13.488, de 6 de outubro de 2017.",,[],0,Lei n. 13.488,,,"Documento: Codigo Eleitoral 2026 anotado Norma: Lei n. 13.877, de 27 de setembro de 2019 Nome popular/citação curta: Lei n. 13.877/2019 Macrogrupo: Lei n. 13.877/2019 Grupo do sumário: Lei n. 13.877/2019 Dispositivo: Art. 7º Tipo: artigo Páginas: 615-615 Resumo: Art. 7º: Fica revogado o art. 4º da Lei n. 13.488, de 6 de outubro de 2017. | há marcação de revogação/cancelamento/veto Art. 7º Fica revogado o art. 4º da Lei n. 13.488, de 6 de outubro de 2017.","Art. 7º: Fica revogado o art. 4º da Lei n. 13.488, de 6 de outubro de 2017. | há marcação de revogação/cancelamento/veto",setembro; fica; revogado; outubro,True,458,114,011_lei_13877_2019_lei_n_13_877_2019:10,011_lei_13877_2019_lei_n_13_877_2019.csv,,
11,11,Codigo_Eleitoral_2026_anotado.pdf,lei_13877_2019,"Lei n. 13.877, de 27 de setembro de 2019",Lei n. 13.877/2019,Lei n. 13.877/2019,Lei n. 13.877/2019,615,615,,artigo,Art. 8º,,Art. 8º,,,,,Art. 8º Esta lei entra em vigor na data de sua publicação.,,[],0,,,,"Documento: Codigo Eleitoral 2026 anotado Norma: Lei n. 13.877, de 27 de setembro de 2019 Nome popular/citação curta: Lei n. 13.877/2019 Macrogrupo: Lei n. 13.877/2019 Grupo do sumário: Lei n. 13.877/2019 Dispositivo: Art. 8º Tipo: artigo Páginas: 615-615 Resumo: Art. 8º: Esta lei entra em vigor na data de sua publicação. Art. 8º Esta lei entra em vigor na data de sua publicação.",Art. 8º: Esta lei entra em vigor na data de sua publicação.,setembro; esta; entra; vigor; data; publicacao,True,381,95,011_lei_13877_2019_lei_n_13_877_2019:11,011_lei_13877_2019_lei_n_13_877_2019.csv,,
