id,ordem_doc,arquivo_fonte,norma_id,norma_titulo,norma_nome_popular,macrogrupo,grupo_sumario,pagina_inicial,pagina_final,hierarquia_normativa,tipo_dispositivo,dispositivo,dispositivo_pai,artigo,paragrafo,inciso,alinea,item,texto_dispositivo,notas_texto,notas_json,qtd_notas,referencias_normativas,referencias_jurisprudenciais,referencias_sumulas,texto_rag,resumo_curto,palavras_chave,incluir_no_rag,chars,tokens_estimados,row_key,csv_arquivo,dispositivo_pai_id,dispositivo_pai_row_key
1,1,Codigo_Eleitoral_2026_anotado.pdf,decreto_4199_2002,"Decreto n. 4.199, de 16 de abril de 2002",Decreto n. 4.199/2002,Legislação correlata,Legislação correlata,723,723,,norma,"Decreto n. 4.199, de 16 de abril de 2002",,,,,,,"Dispõe sobre a prestação de informações institucionais relativas à administração pública federal a partidos políticos, coligações e candidatos à Presidência da República até a data da divulgação oficial do resultado final das eleições. O PRESIDENTE DA REPÚBLICA, no uso da atribuição que lhe confere o art. 84, inciso VI, alínea a, da Constituição, DECRETA:",,[],0,,,,"Documento: Codigo Eleitoral 2026 anotado Norma: Decreto n. 4.199, de 16 de abril de 2002 Nome popular/citação curta: Decreto n. 4.199/2002 Macrogrupo: Legislação correlata Grupo do sumário: Legislação correlata Dispositivo: Decreto n. 4.199, de 16 de abril de 2002 Tipo: norma Páginas: 723-723 Resumo: Norma Decreto n. 4.199/2002: Dispõe sobre a prestação de informações institucionais relativas à administração pública federal a partidos políticos, coligações e candidatos à Presidência da República até a data da divulgação oficial do resultado final das eleições. Dispõe sobre a prestação de informações institucionais relativas à administração pública federal a partidos políticos, coligações e candidatos à Presidência da República até a data da divulgação oficial do resultado final das eleições. O PRESIDENTE DA REPÚBLICA, no uso da atribuição que lhe confere o art. 84, inciso VI, alínea a, da Constituição, DECRETA:","Norma Decreto n. 4.199/2002: Dispõe sobre a prestação de informações institucionais relativas à administração pública federal a partidos políticos, coligações e candidatos à Presidência da República até a data da divulgação oficial do resultado final das eleições.",decreto; abril; republica; dispoe; sobre; prestacao; informacoes; institucionais; relativas; administracao,True,924,231,035_decreto_4199_2002:1,035_decreto_4199_2002.csv,,
2,2,Codigo_Eleitoral_2026_anotado.pdf,decreto_4199_2002,"Decreto n. 4.199, de 16 de abril de 2002",Decreto n. 4.199/2002,Legislação correlata,Legislação correlata,723,723,,artigo,Art. 1º,"Decreto n. 4.199, de 16 de abril de 2002",Art. 1º,,,,,"Art. 1º Este decreto regulamenta a prestação de informações institucionais relativas à administração pública federal a partidos políticos, coligações e candidatos à Presidência da República até a data de divulgação oficial do resultado final das eleições.",,[],0,,,,"Documento: Codigo Eleitoral 2026 anotado Norma: Decreto n. 4.199, de 16 de abril de 2002 Nome popular/citação curta: Decreto n. 4.199/2002 Macrogrupo: Legislação correlata Grupo do sumário: Legislação correlata Dispositivo: Art. 1º Tipo: artigo Dispositivo pai: Decreto n. 4.199, de 16 de abril de 2002 ID do dispositivo pai: 035_decreto_4199_2002:1 Páginas: 723-723 Resumo: Art. 1º, subordinado a Decreto n. 4.199, de 16 de abril de 2002: Este decreto regulamenta a prestação de informações institucionais relativas à administração pública federal a partidos políticos, coligações e candidatos à Presidência da República até a data de divulgação oficial do resultado final das eleições. Art. 1º Este decreto regulamenta a prestação de informações institucionais relativas à administração pública federal a partidos políticos, coligações e candidatos à Presidência da República até a data de divulgação oficial do resultado final das eleições.","Art. 1º, subordinado a Decreto n. 4.199, de 16 de abril de 2002: Este decreto regulamenta a prestação de informações institucionais relativas à administração pública federal a partidos políticos, coligações e candidatos à Presidência da República até a data de divulgação oficial do resultado final das eleições.",decreto; abril; este; regulamenta; prestacao; informacoes; institucionais; relativas; administracao; publica,True,943,236,035_decreto_4199_2002:2,035_decreto_4199_2002.csv,1,035_decreto_4199_2002:1
3,3,Codigo_Eleitoral_2026_anotado.pdf,decreto_4199_2002,"Decreto n. 4.199, de 16 de abril de 2002",Decreto n. 4.199/2002,Legislação correlata,Legislação correlata,723,723,,artigo,Art. 2º,"Decreto n. 4.199, de 16 de abril de 2002",Art. 2º,,,,,Art. 2º Qualquer solicitação de informações institucionais relativas à administração pública federal poderá ser feita por partido político ou coligação.,,[],0,,,,"Documento: Codigo Eleitoral 2026 anotado Norma: Decreto n. 4.199, de 16 de abril de 2002 Nome popular/citação curta: Decreto n. 4.199/2002 Macrogrupo: Legislação correlata Grupo do sumário: Legislação correlata Dispositivo: Art. 2º Tipo: artigo Dispositivo pai: Decreto n. 4.199, de 16 de abril de 2002 ID do dispositivo pai: 035_decreto_4199_2002:1 Páginas: 723-723 Resumo: Art. 2º, subordinado a Decreto n. 4.199, de 16 de abril de 2002: Qualquer solicitação de informações institucionais relativas à administração pública federal poderá ser feita por partido político ou coligação. Art. 2º Qualquer solicitação de informações institucionais relativas à administração pública federal poderá ser feita por partido político ou coligação.","Art. 2º, subordinado a Decreto n. 4.199, de 16 de abril de 2002: Qualquer solicitação de informações institucionais relativas à administração pública federal poderá ser feita por partido político ou coligação.",decreto; abril; qualquer; solicitacao; informacoes; institucionais; relativas; administracao; publica; federal,True,737,184,035_decreto_4199_2002:3,035_decreto_4199_2002.csv,1,035_decreto_4199_2002:1
4,4,Codigo_Eleitoral_2026_anotado.pdf,decreto_4199_2002,"Decreto n. 4.199, de 16 de abril de 2002",Decreto n. 4.199/2002,Legislação correlata,Legislação correlata,723,723,,paragrafo,"Art. 2º, §1º",Art. 2º,Art. 2º,§1º,,,,"§ 1º Após a escolha de candidato a que se refere o art. 8º da Lei n. 9.504, de 30 de setembro de 1997, as informações relativas à administração pública federal do interesse de partido político ou coligação com candidato à Presidência da República deverão ser formalizadas pelo candidato registrado do partido ou coligação.",,[],0,Lei n. 9.504,,,"Documento: Codigo Eleitoral 2026 anotado Norma: Decreto n. 4.199, de 16 de abril de 2002 Nome popular/citação curta: Decreto n. 4.199/2002 Macrogrupo: Legislação correlata Grupo do sumário: Legislação correlata Dispositivo: Art. 2º, §1º Tipo: paragrafo Dispositivo pai: Art. 2º ID do dispositivo pai: 035_decreto_4199_2002:3 Páginas: 723-723 Resumo: Art. 2º, §1º, subordinado a Art. 2º: § 1º Após a escolha de candidato a que se refere o art. 8º da Lei n. 9.504, de 30 de setembro de 1997, as informações relativas à administração pública federal do interesse de partido político ou coligação com candidato à Presidência da República deverão ser formalizadas pelo candidato registrado do partido ou coligação. § 1º Após a escolha de candidato a que se refere o art. 8º da Lei n. 9.504, de 30 de setembro de 1997, as informações relativas à administração pública federal do interesse de partido político ou coligação com candidato à Presidência da República deverão ser formalizadas pelo candidato registrado do partido ou coligação.","Art. 2º, §1º, subordinado a Art. 2º: § 1º Após a escolha de candidato a que se refere o art. 8º da Lei n. 9.504, de 30 de setembro de 1997, as informações relativas à administração pública federal do interesse de partido político ou coligação com candidato à Presidência da República deverão ser formalizadas pelo candidato registrado do partido ou coligação.",candidato; partido; coligacao; decreto; abril; apos; escolha; refere; setembro; informacoes,True,1032,258,035_decreto_4199_2002:4,035_decreto_4199_2002.csv,3,035_decreto_4199_2002:3
5,5,Codigo_Eleitoral_2026_anotado.pdf,decreto_4199_2002,"Decreto n. 4.199, de 16 de abril de 2002",Decreto n. 4.199/2002,Legislação correlata,Legislação correlata,723,723,,paragrafo,"Art. 2º, §2º",Art. 2º,Art. 2º,§2º,,,,"§ 2º Na hipótese do § 1º, qualquer que seja a natureza da informação pleiteada, as solicitações deverão ser requeridas por escrito ao secretário-executivo da Casa Civil da Presidência da República.",,[],0,,,,"Documento: Codigo Eleitoral 2026 anotado Norma: Decreto n. 4.199, de 16 de abril de 2002 Nome popular/citação curta: Decreto n. 4.199/2002 Macrogrupo: Legislação correlata Grupo do sumário: Legislação correlata Dispositivo: Art. 2º, §2º Tipo: paragrafo Dispositivo pai: Art. 2º ID do dispositivo pai: 035_decreto_4199_2002:3 Páginas: 723-723 Resumo: Art. 2º, §2º, subordinado a Art. 2º: § 2º Na hipótese do § 1º, qualquer que seja a natureza da informação pleiteada, as solicitações deverão ser requeridas por escrito ao secretário-executivo da Casa Civil da Presidência da República. § 2º Na hipótese do § 1º, qualquer que seja a natureza da informação pleiteada, as solicitações deverão ser requeridas por escrito ao secretário-executivo da Casa Civil da Presidência da República.","Art. 2º, §2º, subordinado a Art. 2º: § 2º Na hipótese do § 1º, qualquer que seja a natureza da informação pleiteada, as solicitações deverão ser requeridas por escrito ao secretário-executivo da Casa Civil da Presidência da República.",decreto; abril; hipotese; qualquer; seja; natureza; informacao; pleiteada; solicitacoes; deverao,True,782,196,035_decreto_4199_2002:5,035_decreto_4199_2002.csv,3,035_decreto_4199_2002:3
6,6,Codigo_Eleitoral_2026_anotado.pdf,decreto_4199_2002,"Decreto n. 4.199, de 16 de abril de 2002",Decreto n. 4.199/2002,Legislação correlata,Legislação correlata,723,723,,paragrafo,"Art. 2º, §3º",Art. 2º,Art. 2º,§3º,,,,"§ 3º O secretário-executivo da Casa Civil da Presidência da República poderá requisitar a órgão, entidade ou servidor os dados necessários à satisfação da solicitação.",,[],0,,,,"Documento: Codigo Eleitoral 2026 anotado Norma: Decreto n. 4.199, de 16 de abril de 2002 Nome popular/citação curta: Decreto n. 4.199/2002 Macrogrupo: Legislação correlata Grupo do sumário: Legislação correlata Dispositivo: Art. 2º, §3º Tipo: paragrafo Dispositivo pai: Art. 2º ID do dispositivo pai: 035_decreto_4199_2002:3 Páginas: 723-723 Resumo: Art. 2º, §3º, subordinado a Art. 2º: § 3º O secretário-executivo da Casa Civil da Presidência da República poderá requisitar a órgão, entidade ou servidor os dados necessários à satisfação da solicitação. § 3º O secretário-executivo da Casa Civil da Presidência da República poderá requisitar a órgão, entidade ou servidor os dados necessários à satisfação da solicitação.","Art. 2º, §3º, subordinado a Art. 2º: § 3º O secretário-executivo da Casa Civil da Presidência da República poderá requisitar a órgão, entidade ou servidor os dados necessários à satisfação da solicitação.",decreto; abril; secretario; executivo; casa; civil; presidencia; republica; podera; requisitar,True,722,180,035_decreto_4199_2002:6,035_decreto_4199_2002.csv,3,035_decreto_4199_2002:3
7,7,Codigo_Eleitoral_2026_anotado.pdf,decreto_4199_2002,"Decreto n. 4.199, de 16 de abril de 2002",Decreto n. 4.199/2002,Legislação correlata,Legislação correlata,723,723,,paragrafo,"Art. 2º, §4º",Art. 2º,Art. 2º,§4º,,,,"§ 4º O órgão, a entidade ou o servidor instado a se manifestar deverá fazê-lo no prazo de dez dias, salvo determinação diversa do secretário-executivo da Casa Civil da Presidência da República.",,[],0,,,,"Documento: Codigo Eleitoral 2026 anotado Norma: Decreto n. 4.199, de 16 de abril de 2002 Nome popular/citação curta: Decreto n. 4.199/2002 Macrogrupo: Legislação correlata Grupo do sumário: Legislação correlata Dispositivo: Art. 2º, §4º Tipo: paragrafo Dispositivo pai: Art. 2º ID do dispositivo pai: 035_decreto_4199_2002:3 Páginas: 723-723 Resumo: Art. 2º, §4º, subordinado a Art. 2º: § 4º O órgão, a entidade ou o servidor instado a se manifestar deverá fazê-lo no prazo de dez dias, salvo determinação diversa do secretário-executivo da Casa Civil da Presidência da República. § 4º O órgão, a entidade ou o servidor instado a se manifestar deverá fazê-lo no prazo de dez dias, salvo determinação diversa do secretário-executivo da Casa Civil da Presidência da República.","Art. 2º, §4º, subordinado a Art. 2º: § 4º O órgão, a entidade ou o servidor instado a se manifestar deverá fazê-lo no prazo de dez dias, salvo determinação diversa do secretário-executivo da Casa Civil da Presidência da República.",decreto; abril; orgao; entidade; servidor; instado; manifestar; devera; faze; prazo,True,774,194,035_decreto_4199_2002:7,035_decreto_4199_2002.csv,3,035_decreto_4199_2002:3
8,8,Codigo_Eleitoral_2026_anotado.pdf,decreto_4199_2002,"Decreto n. 4.199, de 16 de abril de 2002",Decreto n. 4.199/2002,Legislação correlata,Legislação correlata,723,723,,artigo,Art. 3º,"Decreto n. 4.199, de 16 de abril de 2002",Art. 3º,,,,,"Art. 3º As informações serão prestadas por escrito no prazo máximo de quinze dias, contados da data de protocolo da solicitação.",,[],0,,,,"Documento: Codigo Eleitoral 2026 anotado Norma: Decreto n. 4.199, de 16 de abril de 2002 Nome popular/citação curta: Decreto n. 4.199/2002 Macrogrupo: Legislação correlata Grupo do sumário: Legislação correlata Dispositivo: Art. 3º Tipo: artigo Dispositivo pai: Decreto n. 4.199, de 16 de abril de 2002 ID do dispositivo pai: 035_decreto_4199_2002:1 Páginas: 723-723 Resumo: Art. 3º, subordinado a Decreto n. 4.199, de 16 de abril de 2002: As informações serão prestadas por escrito no prazo máximo de quinze dias, contados da data de protocolo da solicitação. Art. 3º As informações serão prestadas por escrito no prazo máximo de quinze dias, contados da data de protocolo da solicitação.","Art. 3º, subordinado a Decreto n. 4.199, de 16 de abril de 2002: As informações serão prestadas por escrito no prazo máximo de quinze dias, contados da data de protocolo da solicitação.",decreto; abril; informacoes; serao; prestadas; escrito; prazo; maximo; quinze; dias,True,689,172,035_decreto_4199_2002:8,035_decreto_4199_2002.csv,1,035_decreto_4199_2002:1
9,9,Codigo_Eleitoral_2026_anotado.pdf,decreto_4199_2002,"Decreto n. 4.199, de 16 de abril de 2002",Decreto n. 4.199/2002,Legislação correlata,Legislação correlata,723,723,,artigo,Art. 4º,"Decreto n. 4.199, de 16 de abril de 2002",Art. 4º,,,,,Art. 4º As informações serão prestadas a teor de critérios estabelecidos pelo chefe da Casa Civil da Presidência da República.,,[],0,,,,"Documento: Codigo Eleitoral 2026 anotado Norma: Decreto n. 4.199, de 16 de abril de 2002 Nome popular/citação curta: Decreto n. 4.199/2002 Macrogrupo: Legislação correlata Grupo do sumário: Legislação correlata Dispositivo: Art. 4º Tipo: artigo Dispositivo pai: Decreto n. 4.199, de 16 de abril de 2002 ID do dispositivo pai: 035_decreto_4199_2002:1 Páginas: 723-723 Resumo: Art. 4º, subordinado a Decreto n. 4.199, de 16 de abril de 2002: As informações serão prestadas a teor de critérios estabelecidos pelo chefe da Casa Civil da Presidência da República. Art. 4º As informações serão prestadas a teor de critérios estabelecidos pelo chefe da Casa Civil da Presidência da República.","Art. 4º, subordinado a Decreto n. 4.199, de 16 de abril de 2002: As informações serão prestadas a teor de critérios estabelecidos pelo chefe da Casa Civil da Presidência da República.",decreto; abril; informacoes; serao; prestadas; teor; criterios; estabelecidos; chefe; casa,True,685,171,035_decreto_4199_2002:9,035_decreto_4199_2002.csv,1,035_decreto_4199_2002:1
10,10,Codigo_Eleitoral_2026_anotado.pdf,decreto_4199_2002,"Decreto n. 4.199, de 16 de abril de 2002",Decreto n. 4.199/2002,Legislação correlata,Legislação correlata,723,723,,paragrafo,"Art. 4º, §1º",Art. 4º,Art. 4º,§1º,,,,§ 1º Informações e dados estatísticos de domínio público constantes de estudos já finalizados poderão ser prestados a qualquer tempo.,,[],0,,,,"Documento: Codigo Eleitoral 2026 anotado Norma: Decreto n. 4.199, de 16 de abril de 2002 Nome popular/citação curta: Decreto n. 4.199/2002 Macrogrupo: Legislação correlata Grupo do sumário: Legislação correlata Dispositivo: Art. 4º, §1º Tipo: paragrafo Dispositivo pai: Art. 4º ID do dispositivo pai: 035_decreto_4199_2002:9 Páginas: 723-723 Resumo: Art. 4º, §1º, subordinado a Art. 4º: § 1º Informações e dados estatísticos de domínio público constantes de estudos já finalizados poderão ser prestados a qualquer tempo. § 1º Informações e dados estatísticos de domínio público constantes de estudos já finalizados poderão ser prestados a qualquer tempo.","Art. 4º, §1º, subordinado a Art. 4º: § 1º Informações e dados estatísticos de domínio público constantes de estudos já finalizados poderão ser prestados a qualquer tempo.",decreto; abril; informacoes; dados; estatisticos; dominio; publico; constantes; estudos; finalizados,True,654,164,035_decreto_4199_2002:10,035_decreto_4199_2002.csv,9,035_decreto_4199_2002:9
11,11,Codigo_Eleitoral_2026_anotado.pdf,decreto_4199_2002,"Decreto n. 4.199, de 16 de abril de 2002",Decreto n. 4.199/2002,Legislação correlata,Legislação correlata,723,723,,paragrafo,"Art. 4º, §2º",Art. 4º,Art. 4º,§2º,,,,"§ 2º Em nenhuma hipótese, serão prestadas informações relativas a segredo de Estado ou protegidas por sigilo bancário, fiscal ou de justiça.",,[],0,,,,"Documento: Codigo Eleitoral 2026 anotado Norma: Decreto n. 4.199, de 16 de abril de 2002 Nome popular/citação curta: Decreto n. 4.199/2002 Macrogrupo: Legislação correlata Grupo do sumário: Legislação correlata Dispositivo: Art. 4º, §2º Tipo: paragrafo Dispositivo pai: Art. 4º ID do dispositivo pai: 035_decreto_4199_2002:9 Páginas: 723-723 Resumo: Art. 4º, §2º, subordinado a Art. 4º: § 2º Em nenhuma hipótese, serão prestadas informações relativas a segredo de Estado ou protegidas por sigilo bancário, fiscal ou de justiça. § 2º Em nenhuma hipótese, serão prestadas informações relativas a segredo de Estado ou protegidas por sigilo bancário, fiscal ou de justiça.","Art. 4º, §2º, subordinado a Art. 4º: § 2º Em nenhuma hipótese, serão prestadas informações relativas a segredo de Estado ou protegidas por sigilo bancário, fiscal ou de justiça.",decreto; abril; nenhuma; hipotese; serao; prestadas; informacoes; relativas; segredo; estado,True,668,167,035_decreto_4199_2002:11,035_decreto_4199_2002.csv,9,035_decreto_4199_2002:9
12,12,Codigo_Eleitoral_2026_anotado.pdf,decreto_4199_2002,"Decreto n. 4.199, de 16 de abril de 2002",Decreto n. 4.199/2002,Legislação correlata,Legislação correlata,723,723,,artigo,Art. 5º,"Decreto n. 4.199, de 16 de abril de 2002",Art. 5º,,,,,"Art. 5º Poderá ser constituído, no âmbito da Secretaria-Executiva da Casa Civil da Presidência da República, grupo de trabalho destinado à consecução do disposto neste decreto.",,[],0,,,,"Documento: Codigo Eleitoral 2026 anotado Norma: Decreto n. 4.199, de 16 de abril de 2002 Nome popular/citação curta: Decreto n. 4.199/2002 Macrogrupo: Legislação correlata Grupo do sumário: Legislação correlata Dispositivo: Art. 5º Tipo: artigo Dispositivo pai: Decreto n. 4.199, de 16 de abril de 2002 ID do dispositivo pai: 035_decreto_4199_2002:1 Páginas: 723-723 Resumo: Art. 5º, subordinado a Decreto n. 4.199, de 16 de abril de 2002: Poderá ser constituído, no âmbito da Secretaria-Executiva da Casa Civil da Presidência da República, grupo de trabalho destinado à consecução do disposto neste decreto. Art. 5º Poderá ser constituído, no âmbito da Secretaria-Executiva da Casa Civil da Presidência da República, grupo de trabalho destinado à consecução do disposto neste decreto.","Art. 5º, subordinado a Decreto n. 4.199, de 16 de abril de 2002: Poderá ser constituído, no âmbito da Secretaria-Executiva da Casa Civil da Presidência da República, grupo de trabalho destinado à consecução do disposto neste decreto.",decreto; abril; podera; constituido; ambito; secretaria; executiva; casa; civil; presidencia,True,785,196,035_decreto_4199_2002:12,035_decreto_4199_2002.csv,1,035_decreto_4199_2002:1
13,13,Codigo_Eleitoral_2026_anotado.pdf,decreto_4199_2002,"Decreto n. 4.199, de 16 de abril de 2002",Decreto n. 4.199/2002,Legislação correlata,Legislação correlata,723,723,,artigo,Art. 6º,"Decreto n. 4.199, de 16 de abril de 2002",Art. 6º,,,,,Art. 6º Quaisquer dúvidas no cumprimento deste decreto serão dirimidas pelo secretário-executivo da Casa Civil da Presidência da República.,,[],0,,,,"Documento: Codigo Eleitoral 2026 anotado Norma: Decreto n. 4.199, de 16 de abril de 2002 Nome popular/citação curta: Decreto n. 4.199/2002 Macrogrupo: Legislação correlata Grupo do sumário: Legislação correlata Dispositivo: Art. 6º Tipo: artigo Dispositivo pai: Decreto n. 4.199, de 16 de abril de 2002 ID do dispositivo pai: 035_decreto_4199_2002:1 Páginas: 723-723 Resumo: Art. 6º, subordinado a Decreto n. 4.199, de 16 de abril de 2002: Quaisquer dúvidas no cumprimento deste decreto serão dirimidas pelo secretário-executivo da Casa Civil da Presidência da República. Art. 6º Quaisquer dúvidas no cumprimento deste decreto serão dirimidas pelo secretário-executivo da Casa Civil da Presidência da República.","Art. 6º, subordinado a Decreto n. 4.199, de 16 de abril de 2002: Quaisquer dúvidas no cumprimento deste decreto serão dirimidas pelo secretário-executivo da Casa Civil da Presidência da República.",decreto; abril; quaisquer; duvidas; cumprimento; deste; serao; dirimidas; secretario; executivo,True,711,178,035_decreto_4199_2002:13,035_decreto_4199_2002.csv,1,035_decreto_4199_2002:1
14,14,Codigo_Eleitoral_2026_anotado.pdf,decreto_4199_2002,"Decreto n. 4.199, de 16 de abril de 2002",Decreto n. 4.199/2002,Legislação correlata,Legislação correlata,723,723,,artigo,Art. 7º,"Decreto n. 4.199, de 16 de abril de 2002",Art. 7º,,,,,Art. 7º Este decreto entra em vigor na data da sua publicação.,,[],0,,,,"Documento: Codigo Eleitoral 2026 anotado Norma: Decreto n. 4.199, de 16 de abril de 2002 Nome popular/citação curta: Decreto n. 4.199/2002 Macrogrupo: Legislação correlata Grupo do sumário: Legislação correlata Dispositivo: Art. 7º Tipo: artigo Dispositivo pai: Decreto n. 4.199, de 16 de abril de 2002 ID do dispositivo pai: 035_decreto_4199_2002:1 Páginas: 723-723 Resumo: Art. 7º, subordinado a Decreto n. 4.199, de 16 de abril de 2002: Este decreto entra em vigor na data da sua publicação. Art. 7º Este decreto entra em vigor na data da sua publicação.","Art. 7º, subordinado a Decreto n. 4.199, de 16 de abril de 2002: Este decreto entra em vigor na data da sua publicação.",decreto; abril; este; entra; vigor; data; publicacao,True,557,139,035_decreto_4199_2002:14,035_decreto_4199_2002.csv,1,035_decreto_4199_2002:1
