id,ordem_doc,arquivo_fonte,norma_id,norma_titulo,norma_nome_popular,macrogrupo,grupo_sumario,pagina_inicial,pagina_final,hierarquia_normativa,tipo_dispositivo,dispositivo,dispositivo_pai,artigo,paragrafo,inciso,alinea,item,texto_dispositivo,notas_texto,notas_json,qtd_notas,referencias_normativas,referencias_jurisprudenciais,referencias_sumulas,texto_rag,resumo_curto,palavras_chave,incluir_no_rag,chars,tokens_estimados,row_key,csv_arquivo,dispositivo_pai_id,dispositivo_pai_row_key
18,18,Codigo_Eleitoral_2026_anotado.pdf,decreto_lei_201_1967,"Decreto-Lei n. 201, de 27 de fevereiro de 1967",Decreto-Lei n. 201/1967,Legislação correlata,Legislação correlata,728,728,,inciso,"Art. 1º, XVI",Art. 1º,Art. 1º,,XVI,,,"XVI - deixar de ordenar a redução do montante da dívida consolidada, nos prazos estabelecidos em lei, quando o montante ultrapassar o valor resultante da aplicação do limite máximo fixado pelo Senado Federal;",,[],0,,,,"Documento: Codigo Eleitoral 2026 anotado Norma: Decreto-Lei n. 201, de 27 de fevereiro de 1967 Nome popular/citação curta: Decreto-Lei n. 201/1967 Macrogrupo: Legislação correlata Grupo do sumário: Legislação correlata Dispositivo: Art. 1º, XVI Tipo: inciso Dispositivo pai: Art. 1º ID do dispositivo pai: 037_decreto_lei_201_1967:2 Páginas: 728-728 Resumo: Art. 1º, XVI, subordinado a Art. 1º: deixar de ordenar a redução do montante da dívida consolidada, nos prazos estabelecidos em lei, quando o montante ultrapassar o valor resultante da aplicação do limite máximo fixado pelo Senado Federal; XVI - deixar de ordenar a redução do montante da dívida consolidada, nos prazos estabelecidos em lei, quando o montante ultrapassar o valor resultante da aplicação do limite máximo fixado pelo Senado Federal;","Art. 1º, XVI, subordinado a Art. 1º: deixar de ordenar a redução do montante da dívida consolidada, nos prazos estabelecidos em lei, quando o montante ultrapassar o valor resultante da aplicação do limite máximo fixado pelo Senado Federal;",montante; decreto; fevereiro; deixar; ordenar; reducao; divida; consolidada; prazos; estabelecidos,True,806,202,037_decreto_lei_201_1967:18,037_decreto_lei_201_1967.csv,2,037_decreto_lei_201_1967:2
19,19,Codigo_Eleitoral_2026_anotado.pdf,decreto_lei_201_1967,"Decreto-Lei n. 201, de 27 de fevereiro de 1967",Decreto-Lei n. 201/1967,Legislação correlata,Legislação correlata,728,728,,inciso,"Art. 1º, XVII",Art. 1º,Art. 1º,,XVII,,,"XVII - ordenar ou autorizar a abertura de crédito em desacordo com os limites estabelecidos pelo Senado Federal, sem fundamento na lei orçamentária ou na de crédito adicional ou com inobservância de prescrição legal;",,[],0,,,,"Documento: Codigo Eleitoral 2026 anotado Norma: Decreto-Lei n. 201, de 27 de fevereiro de 1967 Nome popular/citação curta: Decreto-Lei n. 201/1967 Macrogrupo: Legislação correlata Grupo do sumário: Legislação correlata Dispositivo: Art. 1º, XVII Tipo: inciso Dispositivo pai: Art. 1º ID do dispositivo pai: 037_decreto_lei_201_1967:2 Páginas: 728-728 Resumo: Art. 1º, XVII, subordinado a Art. 1º: ordenar ou autorizar a abertura de crédito em desacordo com os limites estabelecidos pelo Senado Federal, sem fundamento na lei orçamentária ou na de crédito adicional ou com inobservância de prescrição legal; XVII - ordenar ou autorizar a abertura de crédito em desacordo com os limites estabelecidos pelo Senado Federal, sem fundamento na lei orçamentária ou na de crédito adicional ou com inobservância de prescrição legal;","Art. 1º, XVII, subordinado a Art. 1º: ordenar ou autorizar a abertura de crédito em desacordo com os limites estabelecidos pelo Senado Federal, sem fundamento na lei orçamentária ou na de crédito adicional ou com inobservância de prescrição legal;",xvii; credito; decreto; fevereiro; ordenar; autorizar; abertura; desacordo; limites; estabelecidos,True,823,206,037_decreto_lei_201_1967:19,037_decreto_lei_201_1967.csv,2,037_decreto_lei_201_1967:2
20,20,Codigo_Eleitoral_2026_anotado.pdf,decreto_lei_201_1967,"Decreto-Lei n. 201, de 27 de fevereiro de 1967",Decreto-Lei n. 201/1967,Legislação correlata,Legislação correlata,728,728,,inciso,"Art. 1º, XVIII",Art. 1º,Art. 1º,,XVIII,,,"XVIII - deixar de promover ou de ordenar, na forma da lei, o cancelamento, a amortização ou a constituição de reserva para anular os efeitos de operação de crédito realizada com inobservância de limite, condição ou montante estabelecido em lei;",,[],0,,,,"Documento: Codigo Eleitoral 2026 anotado Norma: Decreto-Lei n. 201, de 27 de fevereiro de 1967 Nome popular/citação curta: Decreto-Lei n. 201/1967 Macrogrupo: Legislação correlata Grupo do sumário: Legislação correlata Dispositivo: Art. 1º, XVIII Tipo: inciso Dispositivo pai: Art. 1º ID do dispositivo pai: 037_decreto_lei_201_1967:2 Páginas: 728-728 Resumo: Art. 1º, XVIII, subordinado a Art. 1º: deixar de promover ou de ordenar, na forma da lei, o cancelamento, a amortização ou a constituição de reserva para anular os efeitos de operação de crédito realizada com inobservância de limite, condição ou montante estabelecido em lei; XVIII - deixar de promover ou de ordenar, na forma da lei, o cancelamento, a amortização ou a constituição de reserva para anular os efeitos de operação de crédito realizada com inobservância de limite, condição ou montante estabelecido em lei;","Art. 1º, XVIII, subordinado a Art. 1º: deixar de promover ou de ordenar, na forma da lei, o cancelamento, a amortização ou a constituição de reserva para anular os efeitos de operação de crédito realizada com inobservância de limite, condição ou montante estabelecido em lei;",xviii; decreto; fevereiro; deixar; promover; ordenar; forma; cancelamento; amortizacao; constituicao,True,880,220,037_decreto_lei_201_1967:20,037_decreto_lei_201_1967.csv,2,037_decreto_lei_201_1967:2
21,21,Codigo_Eleitoral_2026_anotado.pdf,decreto_lei_201_1967,"Decreto-Lei n. 201, de 27 de fevereiro de 1967",Decreto-Lei n. 201/1967,Legislação correlata,Legislação correlata,728,728,,inciso,"Art. 1º, XIX",Art. 1º,Art. 1º,,XIX,,,"XIX - deixar de promover ou de ordenar a liquidação integral de operação de crédito por antecipação de receita orçamentária, inclusive os respectivos juros e demais encargos, até o encerramento do exercício financeiro;",,[],0,,,,"Documento: Codigo Eleitoral 2026 anotado Norma: Decreto-Lei n. 201, de 27 de fevereiro de 1967 Nome popular/citação curta: Decreto-Lei n. 201/1967 Macrogrupo: Legislação correlata Grupo do sumário: Legislação correlata Dispositivo: Art. 1º, XIX Tipo: inciso Dispositivo pai: Art. 1º ID do dispositivo pai: 037_decreto_lei_201_1967:2 Páginas: 728-728 Resumo: Art. 1º, XIX, subordinado a Art. 1º: deixar de promover ou de ordenar a liquidação integral de operação de crédito por antecipação de receita orçamentária, inclusive os respectivos juros e demais encargos, até o encerramento do exercício financeiro; XIX - deixar de promover ou de ordenar a liquidação integral de operação de crédito por antecipação de receita orçamentária, inclusive os respectivos juros e demais encargos, até o encerramento do exercício financeiro;","Art. 1º, XIX, subordinado a Art. 1º: deixar de promover ou de ordenar a liquidação integral de operação de crédito por antecipação de receita orçamentária, inclusive os respectivos juros e demais encargos, até o encerramento do exercício financeiro;",decreto; fevereiro; deixar; promover; ordenar; liquidacao; integral; operacao; credito; antecipacao,True,826,206,037_decreto_lei_201_1967:21,037_decreto_lei_201_1967.csv,2,037_decreto_lei_201_1967:2
22,22,Codigo_Eleitoral_2026_anotado.pdf,decreto_lei_201_1967,"Decreto-Lei n. 201, de 27 de fevereiro de 1967",Decreto-Lei n. 201/1967,Legislação correlata,Legislação correlata,728,728,,inciso,"Art. 1º, XX",Art. 1º,Art. 1º,,XX,,,"XX - ordenar ou autorizar, em desacordo com a lei, a realização de operação de crédito com qualquer um dos demais entes da Federação, inclusive suas entidades da administração indireta, ainda que na forma de novação, refinanciamento ou postergação de dívida contraída anteriormente;",,[],0,,,,"Documento: Codigo Eleitoral 2026 anotado Norma: Decreto-Lei n. 201, de 27 de fevereiro de 1967 Nome popular/citação curta: Decreto-Lei n. 201/1967 Macrogrupo: Legislação correlata Grupo do sumário: Legislação correlata Dispositivo: Art. 1º, XX Tipo: inciso Dispositivo pai: Art. 1º ID do dispositivo pai: 037_decreto_lei_201_1967:2 Páginas: 728-728 Resumo: Art. 1º, XX, subordinado a Art. 1º: ordenar ou autorizar, em desacordo com a lei, a realização de operação de crédito com qualquer um dos demais entes da Federação, inclusive suas entidades da administração indireta, ainda que na forma de novação, refinanciamento ou postergação de dívida contraída anteriormente; XX - ordenar ou autorizar, em desacordo com a lei, a realização de operação de crédito com qualquer um dos demais entes da Federação, inclusive suas entidades da administração indireta, ainda que na forma de novação, refinanciamento ou postergação de dívida contraída anteriormente;","Art. 1º, XX, subordinado a Art. 1º: ordenar ou autorizar, em desacordo com a lei, a realização de operação de crédito com qualquer um dos demais entes da Federação, inclusive suas entidades da administração indireta, ainda que na forma de novação, refinanciamento ou postergação de dívida contraída anteriormente;",decreto; fevereiro; ordenar; autorizar; desacordo; realizacao; operacao; credito; qualquer; demais,True,953,238,037_decreto_lei_201_1967:22,037_decreto_lei_201_1967.csv,2,037_decreto_lei_201_1967:2
23,23,Codigo_Eleitoral_2026_anotado.pdf,decreto_lei_201_1967,"Decreto-Lei n. 201, de 27 de fevereiro de 1967",Decreto-Lei n. 201/1967,Legislação correlata,Legislação correlata,728,728,,inciso,"Art. 1º, XXI",Art. 1º,Art. 1º,,XXI,,,XXI - captar recursos a título de antecipação de receita de tributo ou contribuição cujo fato gerador ainda não tenha ocorrido;,,[],0,,,,"Documento: Codigo Eleitoral 2026 anotado Norma: Decreto-Lei n. 201, de 27 de fevereiro de 1967 Nome popular/citação curta: Decreto-Lei n. 201/1967 Macrogrupo: Legislação correlata Grupo do sumário: Legislação correlata Dispositivo: Art. 1º, XXI Tipo: inciso Dispositivo pai: Art. 1º ID do dispositivo pai: 037_decreto_lei_201_1967:2 Páginas: 728-728 Resumo: Art. 1º, XXI, subordinado a Art. 1º: captar recursos a título de antecipação de receita de tributo ou contribuição cujo fato gerador ainda não tenha ocorrido; XXI - captar recursos a título de antecipação de receita de tributo ou contribuição cujo fato gerador ainda não tenha ocorrido;","Art. 1º, XXI, subordinado a Art. 1º: captar recursos a título de antecipação de receita de tributo ou contribuição cujo fato gerador ainda não tenha ocorrido;",decreto; fevereiro; captar; recursos; titulo; antecipacao; receita; tributo; contribuicao; cujo,True,644,161,037_decreto_lei_201_1967:23,037_decreto_lei_201_1967.csv,2,037_decreto_lei_201_1967:2
24,24,Codigo_Eleitoral_2026_anotado.pdf,decreto_lei_201_1967,"Decreto-Lei n. 201, de 27 de fevereiro de 1967",Decreto-Lei n. 201/1967,Legislação correlata,Legislação correlata,728,728,,inciso,"Art. 1º, XXII",Art. 1º,Art. 1º,,XXII,,,XXII - ordenar ou autorizar a destinação de recursos provenientes da emissão de títulos para finalidade diversa da prevista na lei que a autorizou;,,[],0,,,,"Documento: Codigo Eleitoral 2026 anotado Norma: Decreto-Lei n. 201, de 27 de fevereiro de 1967 Nome popular/citação curta: Decreto-Lei n. 201/1967 Macrogrupo: Legislação correlata Grupo do sumário: Legislação correlata Dispositivo: Art. 1º, XXII Tipo: inciso Dispositivo pai: Art. 1º ID do dispositivo pai: 037_decreto_lei_201_1967:2 Páginas: 728-728 Resumo: Art. 1º, XXII, subordinado a Art. 1º: ordenar ou autorizar a destinação de recursos provenientes da emissão de títulos para finalidade diversa da prevista na lei que a autorizou; XXII - ordenar ou autorizar a destinação de recursos provenientes da emissão de títulos para finalidade diversa da prevista na lei que a autorizou;","Art. 1º, XXII, subordinado a Art. 1º: ordenar ou autorizar a destinação de recursos provenientes da emissão de títulos para finalidade diversa da prevista na lei que a autorizou;",xxii; decreto; fevereiro; ordenar; autorizar; destinacao; recursos; provenientes; emissao; titulos,True,685,171,037_decreto_lei_201_1967:24,037_decreto_lei_201_1967.csv,2,037_decreto_lei_201_1967:2
25,25,Codigo_Eleitoral_2026_anotado.pdf,decreto_lei_201_1967,"Decreto-Lei n. 201, de 27 de fevereiro de 1967",Decreto-Lei n. 201/1967,Legislação correlata,Legislação correlata,728,728,,inciso,"Art. 1º, XXIII",Art. 1º,Art. 1º,,XXIII,,,XXIII - realizar ou receber transferência voluntária em desacordo com limite ou condição estabelecida em lei.,Incisos XVI a XXIII acrescidos pelo art. 4º da Lei n. 10.028/2000.,"[{""ordem"": 1, ""marcador"": ""quadrado"", ""texto"": ""Incisos XVI a XXIII acrescidos pelo art. 4º da Lei n. 10.028/2000."", ""pagina_inicial"": 728, ""pagina_final"": 728}]",1,Lei n. 10.028/2000,,,"Documento: Codigo Eleitoral 2026 anotado Norma: Decreto-Lei n. 201, de 27 de fevereiro de 1967 Nome popular/citação curta: Decreto-Lei n. 201/1967 Macrogrupo: Legislação correlata Grupo do sumário: Legislação correlata Dispositivo: Art. 1º, XXIII Tipo: inciso Dispositivo pai: Art. 1º ID do dispositivo pai: 037_decreto_lei_201_1967:2 Páginas: 728-728 Resumo: Art. 1º, XXIII, subordinado a Art. 1º: realizar ou receber transferência voluntária em desacordo com limite ou condição estabelecida em lei. | 1 nota(s) vinculada(s) XXIII - realizar ou receber transferência voluntária em desacordo com limite ou condição estabelecida em lei. Notas vinculadas: Incisos XVI a XXIII acrescidos pelo art. 4º da Lei n. 10.028/2000.","Art. 1º, XXIII, subordinado a Art. 1º: realizar ou receber transferência voluntária em desacordo com limite ou condição estabelecida em lei. | 1 nota(s) vinculada(s)",xxiii; decreto; fevereiro; realizar; receber; transferencia; voluntaria; desacordo; limite; condicao,True,720,180,037_decreto_lei_201_1967:25,037_decreto_lei_201_1967.csv,2,037_decreto_lei_201_1967:2
26,26,Codigo_Eleitoral_2026_anotado.pdf,decreto_lei_201_1967,"Decreto-Lei n. 201, de 27 de fevereiro de 1967",Decreto-Lei n. 201/1967,Legislação correlata,Legislação correlata,728,728,,paragrafo,"Art. 1º, §1º",Art. 1º,Art. 1º,§1º,,,,"§ 1º Os crimes definidos neste artigo são de ação pública, punidos os dos itens I e II, com a pena de reclusão, de dois a doze anos, e os demais, com a pena de detenção, de três meses a três anos.","V. nota ao § 2º deste artigo sobre o Ac.-TSE, de 16/4/2013, no REspe n. 20069.","[{""ordem"": 1, ""marcador"": ""quadrado"", ""texto"": ""V. nota ao § 2º deste artigo sobre o Ac.-TSE, de 16/4/2013, no REspe n. 20069."", ""pagina_inicial"": 728, ""pagina_final"": 728}]",1,,"Ac.-TSE, de 16/4/2013, no REspe n. 20069",,"Documento: Codigo Eleitoral 2026 anotado Norma: Decreto-Lei n. 201, de 27 de fevereiro de 1967 Nome popular/citação curta: Decreto-Lei n. 201/1967 Macrogrupo: Legislação correlata Grupo do sumário: Legislação correlata Dispositivo: Art. 1º, §1º Tipo: paragrafo Dispositivo pai: Art. 1º ID do dispositivo pai: 037_decreto_lei_201_1967:2 Páginas: 728-728 Resumo: Art. 1º, §1º, subordinado a Art. 1º: § 1º Os crimes definidos neste artigo são de ação pública, punidos os dos itens I e II, com a pena de reclusão, de dois a doze anos, e os demais, com a pena de detenção, de três meses a três anos. | 1 nota(s) vinculada(s); jurisprudência extraída das notas Referências jurisprudenciais: Ac.-TSE, de 16/4/2013, no REspe n. 20069 § 1º Os crimes definidos neste artigo são de ação pública, punidos os dos itens I e II, com a pena de reclusão, de dois a doze anos, e os demais, com a pena de detenção, de três meses a três anos. Notas vinculadas: V. nota ao § 2º deste artigo sobre o Ac.-TSE, de 16/4/2013, no REspe n. 20069.","Art. 1º, §1º, subordinado a Art. 1º: § 1º Os crimes definidos neste artigo são de ação pública, punidos os dos itens I e II, com a pena de reclusão, de dois a doze anos, e os demais, com a pena de detenção, de três meses a três anos. | 1 nota(s) vinculada(s); jurisprudência extraída das notas",artigo; pena; anos; tres; decreto; fevereiro; crimes; definidos; neste; acao,True,1019,255,037_decreto_lei_201_1967:26,037_decreto_lei_201_1967.csv,2,037_decreto_lei_201_1967:2
27,27,Codigo_Eleitoral_2026_anotado.pdf,decreto_lei_201_1967,"Decreto-Lei n. 201, de 27 de fevereiro de 1967",Decreto-Lei n. 201/1967,Legislação correlata,Legislação correlata,728,728,,paragrafo,"Art. 1º, §2º",Art. 1º,Art. 1º,§2º,,,,"§ 2º A condenação definitiva em qualquer dos crimes definidos neste artigo, acarreta a perda de cargo e a inabilitação, pelo prazo de cinco anos, para o exercício de cargo ou função pública, eletivo ou de nomeação, sem prejuízo da reparação civil do dano causado ao patrimônio público ou particular.","Ac.-TSE, de 16/4/2013, no REspe n. 20069: pena de inabilitaçãopara o exercício de cargo ou função pública é acessória à privativa de liberdade e não autônoma, pois a sua existência fica condicionada à condenação definitiva.","[{""ordem"": 1, ""marcador"": ""ticado"", ""texto"": ""Ac.-TSE, de 16/4/2013, no REspe n. 20069: pena de inabilitaçãopara o exercício de cargo ou função pública é acessória à privativa de liberdade e não autônoma, pois a sua existência fica condicionada à condenação definitiva."", ""pagina_inicial"": 728, ""pagina_final"": 728}]",1,,"Ac.-TSE, de 16/4/2013, no REspe n. 20069",,"Documento: Codigo Eleitoral 2026 anotado Norma: Decreto-Lei n. 201, de 27 de fevereiro de 1967 Nome popular/citação curta: Decreto-Lei n. 201/1967 Macrogrupo: Legislação correlata Grupo do sumário: Legislação correlata Dispositivo: Art. 1º, §2º Tipo: paragrafo Dispositivo pai: Art. 1º ID do dispositivo pai: 037_decreto_lei_201_1967:2 Páginas: 728-728 Resumo: Art. 1º, §2º, subordinado a Art. 1º: § 2º A condenação definitiva em qualquer dos crimes definidos neste artigo, acarreta a perda de cargo e a inabilitação, pelo prazo de cinco anos, para o exercício de cargo ou função pública, eletivo ou de nomeação, sem prejuízo da reparação civil do dano causado ao patrimônio público ou particular. | 1 nota(s) vinculada(s); jurisprudência extraída das notas Referências jurisprudenciais: Ac.-TSE, de 16/4/2013, no REspe n. 20069 § 2º A condenação definitiva em qualquer dos crimes definidos neste artigo, acarreta a perda de cargo e a inabilitação, pelo prazo de cinco anos, para o exercício de cargo ou função pública, eletivo ou de nomeação, sem prejuízo da reparação civil do dano causado ao patrimônio público ou particular. Notas vinculadas: Ac.-TSE, de 16/4/2013, no REspe n. 20069: pena de inabilitaçãopara o exercício de cargo ou função pública é acessória à privativa de liberdade e não autônoma, pois a sua existência fica condicionada à condenação definitiva.","Art. 1º, §2º, subordinado a Art. 1º: § 2º A condenação definitiva em qualquer dos crimes definidos neste artigo, acarreta a perda de cargo e a inabilitação, pelo prazo de cinco anos, para o exercício de cargo ou função pública, eletivo ou de nomeação, sem prejuízo da reparação civil do dano causado ao patrimônio público ou particular. | 1 nota(s) vinculada(s); jurisprudência extraída das notas",cargo; condenacao; definitiva; exercicio; funcao; publica; decreto; fevereiro; qualquer; crimes,True,1370,342,037_decreto_lei_201_1967:27,037_decreto_lei_201_1967.csv,2,037_decreto_lei_201_1967:2
28,28,Codigo_Eleitoral_2026_anotado.pdf,decreto_lei_201_1967,"Decreto-Lei n. 201, de 27 de fevereiro de 1967",Decreto-Lei n. 201/1967,Legislação correlata,Legislação correlata,728,728,,artigo,Art. 2º,"Decreto-Lei n. 201, de 27 de fevereiro de 1967",Art. 2º,,,,,"Art. 2º O processo dos crimes definidos no artigo anterior é o comum do juízo singular, estabelecido pelo Código de Processo Penal, com as seguintes modificações:",,[],0,,,,"Documento: Codigo Eleitoral 2026 anotado Norma: Decreto-Lei n. 201, de 27 de fevereiro de 1967 Nome popular/citação curta: Decreto-Lei n. 201/1967 Macrogrupo: Legislação correlata Grupo do sumário: Legislação correlata Dispositivo: Art. 2º Tipo: artigo Dispositivo pai: Decreto-Lei n. 201, de 27 de fevereiro de 1967 ID do dispositivo pai: 037_decreto_lei_201_1967:1 Páginas: 728-728 Resumo: Art. 2º, subordinado a Decreto-Lei n. 201, de 27 de fevereiro de 1967: O processo dos crimes definidos no artigo anterior é o comum do juízo singular, estabelecido pelo Código de Processo Penal, com as seguintes modificações: Art. 2º O processo dos crimes definidos no artigo anterior é o comum do juízo singular, estabelecido pelo Código de Processo Penal, com as seguintes modificações:","Art. 2º, subordinado a Decreto-Lei n. 201, de 27 de fevereiro de 1967: O processo dos crimes definidos no artigo anterior é o comum do juízo singular, estabelecido pelo Código de Processo Penal, com as seguintes modificações:",processo; decreto; fevereiro; crimes; definidos; artigo; anterior; comum; juizo; singular,True,780,195,037_decreto_lei_201_1967:28,037_decreto_lei_201_1967.csv,1,037_decreto_lei_201_1967:1
29,29,Codigo_Eleitoral_2026_anotado.pdf,decreto_lei_201_1967,"Decreto-Lei n. 201, de 27 de fevereiro de 1967",Decreto-Lei n. 201/1967,Legislação correlata,Legislação correlata,728,728,,inciso,"Art. 2º, I",Art. 2º,Art. 2º,,I,,,"I - antes de receber a denúncia, o juiz ordenará a notificação do acusado para apresentar defesa prévia, no prazo de cinco dias. Se o acusado não for encontrado para a notificação, ser-lhe-á nomeado defensor, a quem caberá apresentar a defesa, dentro no mesmo prazo;",,[],0,,,,"Documento: Codigo Eleitoral 2026 anotado Norma: Decreto-Lei n. 201, de 27 de fevereiro de 1967 Nome popular/citação curta: Decreto-Lei n. 201/1967 Macrogrupo: Legislação correlata Grupo do sumário: Legislação correlata Dispositivo: Art. 2º, I Tipo: inciso Dispositivo pai: Art. 2º ID do dispositivo pai: 037_decreto_lei_201_1967:28 Páginas: 728-728 Resumo: Art. 2º, I, subordinado a Art. 2º: antes de receber a denúncia, o juiz ordenará a notificação do acusado para apresentar defesa prévia, no prazo de cinco dias. I - antes de receber a denúncia, o juiz ordenará a notificação do acusado para apresentar defesa prévia, no prazo de cinco dias. Se o acusado não for encontrado para a notificação, ser-lhe-á nomeado defensor, a quem caberá apresentar a defesa, dentro no mesmo prazo;","Art. 2º, I, subordinado a Art. 2º: antes de receber a denúncia, o juiz ordenará a notificação do acusado para apresentar defesa prévia, no prazo de cinco dias.",notificacao; acusado; apresentar; defesa; prazo; decreto; fevereiro; antes; receber; denuncia,True,783,196,037_decreto_lei_201_1967:29,037_decreto_lei_201_1967.csv,28,037_decreto_lei_201_1967:28
30,30,Codigo_Eleitoral_2026_anotado.pdf,decreto_lei_201_1967,"Decreto-Lei n. 201, de 27 de fevereiro de 1967",Decreto-Lei n. 201/1967,Legislação correlata,Legislação correlata,728,729,,inciso,"Art. 2º, II",Art. 2º,Art. 2º,,II,,,"II - ao receber a denúncia, o juiz manifestar-se-á, obrigatória e motivadamente, sobre a prisão preventiva do acusado, nos casos dos itens I e II do artigo anterior, e sobre o seu afastamento do exercício do cargo durante a instrução criminal, em todos os casos;",,[],0,,,,"Documento: Codigo Eleitoral 2026 anotado Norma: Decreto-Lei n. 201, de 27 de fevereiro de 1967 Nome popular/citação curta: Decreto-Lei n. 201/1967 Macrogrupo: Legislação correlata Grupo do sumário: Legislação correlata Dispositivo: Art. 2º, II Tipo: inciso Dispositivo pai: Art. 2º ID do dispositivo pai: 037_decreto_lei_201_1967:28 Páginas: 728-729 Resumo: Art. 2º, II, subordinado a Art. 2º: ao receber a denúncia, o juiz manifestar-se-á, obrigatória e motivadamente, sobre a prisão preventiva do acusado, nos casos dos itens I e II do artigo anterior, e sobre o seu afastamento do exercício do cargo durante a instrução criminal, em todos os casos; II - ao receber a denúncia, o juiz manifestar-se-á, obrigatória e motivadamente, sobre a prisão preventiva do acusado, nos casos dos itens I e II do artigo anterior, e sobre o seu afastamento do exercício do cargo durante a instrução criminal, em todos os casos;","Art. 2º, II, subordinado a Art. 2º: ao receber a denúncia, o juiz manifestar-se-á, obrigatória e motivadamente, sobre a prisão preventiva do acusado, nos casos dos itens I e II do artigo anterior, e sobre o seu afastamento do exercício do cargo durante a instrução criminal, em todos os casos;",sobre; casos; decreto; fevereiro; receber; denuncia; juiz; manifestar; obrigatoria; motivadamente,True,914,228,037_decreto_lei_201_1967:30,037_decreto_lei_201_1967.csv,28,037_decreto_lei_201_1967:28
